id,created_at,text,user,favorite_count,retweet_count
789182226567077888,2016-10-20 19:11:19,"b'Was given a bandana by My Grandma\'s House - a suicide prevention effort. It reads ""be a fireweed even after a fire\xe2\x80\xa6 https://t.co/dseejduR9B'",lisamurkowski,12,0
789138793379074048,2016-10-20 16:18:44,b'Thanks to @repdonyoung for hosting All Academies Night in Fbx! Deadline for military academy nomination is Dec.1:\xe2\x80\xa6 https://t.co/Tgo4Hw2kOo',lisamurkowski,6,0
788780133737988096,2016-10-19 16:33:33,b'.@SenDanSullivan &amp; I recently introduced Senate Resolution commemorating 50 years of Alaska Federation of Natives:\xe2\x80\xa6 https://t.co/684Yp8gxWJ',lisamurkowski,9,5
788604060802908160,2016-10-19 04:53:54,b'In Sitka at the parade for #AlaskaDay. https://t.co/aYxlfNhKl7',lisamurkowski,6,1
788517630239838208,2016-10-18 23:10:27,b'Happy #AlaskaDay. It\xe2\x80\x99s a joy to be celebrating this day in Sitka \xe2\x80\x93 where the official Alaska Day Festival is held! https://t.co/inaTqHdjjI',lisamurkowski,16,6
788445693178294272,2016-10-18 18:24:36,b'In Juneau-toured Wildflower Court Sr. assisted living home &amp; saw firsthand great care provided to our seniors. https://t.co/FpHitbPVJP',lisamurkowski,6,1
788173204917514240,2016-10-18 00:21:50,b'Wonderful to see young Alaskans doing great things to help out their community. https://t.co/ItqFwSAPPf',lisamurkowski,6,1
788170695197003776,2016-10-18 00:11:51,"b""At Alaska's Healing Hearts Warrior Western Day in the Mat-Su Valley, this serviceman showed just how fun four-wheel\xe2\x80\xa6 https://t.co/swcPcch57Y""",lisamurkowski,9,2
788079674794582016,2016-10-17 18:10:10,"b""I was proud to recently join with Anchorage's own Fil-Am community to celebrate Filipino American History Month! https://t.co/zWd4QuduON""",lisamurkowski,14,4
787443178315984897,2016-10-16 00:00:58,b'Always great to address Alaska\xe2\x80\x99s student leaders at the Alaska Association of Student Governments\xe2\x80\x99 Fall Conference! https://t.co/gbNn1Ojv27',lisamurkowski,86,46
787045340025348096,2016-10-14 21:40:06,b'Excellent news \xe2\x80\x93 my bill with @SenatorHeitkamp to improve the lives of Native children has been signed into law! https://t.co/Wr02whZEjJ',lisamurkowski,12,4
787006505807671296,2016-10-14 19:05:47,"b'Yesterday I visited LeeShore Center, the domestic violence and sexual assault facility serving the northern Kenai P\xe2\x80\xa6 https://t.co/JqfAFOqlg9'",lisamurkowski,10,1
786693856276381697,2016-10-13 22:23:26,b'RT @EnergyGOP: Glacier Bay National Park is undergoing a new planning process for parts of the park. Learn more/comment here: https://t.co/\xe2\x80\xa6',lisamurkowski,0,2
786684282110640128,2016-10-13 21:45:23,"b""Spoke at @AlaskaChamber Fall Forum in Kenai today to lay out what I'm doing on the federal level to build AK's econ\xe2\x80\xa6 https://t.co/3MaHmhNrBd""",lisamurkowski,4,0
786350538015199233,2016-10-12 23:39:12,b'Wonderful to speak w/ students studying U.S. History &amp; Civics @KodiakHS today about the responsibilities and challe\xe2\x80\xa6 https://t.co/rt6PEffOgc',lisamurkowski,17,4
786277114425249792,2016-10-12 18:47:27,"b'Spoke to Coalition on Housing &amp; Homelessness, updating them on work done in the Senate to reduce homelessness in AK\xe2\x80\xa6 https://t.co/zyw012fnpj'",lisamurkowski,6,1
785871056150138880,2016-10-11 15:53:55,b'Stopped by AVTEC in Seward this past weekend and learned to navigate through ice on their marine simulator. Amazing\xe2\x80\xa6 https://t.co/wNUIshAQ2k',lisamurkowski,11,0
785294540668186624,2016-10-10 01:43:03,"b'Great to meet w/ the hard-working men and women of UniSea, which produces some of the world\xe2\x80\x99s best sustainable seaf\xe2\x80\xa6 https://t.co/HW0lPtNhB5'",lisamurkowski,13,1
785215022746079232,2016-10-09 20:27:04,b'Spoke with some great Unlaskans at the Ballyhoo Lions Club luncheon this past week! https://t.co/QAkKFPrDCn',lisamurkowski,5,0
784848851588947968,2016-10-08 20:12:02,"b'While in Unalaska I stopped by Museum of the Aleutians\xe2\x80\x93a fantastic museum w/mission to collect, preserve, share the\xe2\x80\xa6 https://t.co/XHaeCSaIhP'",lisamurkowski,9,2
784803052582690816,2016-10-08 17:10:03,"b""On #NationalSalmonDay, I'm grateful for this bountiful natural resource that sustains Alaskans across the state. Wh\xe2\x80\xa6 https://t.co/RcUME4ONYr""",lisamurkowski,43,2
784485459279814656,2016-10-07 20:08:03,"b'Toured the Alaska pollock catching/processing vessel, the F/V Starbound \xe2\x80\x93 owned &amp; operated by Aleutian Spray Fisher\xe2\x80\xa6 https://t.co/tFY51odLKw'",lisamurkowski,10,9
784439548042473474,2016-10-07 17:05:37,"b'Navy responded to my concerns over Northern Edge exercise, expressing commitment to engage early &amp; often w/Alaskans: https://t.co/NKZnNonxpj'",lisamurkowski,2,1
784414496727109632,2016-10-07 15:26:04,"b'Excellent news\xe2\x80\x93Vivian Korthuis will lead Assoc. of Village Council Presidents, the first woman ever to do so. Truly\xe2\x80\xa6 https://t.co/XYNvbuMcaK'",lisamurkowski,7,2
784119761659650048,2016-10-06 19:54:54,"b""Pleased to say the BIA Tribal Providers Conference, an invaluable opportunity for AK's tribes, is back on schedule:\xe2\x80\xa6 https://t.co/Cx8jZ1fV0q""",lisamurkowski,2,0
784058673404534784,2016-10-06 15:52:09,"b'Visited w/ Dr. Ann Nora Ehret, Medical Director at the Iliuliuk Family and Health Services Clinic in Unalaska yeste\xe2\x80\xa6 https://t.co/LSj4968oe3'",lisamurkowski,2,0
783814169858629633,2016-10-05 23:40:35,b'Great to speak with students at Unalaska High School! https://t.co/W3BAuz0Bk0',lisamurkowski,4,2
783701873412993024,2016-10-05 16:14:21,b'Spoke at @WTCAlaska Arctic Ambitions Conference about commerce and investment in the #Arctic. https://t.co/Ajdgrynfil',lisamurkowski,6,1
783394182299783168,2016-10-04 19:51:42,b'I look forward to keeping all of the federal permitting agencies aligned &amp; on time so Caelus can move from exploration to development (2/2)',lisamurkowski,9,2
783394161110188033,2016-10-04 19:51:37,b'Caelus\xe2\x80\x99 Smith Bay discovery is exactly what our state and nation need to keep TAPS viable (1/2) https://t.co/OOvNoF9E84',lisamurkowski,12,7
783330860556775425,2016-10-04 15:40:05,b'My bill w/ @SenatorHeitkamp addressing challenges facing Native youth is headed to President to be signed into law:\xe2\x80\xa6 https://t.co/C8lxbtmQ7V',lisamurkowski,6,0
782997987064774658,2016-10-03 17:37:22,"b""(2/2) Since helping found BCDC in 70's, I\xe2\x80\x99m proud of all my mom has done to raise support for early detection &amp; scr\xe2\x80\xa6 https://t.co/S0iRhUFOrZ""",lisamurkowski,10,3
782997779106922501,2016-10-03 17:36:32,b'(1/2) Wonderful event in Fairbanks celebrating 40th anniversary of Breast Cancer Detection Center (BCDC). https://t.co/hvC6D9vwlv',lisamurkowski,18,3
782277464949190656,2016-10-01 17:54:16,"b""At Mat-Su Valley Cancer Center opening, we wrote notes of hope to serve as a reminder that patients aren't alone. https://t.co/EXMl0hcezD""",lisamurkowski,20,3
782276060696150019,2016-10-01 17:48:41,b'Mat-Su Valley Cancer Center - state of the art facility will give Alaskans a chance to receive care closer to home. https://t.co/eE700JYVAJ',lisamurkowski,10,1
781911874346639360,2016-09-30 17:41:32,b'Happy to see so many Alaskans show their support for the @ChildsLunchbox to combat childhood hunger across our stat\xe2\x80\xa6 https://t.co/aN7kTAHOd1',lisamurkowski,8,1
781882103046758400,2016-09-30 15:43:14,"b""RT @EnergyGOP: ICYMI: Article from @alaskajournal re: Sen. @lisamurkowski's work on #Alaska Mental Health Trust land transfer https://t.co/\xe2\x80\xa6""",lisamurkowski,0,5
781529339020111872,2016-09-29 16:21:29,"b'Congrats to the 3 Alaska schools recognized as National Blue Ribbon Schools \xe2\x80\x93 Academy Charter, Bayshore Elementary, &amp; Orion Elementary!'",lisamurkowski,5,2
781242582684819456,2016-09-28 21:22:01,"b'RT @AlaskaMiners: Congratulations to the operators of Jubilee Mine, Prospect Creek, Alaska, for the BLM Small Operator Reclamation Award! #\xe2\x80\xa6'",lisamurkowski,0,6
781189802834202624,2016-09-28 17:52:17,b'Senate just voted overwhelmingly to override @POTUS veto of #JASTA - Justice Against Sponsors of Terrorism Act. My\xe2\x80\xa6 https://t.co/o7aiZQxG2F',lisamurkowski,6,4
781162949234814976,2016-09-28 16:05:35,b'I love seeing Alaskans in our nation\xe2\x80\x99s capital! Yesterday I chatted w/ a group of young Alaskans in DC for the Nati\xe2\x80\xa6 https://t.co/1v4iAgB0hD',lisamurkowski,31,0
780884152577036288,2016-09-27 21:37:44,"b""Alaskans know that winter is on its way! Today's AK Snow Symposium brought together those who keep roads safe/acces\xe2\x80\xa6 https://t.co/ZAJIbKR2nh""",lisamurkowski,12,6
780822302124609537,2016-09-27 17:31:58,b'Bill I co-sponsored to empower Native communities and boost tourism in Alaska has been signed into law: https://t.co/kTFjsPc6yn.',lisamurkowski,6,0
780813989194371072,2016-09-27 16:58:56,b'Fabulous to see Martin Sensmeier of Yakutat \xe2\x80\x93 star in \xe2\x80\x9cThe Magnificent Seven\xe2\x80\x9d \xe2\x80\x93  here in DC to meet w/Native youth. https://t.co/N2qej9yM3b',lisamurkowski,23,6
780504152749305856,2016-09-26 20:27:45,b'Great opportunity for tribal members to gather w/ common goal of improving lives of AK Natives &amp; American Indians. https://t.co/eWwMgIAnp6',lisamurkowski,5,1
780503814428295170,2016-09-26 20:26:25,b'Great to see so many Alaskans at WH #TribalNations Conference \xe2\x80\x93 bringing together tribal leaders nationwide. https://t.co/NKFZ1akFCy',lisamurkowski,11,5
780142604365299714,2016-09-25 20:31:05,b'Yoga on the National Mall this morning! https://t.co/RyrjcBxcAG',lisamurkowski,9,2
779106776469868544,2016-09-22 23:55:05,b'Thoughts and prayers for the APD officers injured today in the line of duty and for those still in harms way. https://t.co/Ii4rb0qnQr',lisamurkowski,7,3
779047970834710532,2016-09-22 20:01:24,b'Today Alaska welcomed its 1 millionth cruise ship passenger to the state this year. A great sign for Alaska\xe2\x80\x99s touri\xe2\x80\xa6 https://t.co/cyTyBMZZQY',lisamurkowski,11,5
779008049331724289,2016-09-22 17:22:46,"b'This measure ensures that Alaska is not just a resource-rich state, but also a resource-producing state: https://t.co/a27cMKoD4B. (3/3)'",lisamurkowski,4,3
779007703184240640,2016-09-22 17:21:24,"b'Bill facilitates responsible oil, gas, mineral &amp; timber production in AK, increasing economic growth &amp; creating thousands of new jobs. (2/3)'",lisamurkowski,4,3
779007615829413888,2016-09-22 17:21:03,"b""Today @EnergyGOP considered economic development bill I intro'd that comes at a vital time as Alaska grapples with\xe2\x80\xa6 https://t.co/JU9A3pRn1G""",lisamurkowski,13,8
778706481000488960,2016-09-21 21:24:27,"b'Great to meet Angels in Adoption Pat &amp; Clarissa Kougl of North Pole, who have opened their home &amp; hearts to children https://t.co/xe5OzER2PH'",lisamurkowski,8,2
778624879276982272,2016-09-21 16:00:12,"b'Impressed w/ UAA\xe2\x80\x99s Dr. Amstislavski, who created an environmentally-friendly &amp; cost-effective thermal insulation. https://t.co/Gj5ruLaSBq'",lisamurkowski,19,2
778612381354172420,2016-09-21 15:10:32,"b""RT @EnergyGOP: Great article on how the #energy bill could help bolster U.S. innovation by @powellrich &amp; @Energy21's Chris Guith https://t.\xe2\x80\xa6""",lisamurkowski,0,4
778333328961314816,2016-09-20 20:41:41,"b'Recently contacted @USNavy, requesting engagement w/ AK communities concerned over Northern Edge military exercise: https://t.co/uOcXR8Wu6o.'",lisamurkowski,3,1
778298344770768897,2016-09-20 18:22:40,"b'Here\xe2\x80\x99s to many more years of peace, investment, and discovery in the Arctic through the vital work of the Arctic Co\xe2\x80\xa6 https://t.co/aPT73Efc28'",lisamurkowski,5,6
777635960183984128,2016-09-18 22:30:35,b'Happy B-Day @usairforce -keeping America safe for 69 yrs. Thanks to all the airmen &amp; women serving in Alaska!#AFBDAY https://t.co/gzPKGScs71',lisamurkowski,8,1
777551550877237248,2016-09-18 16:55:10,b'First stop in Kodiak today. Amazing! https://t.co/pklciLaLlD',lisamurkowski,11,4
777548007789199360,2016-09-18 16:41:05,b'Congrats Shirley Reilly for all your success in Paralympic Games! You are an inspiration. https://t.co/zqWkT8JoW8 https://t.co/xeHxvvibNu',lisamurkowski,29,4
776850829739458561,2016-09-16 18:30:45,"b'Happy #ConstitutionDay! Today we celebrate the 7,591 words that have kept our country together for centuries. https://t.co/FQKlEXFDIV'",lisamurkowski,37,16
776526956905033728,2016-09-15 21:03:48,b'The Senate passed legislation with a huge impact on water resource development in small communities across AK: https://t.co/sNgLJ2QlMO',lisamurkowski,5,1
776481851074605056,2016-09-15 18:04:34,b'RT @AlaskaJournal: Senate &amp; House conference for S 2012 - the first energy reform bill in a decade.  https://t.co/3WzV7LiwAc https://t.co/M\xe2\x80\xa6',lisamurkowski,0,3
776468049281114112,2016-09-15 17:09:43,b'I had a great time w/ Sen. @MartinHeinrich at the Congressional Sportsmen\xe2\x80\x99s Foundation banquet last night. https://t.co/IKTQHw3ijH',lisamurkowski,17,3
776168291673006080,2016-09-14 21:18:35,b'RT @EnergyGOP: Sen. @lisamurkowski: 51 medevacs and counting from King Cove #Alaska https://t.co/P0gW7VPix5',lisamurkowski,0,4
776159355779555329,2016-09-14 20:43:05,b'Proud to intro bill w/ @SenDanSullivan &amp; @DonYoung to once again give Alaskans a choice in healthcare coverage: https://t.co/l2hwzs4fC5',lisamurkowski,0,0
776149584548622336,2016-09-14 20:04:15,b'Couldn\xe2\x80\x99t agree more! https://t.co/weuqEQzwBF',lisamurkowski,11,8
776126693631287296,2016-09-14 18:33:18,b'RT @EnergyGOP: Sen. @lisamurkowski: @NatlParkService decision is a victory for small business in #Alaska https://t.co/4Svx3fFa9Y #Denali @D\xe2\x80\xa6',lisamurkowski,0,2
776113389735178240,2016-09-14 17:40:26,"b'Great to meet with Alaska\xe2\x80\x99s Secondary Principal of the Year, Shaun Kraska of Fairbanks! https://t.co/gvUYaUYNWo'",lisamurkowski,18,3
776088894332821504,2016-09-14 16:03:06,"b""I told my Senate colleagues it's past time we build a road &amp; help the people of King Cove #StandWithKingCove https://t.co/XBO4LkqUtn""",lisamurkowski,23,12
775801681879638016,2016-09-13 21:01:49,b'Great overview about how my energy bill promotes renewable energy resources in Alaska. https://t.co/OQ9HEDBwQB',lisamurkowski,6,8
775399974414712832,2016-09-12 18:25:34,b'Had a blast at @SpecialOlymAK tourney this wknd. Great to see the hard work put in by the org. &amp; athletes pay off. https://t.co/TvTfR8lhK3',lisamurkowski,11,3
775022939016204292,2016-09-11 17:27:22,"b'And we honor all who have and continue to make tremendous sacrifices to keep us safe, at home &amp; abroad. #NeverForget https://t.co/An9NWKrLIx'",lisamurkowski,5,3
775022768635142144,2016-09-11 17:26:41,"b'Today, we pay tribute to the courage, bravery, &amp; heroism shown by our first responders. https://t.co/An9NWKrLIx #NeverForget'",lisamurkowski,3,1
775022488782827520,2016-09-11 17:25:35,"b'Today, we remember those who lost their lives in these terrible attacks. #NeverForget https://t.co/An9NWKrLIx https://t.co/Ju8NsEmXgA'",lisamurkowski,8,4
774354102784520193,2016-09-09 21:09:39,b'#FlashbackFriday to last weekend duck hunting in #Alaska with Verne. https://t.co/s1KcyoVqiJ',lisamurkowski,12,0
774322700718317568,2016-09-09 19:04:52,"b""AK Delegation &amp; I wrote to @JohnKerry @StateDept's lack of ensuring Canada protects transboundary waterways in AK.  https://t.co/NKKOQehtP2""",lisamurkowski,0,0
774012086447923200,2016-09-08 22:30:36,b'Proud to stand with Alaskans and @FoodBankofAK to raise awareness of the impact of hunger. #HungerActionMonth https://t.co/Bj5ckxELQl',lisamurkowski,27,7
773942543809712129,2016-09-08 17:54:16,"b'In #energy conference mtg, I reminded my colleagues our task: to develop a final bill that can be signed into law. https://t.co/lj2KHjGb6e'",lisamurkowski,16,6
773927672120537089,2016-09-08 16:55:10,b'This morning I held the first official conference meeting for my bipartisan energy bill. #Energy #EnergyisGood https://t.co/MpgcNIeNBJ',lisamurkowski,25,16
773873291626844164,2016-09-08 13:19:05,b'RT @EnergyGOP: At 9:30AM: Meeting of Senate and House Conferees on Energy Policy Modernization Act of 2016. Watch live here: https://t.co/g\xe2\x80\xa6',lisamurkowski,0,3
773566939662802944,2016-09-07 17:01:45,b'Congrats to Romig Middle School teacher Catherine Walker for winning Presidential Award for Math &amp; Science Teaching. https://t.co/5x52jg0KNV',lisamurkowski,22,8
772102595292696577,2016-09-03 16:02:58,"b""Couldn't be a more beautiful day for flying in the Interior. #Alaska https://t.co/CQjXRNCoIf""",lisamurkowski,32,9
771871953049092096,2016-09-03 00:46:28,b'Headed off to hunting camp. Off the grid! #Alaska https://t.co/ovqj35J6UF',lisamurkowski,13,1
771479584290250752,2016-09-01 22:47:20,"b""I am praying for the families, friends, and the communities who have lost their loved ones in yesterday's crash. https://t.co/L2qWfsK4yn""",lisamurkowski,7,0
770814645242253312,2016-08-31 02:45:07,"b""Thanks AT&amp;T for $750K grant to @UnitedWay @covenanthouseak &amp; ASD to help raise Alaska's high-school graduation rate. https://t.co/XzL5uIQ0E7""",lisamurkowski,18,7
770748118866403328,2016-08-30 22:20:46,b'Congrats to Susan Carney for being sworn into the Alaska Supreme Court- 3rd woman to sit on the court. https://t.co/61Nwhnnaxt',lisamurkowski,24,5
770722594941181952,2016-08-30 20:39:20,"b'Great to see Homer\xe2\x80\x99s newest ambulance. Thanks to Code Blue program, the community is getting an EMS boost. #Homer https://t.co/yFhFeXe08K'",lisamurkowski,10,1
770456079390035969,2016-08-30 03:00:18,b'Grand opening of first Krispy Kreme in Alaska is at 5am tomorrow. 80 new jobs with the opening @KrispyKremeANC. https://t.co/plPCPTLoCA',lisamurkowski,45,23
770451168602435584,2016-08-30 02:40:47,b'First In line waiting for the first Krispy Kreme in Alaska to open @KrispyKremeANC https://t.co/bNJweBV7Mw',lisamurkowski,19,4
770429447623286786,2016-08-30 01:14:28,b'Great news for #Alaska as @usdaRD announced $810K+ grants &amp; loans to improve the health &amp; safety of our communities. https://t.co/lzeSTt8iKv',lisamurkowski,4,6
770318201464860672,2016-08-29 17:52:25,b'It was great to see so many Alaskans out at the Kenai Peninsula Food Bank Soup Supper this weekend. https://t.co/Kadhm957C4',lisamurkowski,11,1
770157213708980224,2016-08-29 07:12:43,b'Flying from Fairbanks to Anchorage tonight. Denali is pretty spectacular in the evening sunset. #nofilter https://t.co/gHBeYjXEL0',lisamurkowski,64,12
770055853818994689,2016-08-29 00:29:57,b'Happy 64th wedding anniversary to my mom and dad. Fabulous parents! https://t.co/NK3R2ZPJU6',lisamurkowski,35,1
770008890763251712,2016-08-28 21:23:20,b'Saddened to hear of the passing of Maj. Gen. John Schaeffer. A lifelong servicemen who will truly be missed. https://t.co/ETe76ngm0d',lisamurkowski,15,3
769345739759681536,2016-08-27 01:28:12,b'Happy #NationalDogDay! Family dogs have brought so much love to our family over the years. https://t.co/aINrkGe36m',lisamurkowski,23,4
769330693625286656,2016-08-27 00:28:25,b'Former intern sightings at the @AlaskaStateFair -- Annie and Tavish. https://t.co/IL47eHAwbm',lisamurkowski,12,2
769284479378681856,2016-08-26 21:24:47,b'Great to see @usdafsa Administrator Val Dolcini visit AK and make it to the  Matsu Alaska Legislation Farm Tour. https://t.co/3Shv4HLbh4',lisamurkowski,5,0
768971203524505600,2016-08-26 00:39:56,b'Happy 100th Birthday @NatlParkService! https://t.co/4igyTKNUnH',lisamurkowski,9,3
768946915341762560,2016-08-25 23:03:25,"b""RT @alaskanewsnow: As the National Park Service turns 100, take a tour of Alaska's park gems https://t.co/5ES45Owrd9 #alaska https://t.co/t\xe2\x80\xa6""",lisamurkowski,0,16
768941661950926848,2016-08-25 22:42:33,b'Happy 100th anniversary @NatlParkService. I hope Alaskans take advantage of our 54 million acres of parks! #NPS100 https://t.co/mmPDwIGZuG',lisamurkowski,31,7
768574724435742724,2016-08-24 22:24:28,b'Happy to see beloved Mayor Stubbs received the Congressional Record celebrating Talkeetna\xe2\x80\x99s Centennial. https://t.co/gcZ05sd2nY',lisamurkowski,55,30
767880992954646529,2016-08-23 00:27:49,b'Congrats @AlaskaAir on breaking ground on aircraft &amp; maintenance facility that will provide jobs &amp; support Alaska. https://t.co/w0EW2IjbIy',lisamurkowski,24,3
767822376730001408,2016-08-22 20:34:54,"b'Happy 29th Anniversary to my husband Verne! Thank you for so many wonderful years together, and many more to come. https://t.co/yXVlmEPi09'",lisamurkowski,52,4
766693268998463489,2016-08-19 17:48:14,b'Happy #NationalAviationDay! Aviation plays a big role in Alaska as pilots are the lifeline to 80%+ AK communities. https://t.co/Um8pj5Q4hP',lisamurkowski,24,6
766438980451794950,2016-08-19 00:57:47,b'#TBT to when my boys were much smaller. https://t.co/sOqNjExbv6',lisamurkowski,3,1
766416346884272128,2016-08-18 23:27:51,b'Congrats Julie Wild-Curry for receiving Champion for Kids award. Well-deserved recognition! https://t.co/Fxh8onwnvb https://t.co/30R2fDYwwA',lisamurkowski,7,2
765607149883961344,2016-08-16 17:52:23,"b""It's been great to have my eldest son Nic home for the summer before he returns to law school in Oregon! https://t.co/E968rI37fy""",lisamurkowski,38,2
764259222007664640,2016-08-13 00:36:12,b'Congratulations to the 49 people from 22 different countries who became naturalized citizens today in Anchorage. https://t.co/tbJ3RxR3LN',lisamurkowski,72,13
764159500731441156,2016-08-12 17:59:57,b'Always great to meet w/ @admzukunft of @USCG to discuss CG assets coming to Alaska &amp; efforts to keep fishermen safe https://t.co/kVYRoBXLhc',lisamurkowski,16,4
763890316395089924,2016-08-12 00:10:18,b'Honored to speak @TananaChiefs Conf. about tribal courts progress &amp; how we must continue working together. https://t.co/taQUCLaKk4',lisamurkowski,20,6
763854481809440770,2016-08-11 21:47:54,b'The Coast Guard Foundation\xe2\x80\x99s Gala last night was a wonderful evening honoring our men &amp; women in @USCG. https://t.co/CI8qCwdQ43',lisamurkowski,14,2
763523981395845120,2016-08-10 23:54:37,b'Way to go Alev Kelter for ending your #Rio2016 debut as U.S. leading scorer. Proud of you! https://t.co/pzLxqzdt9p https://t.co/fU2hQIDU7p',lisamurkowski,11,3
763480414149193728,2016-08-10 21:01:30,b'Happy Alaska Wild Salmon Day! I hope the fish are biting &amp; everyone has a chance to eat wild salmon! #AskForAlaska https://t.co/KMMfz2hsee',lisamurkowski,80,23
763408968370622464,2016-08-10 16:17:36,b'RT @EnergyGOP: Sen. @lisamurkowski urges fair protest period for mammoth #BLM Land Plan https://t.co/3Q4X8mIf2Y #publiclands',lisamurkowski,0,4
763147999006625792,2016-08-09 23:00:36,"b'Congrats Yakutat on your new community playground, thanks to generosity of @rasmuson &amp; hard-working volunteers. https://t.co/HhysCp4MIB'",lisamurkowski,21,4
760524818190110720,2016-08-02 17:17:01,b'An honor to be @cwnorth event as my dad Gov.Frank Murkowski &amp; Gov.Knowles were presented w/ Walter J. Hickel Award. https://t.co/rY6e21RvtF',lisamurkowski,13,4
760170640049639424,2016-08-01 17:49:38,"b'I am very saddened to hear of the passing of Ursula Paniyak Irvin, who always had the most beautiful dolls at AFN. https://t.co/UlxQnMZqZg'",lisamurkowski,17,10
758727801906143234,2016-07-28 18:16:19,b'Just another day in paradise. Captured this photo flying to Ketchikan #Alaska. https://t.co/veORV1Ik4X',lisamurkowski,62,18
758435446548561920,2016-07-27 22:54:36,b'RT @tvpeebles: Want to thank/meet those who helped fight McHugh Fire? Visit Golden View Middle School tonight @6-8 details on #ktuu https:/\xe2\x80\xa6',lisamurkowski,0,4
758426691211591681,2016-07-27 22:19:48,"b'I\xe2\x80\x99ve been a consistent champion for responsible energy development in NPR-A, &amp; I\xe2\x80\x99m pleased BLM is taking this step. https://t.co/BrFQC3iT2f'",lisamurkowski,6,1
758362608592363520,2016-07-27 18:05:10,b'Thanks to @USCG &amp; quick actions of good samaritans all 46 fisherman were  rescued from sinking vessel in Bering Sea. https://t.co/JtiOLnG5w4',lisamurkowski,7,4
758102129722687488,2016-07-27 00:50:07,"b""Best of luck to Colette Nelson! You've already made us proud. https://t.co/B0rnWyJOBY""",lisamurkowski,3,3
758029288981528576,2016-07-26 20:00:40,b'Honored to receive the Spirit of Enterprise Award from the @USChamber! https://t.co/tAllzXQwEQ',lisamurkowski,13,5
758000460821389312,2016-07-26 18:06:07,b'Wonderful to be back in #Alaska with my friends and colleagues @repdonyoung and @SenDanSullivan! https://t.co/mrR2VLPrn2',lisamurkowski,7,4
757318770159267840,2016-07-24 20:57:19,"b'I know I\'m in AK b/c I take my work home in this ""homepack"" \xe2\x80\x93 given to me by an 8th grader in Houston, AK years ago! https://t.co/ZG5yMEYgNo'",lisamurkowski,27,0
756937918019571718,2016-07-23 19:43:57,"b'Happy #TedStevensDay, Alaska! Get outside &amp; enjoy the great outdoors this weekend -- just like Uncle Ted would want. https://t.co/cg53xKSOHI'",lisamurkowski,55,19
756612129881415680,2016-07-22 22:09:23,b'Met w/ Mayor Bill Alstrom &amp; Super. Dave Herbert @ Andreafski HS in St. Mary\xe2\x80\x99s re: challenges facing rural schools. https://t.co/6EJ2tRH3QP',lisamurkowski,6,1
756589474486837249,2016-07-22 20:39:22,b'Leaving Mountain Village by skiff earlier this week! https://t.co/U3VV2o0onu',lisamurkowski,8,3
756558525581627392,2016-07-22 18:36:23,"b'Visited Nunam Iqua, Alakanuk, Emmonak, Mountain Village, Nunapitchuk &amp; Scammon Bay on Y-K Delta. Lots of fish camps! https://t.co/iG5Y9O3fbq'",lisamurkowski,23,5
