id,created_at,text,user,favorite_count,retweet_count
636633476117176320,2015-08-26 20:17:03,"b'Today is the 95th anniv of the #19thAmendment, which gave all women in the US the right to vote. http://t.co/Yr03GEpp6C'",SenatorEnzi,10,11
636622749046337536,2015-08-26 19:34:25,b'They make &amp; distribute generators for oil and gas industry that run on natural gas which would have been wasted.(2/2) http://t.co/Go357x54gM',SenatorEnzi,2,1
636622585996967940,2015-08-26 19:33:47,b'It was a pleasure to tour Mesa Natural Gas Solutions and Moser Energy Solutions in Casper this week. (1/2) http://t.co/Vu01jDoeHV',SenatorEnzi,2,1
636295008132313088,2015-08-25 21:52:06,"b'If we are serious about a #BalancedBudget, real substantive budget reforms &amp; savings must be on the table. http://t.co/kkFIUJAFHI'",SenatorEnzi,3,6
636291680891719680,2015-08-25 21:38:53,"b"".@USCBO released report showing positive impact of #BudgetCaps, but this isn't an excuse to continue to overspend. http://t.co/kkFIUJSh6i""",SenatorEnzi,2,2
635917554251341825,2015-08-24 20:52:14,b'TW: Show your support for a #Wyo woman on #thenew10. http://t.co/3sW0TRqLVA',SenatorEnzi,5,5
634832150324477952,2015-08-21 20:59:13,"b'We talked about not only oil, but the challenges other Wyoming energy industries face. (2/2) http://t.co/cUE6Y3t857'",SenatorEnzi,3,1
634832031369809920,2015-08-21 20:58:45,b'Speaking w/ Cap &amp; Linda Bell at Big Horn Basin Chapter of Petroleum Engineers luncheon in Cody yesterday. (1/2) http://t.co/PAiNCT6d8s',SenatorEnzi,1,0
634388692627419136,2015-08-20 15:37:05,b'Check out my new story on #Medium about the #SBDC 35th anniversary and all they do to help #smallbusiness. http://t.co/eW8uIJduHx',SenatorEnzi,6,2
634378866518167552,2015-08-20 14:58:02,b'#SBDC was established 35 years ago to help #smallbusiness owners navigate the challenges they face. http://t.co/eW8uIJduHx',SenatorEnzi,0,2
633353359450206208,2015-08-17 19:03:02,b'Cosponsored a bill allowing #military spouses to purchase handguns where their partner is stationed. #2ndAmendment  http://t.co/jeBWYX45Po',SenatorEnzi,1,1
633345481020731396,2015-08-17 18:31:44,b'Sent letter against plan by the fed govt to prevent certain seniors from being able to purchase guns. #2ndAmendment  http://t.co/jeBWYWMuXQ',SenatorEnzi,1,2
632297395011850240,2015-08-14 21:07:01,b'Joined legislation to make #CFPB accountable to people by bringing it under the congressional appropriations process. http://t.co/QalKAn5Ewq',SenatorEnzi,1,2
632249850071875584,2015-08-14 17:58:05,b'Great experience fishing on Bear River recently where I completed my #Wyo #CuttSlam. http://t.co/2IxYMmjsbt http://t.co/J5E9YXuv4z',SenatorEnzi,4,2
632244770555973632,2015-08-14 17:37:54,b'Caught all 4 types of cut throat in #Wyo to complete #CuttSlam. Challenge all you to try too. http://t.co/2IxYMm1RjV http://t.co/neW5yM066N',SenatorEnzi,8,5
629726219995492352,2015-08-07 18:50:05,b'We need a focused discussion to find a fiscally responsible solution to wildfire funding/fire suppression. http://t.co/pJQjv7lWn2',SenatorEnzi,5,4
629718073029824512,2015-08-07 18:17:42,b'Need to work together to find solution to address budget concerns surrounding wildfire funding &amp; fire suppression. http://t.co/pJQjv7DxLC',SenatorEnzi,2,2
629043709976276992,2015-08-05 21:38:02,b'Minimum understanding of the #Minimumwage http://t.co/KXpZeFNvmz',SenatorEnzi,3,2
629036773188980736,2015-08-05 21:10:28,b'Insightful perspective in The Hill regarding the #minimumwage. http://t.co/KXpZeFvUv1',SenatorEnzi,2,1
628348146511273984,2015-08-03 23:34:06,b'Joined @SteveDaines &amp; others in letter to State Dept concerned new changes would limit #2ndamendment #freedomofspeech http://t.co/pdHqjFZLNv',SenatorEnzi,0,1
628340074082504704,2015-08-03 23:02:02,b'With State Dept new changes I\xe2\x80\x99m concerned it could limit American\xe2\x80\x99s #2ndamendment rights &amp; #freedomofspeech. http://t.co/pdHqjFZLNv',SenatorEnzi,1,2
628335456686600193,2015-08-03 22:43:41,"b'.@SenJohnBarrasso &amp; I joined letter voicing concerns State Dept changes could limit #2ndamendment, #freedomofspeech. http://t.co/pdHqjGhnc5'",SenatorEnzi,1,2
628329192954929152,2015-08-03 22:18:48,b'I voted to redirect fed money to providers of women\xe2\x80\x99s health services other than Planned Parenthood. Bill failed. http://t.co/buOdEDz2AX',SenatorEnzi,1,2
628302577373843457,2015-08-03 20:33:02,"b'Today #EPA moves forward w/ power plant rule, showing the Admin doesn\xe2\x80\x99t care about the cost of killing coal. #CPP http://t.co/3o3ASNlHs4'",SenatorEnzi,2,2
628293703480803328,2015-08-03 19:57:46,b'Today the #EPA moved forward w/ its unprecedented rule to regulate new and existing coal power plants. #CPP http://t.co/3o3ASNDiQE',SenatorEnzi,1,2
627216420997206016,2015-07-31 20:37:02,b'Check out this Enzi Insider. http://t.co/fh4qtFglXk http://t.co/alD2IxupWY',SenatorEnzi,1,0
627202582012948481,2015-07-31 19:42:03,"b'#SanctuaryCities, #PlannedParenthood, #CancerResearch and more in this week\xe2\x80\x99s Enzi Insider. http://t.co/fh4qtEYL5M http://t.co/WLdZ5B6Gdl'",SenatorEnzi,2,3
626864942965243904,2015-07-30 21:20:23,b'#AmericanConservativeUnion Chairman Matt Schlapp presented me with the Conservative Achievement Award for 2014 today. http://t.co/QA4bdRJnck',SenatorEnzi,1,0
626438047303733249,2015-07-29 17:04:03,"b""Raising costs of mining coal will hike electricity/destroy high-wage mining jobs &amp; may decrease gov't revenue for #education &amp; more.""",SenatorEnzi,2,2
626430240701612032,2015-07-29 16:33:02,b'The Administration is fixated on #killingcoal w/o consideration of the consequences or lack of non-political benefits http://t.co/YDfUqjFoel',SenatorEnzi,2,0
626421663832391680,2015-07-29 15:58:57,b'#Wyo delegation statement on BLM listening sessions to discuss raising royalty rates on Federal Coal Leasing Program. http://t.co/YDfUqjWZCV',SenatorEnzi,1,1
626407606391668736,2015-07-29 15:03:06,b'Since 2011 been working on the #REINSact. Good to see House pass it today. http://t.co/nP443YAJBm',SenatorEnzi,1,2
626401049251688450,2015-07-29 14:37:02,b'Administration crushing country under weight of 500 major regulations. I\xe2\x80\x99ve been working on solutions &amp; am pleased House passed #REINSact.',SenatorEnzi,2,2
626387967502852096,2015-07-29 13:45:03,b'I am pleased the House passed #REINSact last night. It\xe2\x80\x99s something I\xe2\x80\x99ve also been working on. http://t.co/nP443YSkZW',SenatorEnzi,0,0
626097212183969792,2015-07-28 18:29:42,"b""RT @BudgetBulletin: #BudgetBulletin: Learn more about the #BalancedBudget's role in FY 2016 Appropriations http://t.co/8D1Ph4cvfW""",SenatorEnzi,0,4
626070136034734080,2015-07-28 16:42:06,"b""Senate passed #NOTICEAct yesterday. Will help seniors know when their post hospital stay is/isn't covered by Medicare http://t.co/AIGdutwgBQ""",SenatorEnzi,1,0
626064098438975488,2015-07-28 16:18:07,b'By providing a little more info the #NOTICEAct will help people feel a little more secure in their medical care. http://t.co/AIGdutwgBQ',SenatorEnzi,1,1
626057183952785408,2015-07-28 15:50:38,"b""Senate passed my bill w/ @SenatorCardin to help seniors know when post hospital stay is/isn't covered by Medicare. http://t.co/AIGdutNS0q""",SenatorEnzi,0,0
625046629066780672,2015-07-25 20:55:03,b'Check out this sneak peak video recorded for #CheyenneFrontierDays with @CynthiaLummis &amp; @SenJohnBarrasso. http://t.co/eWSuAK08uY',SenatorEnzi,0,2
625018941862080512,2015-07-25 19:05:02,"b'To celebrate #NationalDayoftheAmericanCowboy, I joined @CynthiaLummis &amp; @SenJohnBarrasso in recording this video. http://t.co/eWSuAK08uY'",SenatorEnzi,2,2
625003106577682432,2015-07-25 18:02:07,b'The Wyo delegation recorded this video for #CheyenneFrontierDays to celebrate #NationalDayoftheAmericanCowboy. http://t.co/eWSuAK08uY',SenatorEnzi,2,4
624983731661488129,2015-07-25 16:45:07,"b'On this day in 1868, #Wyo became a territory. http://t.co/xJJrAhunqN'",SenatorEnzi,2,2
624971145737977857,2015-07-25 15:55:07,b'The cowboy reputation for honesty &amp; hard work embody the way of life in #Wyo. #NationalDayoftheAmericanCowboy http://t.co/IcrYvZarra',SenatorEnzi,3,5
624927125234036736,2015-07-25 13:00:11,"b'Today is #NationalDayoftheAmericanCowboy. Cowboys are models of strong character, sound values &amp; good common sense. http://t.co/QY5m36bYbF'",SenatorEnzi,8,9
624707406967103488,2015-07-24 22:27:06,b'Public needs \xe2\x80\x9creasonable opportunity\xe2\x80\x9d to respond to rule to make drastic changes to existing #overtime eligibility. http://t.co/rLrhMWw2nu',SenatorEnzi,0,2
624699723514036224,2015-07-24 21:56:35,"b""Dept. Labor wants to double #overtime threshold. Might not be all it's cracked up to be. Deserves more thought. http://t.co/OXB6kcx8Df""",SenatorEnzi,1,2
624686270581641216,2015-07-24 21:03:07,b'See what I am working on in this week\xe2\x80\x99s Enzi Insider.  http://t.co/JYcUSIWQgV http://t.co/iqohJsrspu',SenatorEnzi,1,0
624678653935374337,2015-07-24 20:32:51,b'I joined other senators to request an investigation into Planned Parenthood.  This and more in the Enzi Insider. http://t.co/JYcUSIFfpn',SenatorEnzi,4,4
624593606486065153,2015-07-24 14:54:54,"b""RT @BudgetGOP: CQ's @PaulKrawzak reports Highway Bill Budget Gimmicks Would Be Barred Under @SenatorEnzi Move http://t.co/mYhQx6nmHQ http:/\xe2\x80\xa6""",SenatorEnzi,0,2
624338719105880064,2015-07-23 22:02:04,b'#Wyo near top fastest growth for women-owned businesses. Congrats Assoc. Women Business Owners on 40th anniv. #NAWBO http://t.co/AqqhSNOHL5',SenatorEnzi,2,1
624331419779665924,2015-07-23 21:33:04,b'A big salute from the Equality State to the National Association of Women Business Owners on your 40th anniv. #NAWBO http://t.co/AqqhSNOHL5',SenatorEnzi,0,1
624324626093510656,2015-07-23 21:06:04,"b'Diana and I really enjoyed being a part of the Cheyenne Frontier Days Parade last weekend, and our grandkids did too. http://t.co/AAmgYm4vWE'",SenatorEnzi,0,0
623948398954057728,2015-07-22 20:11:05,b'Regulations from the #DoddFrank do not fix \xe2\x80\x9ctoo big to fail\xe2\x80\x9d &amp; burden our community banks and credit unions. http://t.co/3d4TOK4FXm',SenatorEnzi,0,0
623940849886298112,2015-07-22 19:41:05,"b'Because of #DoddFrank, @CFPB has been collecting financial info of US citizens w/o consent. http://t.co/fJTOll4Mf1 http://t.co/3d4TOK4FXm'",SenatorEnzi,2,1
623938828030509056,2015-07-22 19:33:03,b'Yesterday I spoke on the Senate floor about how the #DoddFrank law has failed to protect consumers. http://t.co/3d4TOK4FXm',SenatorEnzi,1,1
623934794288664576,2015-07-22 19:17:01,"b'Because of #Dodd-Frank, community banks spend 30% of operating cost just to comply with regulations. http://t.co/3d4TOK4FXm'",SenatorEnzi,2,3
623911249408077824,2015-07-22 17:43:28,b'Stop by my staff\xe2\x80\x99s office hours in Lovell &amp; Greybull tomorrow to share your questions/concerns http://t.co/dwwhUJ444h http://t.co/v5Ngy7eAFl',SenatorEnzi,3,0
623620772964237312,2015-07-21 22:29:13,"b'RT @StewSays: . @SenatorEnzi speaking now on the consequences of the Dodd-Frank legislation, CFPB.'",SenatorEnzi,0,1
623246190474330112,2015-07-20 21:40:45,"b'Employee rights, education, agriculture and more. Learn more in this Enzi Insider. http://t.co/2Svd7GpYlv http://t.co/AEoq5AIU7b'",SenatorEnzi,0,0
623215258866466817,2015-07-20 19:37:51,b'If you like doing your dishes by hand you will like the Dept. of Energy\xe2\x80\x99s proposed dishwasher efficiency standards. http://t.co/9reKh656Xq',SenatorEnzi,0,2
622096687545192448,2015-07-17 17:33:02,b'We need to expand our tools to fight governing by rulemaking rather than representation. http://t.co/UyV4ihktgs  http://t.co/nzGiJWW05o',SenatorEnzi,1,1
622090227222478848,2015-07-17 17:07:22,"b""EPA continues unreasonable regulations but ultimately the states know what's best. http://t.co/UyV4ihC4F2  http://t.co/nzGiJWEpdQ""",SenatorEnzi,2,0
621809296326574081,2015-07-16 22:31:03,b'Every Child Achieves Act allows states to determine how to use federally required tests for accountability purposes. http://t.co/LPurip7RLz',SenatorEnzi,3,2
621807231315628032,2015-07-16 22:22:51,b'U.S should consider eliminating a regulation for every new one adopted. https://t.co/cUkIk0SMS3',SenatorEnzi,0,1
621805773643890689,2015-07-16 22:17:03,b'It\xe2\x80\x99s the Every Child Achieves Act or risk keeping the current bad system in place. http://t.co/LPurip7RLz',SenatorEnzi,4,4
621801731865772032,2015-07-16 22:01:00,"b'Every Child Achieves Act gives parents, schools and states more power in education. http://t.co/LPurip7RLz'",SenatorEnzi,0,0
621798998588788736,2015-07-16 21:50:08,b'Feds can revoke ed money sent to states if they don\xe2\x80\x99t follow mandates. The Every Child Achieves Act changes that. http://t.co/LPurip7RLz',SenatorEnzi,1,2
621796465959026690,2015-07-16 21:40:04,b'Every Child Achieves Act ends the emphasis on standardized tests. http://t.co/LPurip7RLz',SenatorEnzi,2,2
621792506896908289,2015-07-16 21:24:20,b'Every Child Achieves Act is an opportunity to shift the education balance back to states and local school districts. http://t.co/LPurioQgU1',SenatorEnzi,2,3
621757473196634112,2015-07-16 19:05:07,b'A new study has found Obamacare enrollees get to choose from fewer doctors &amp; hospitals than typical insurance plans. http://t.co/nsGsrVMLrV',SenatorEnzi,2,0
621744390583779328,2015-07-16 18:13:08,b'New post on Medium - \xe2\x80\x9cWorking Toward Common Sense Solutions to Obamacare\xe2\x80\x9d http://t.co/J7fgxfvjAU',SenatorEnzi,2,2
621732344660160512,2015-07-16 17:25:16,"b'#Obamacare plans have 34 percent fewer doctors, hospitals. http://t.co/nsGsrW4mQv'",SenatorEnzi,0,2
621093087016693761,2015-07-14 23:05:05,"b""We could accomplish great energy innovation across all energy sectors, but can't if fed rules shut the industry down. http://t.co/DOHUXAkndz""",SenatorEnzi,0,4
621083207887388674,2015-07-14 22:25:50,"b'At a hearing today I said fed gov should encourage small businesses to innovate in energy sector, not stifle it. http://t.co/DOHUXA2Mm1'",SenatorEnzi,1,1
621073797966397440,2015-07-14 21:48:27,b'The application deadline for a fall internship in my D.C. office has been extended to July 17. http://t.co/atUlnjLqUx http://t.co/SZ0moe9X7j',SenatorEnzi,1,1
620669461360705536,2015-07-13 19:01:45,b'RT @BudgetGOP: BREAKING @SenatorEnzi Requests @USCBO Report on Current Impact of Balanced Budget Resolution http://t.co/HjhwLA0rGS',SenatorEnzi,0,4
620662171819712513,2015-07-13 18:32:47,b'My state staff will be holding office hours in Moorcoft &amp; Hulett tomorrow. Stop by to share your questions/concerns. http://t.co/dwwhUJ444h',SenatorEnzi,3,1
619629487479758848,2015-07-10 22:09:16,"b'.@ProfJulieHill Correct! RT@SenatorEnzi #1 Cheyenne; #2 Casper, #3 Laramie, #4 Sheridan, #5 Encampment #Wyo125'",SenatorEnzi,1,1
619590183319539713,2015-07-10 19:33:05,b'God bless Wyoming and the wonderful people that call it home. http://t.co/zkplXuetpS',SenatorEnzi,5,5
619572740207575040,2015-07-10 18:23:47,"b'Today we celebrate Wyoming\xe2\x80\x99s 125th birthday. July 10, 1890 we became the 44th state! http://t.co/lByDbIHKBK'",SenatorEnzi,2,2
619517491967053825,2015-07-10 14:44:14,b'Photo 5. #Wyo125 http://t.co/toivMm2hx4',SenatorEnzi,3,4
619517411084095488,2015-07-10 14:43:55,b'Photo 4. #Wyo125 http://t.co/490AnoCLsP',SenatorEnzi,3,1
619517331970994176,2015-07-10 14:43:36,b'Photo 3. #Wyo125 http://t.co/tB3XFKIsxc',SenatorEnzi,1,1
619517290866974720,2015-07-10 14:43:26,b'Photo 2. #Wyo125 http://t.co/t8gHNE3S1d',SenatorEnzi,1,1
619517247971819521,2015-07-10 14:43:16,b'Photo 1. #Wyo125 http://t.co/SMpXy1O35N',SenatorEnzi,2,2
619517031709298690,2015-07-10 14:42:25,b'Can you name the town where these photos were taken back in 1890 when Wyoming first became a state? #Wyo125',SenatorEnzi,0,0
619516990726766593,2015-07-10 14:42:15,"b""Happy Birthday Wyoming! Today we celebrate the state's 125th anniversary. #Wyo125""",SenatorEnzi,3,5
619279914227757056,2015-07-09 23:00:11,b'Solving problems early is less expensive than solving problems later. https://t.co/r526G9w5gd',SenatorEnzi,3,5
619270578847903745,2015-07-09 22:23:06,b'We should learn from Greece\xe2\x80\x99s mistakes. #greececrisis https://t.co/r526G9w5gd http://t.co/bYLZKrgzOm',SenatorEnzi,3,2
619258239872438272,2015-07-09 21:34:04,"b'With Greece in financial crisis, what lessons can be learned so that US doesn\xe2\x80\x99t find itself in a similar disaster? https://t.co/r526G9w5gd'",SenatorEnzi,0,1
619215251670716418,2015-07-09 18:43:15,"b'Some said Congress would not be able to pass a #BalancedBudget this year, but we did. https://t.co/QjrV74wfuy'",SenatorEnzi,2,2
618901143863734272,2015-07-08 21:55:05,b'We should ask what small business health insurance markets should look like in the future &amp; how we get there. http://t.co/aoNKqeFWeu',SenatorEnzi,2,1
618892200361877504,2015-07-08 21:19:33,b'Today @SenJohnBarrasso &amp; I met with over 100 students from all over #Wyo participating in FCCLA at the Capitol. http://t.co/4iw2aAhaSB',SenatorEnzi,2,1
618880411662467072,2015-07-08 20:32:43,b'Small businesses across the US struggle to provide affordable insurance. I held a roundtable to discuss solutions. http://t.co/aoNKqeolmW',SenatorEnzi,1,2
618836479767392256,2015-07-08 17:38:08,"b'This was like the honor flights for WWII veterans, but for Vietnam veterans from the grateful people of our state. https://t.co/iLBNM0V477'",SenatorEnzi,1,1
618820421933252608,2015-07-08 16:34:20,"b'Recently in Casper, Wyoming my wife Diana and I paid our respects to the men and women who were in Vietnam. https://t.co/iLBNM0V477'",SenatorEnzi,1,2
618813897152274432,2015-07-08 16:08:24,b'Vietnam vets finally get welcome home they deserve. https://t.co/iLBNM0V477',SenatorEnzi,1,1
618541768489873409,2015-07-07 22:07:04,"b""On July 10th Wyoming will celebrate the 125th anniversary of its statehood. Intro'd resolution to celebrate.  #Wyo125 http://t.co/V22Sp0NEPy""",SenatorEnzi,5,3
618533231080550401,2015-07-07 21:33:08,"b'Wyo residents may be few in number but our hardworking, resilient and independent spirit is worth celebrating #Wyo125 http://t.co/V22Sp0NEPy'",SenatorEnzi,1,2
618529067390889985,2015-07-07 21:16:36,"b""Senate recently passed resolution intro'd by @SenJohnBarrasso &amp; me celebrating Wyoming's 125th statehood anniversary. http://t.co/V22Sp0w3Y0""",SenatorEnzi,0,1
618414873257623552,2015-07-07 13:42:50,b'Stop by my staff\xe2\x80\x99s office hours in Moorcoft and Hulett next week to share your questions/concerns. http://t.co/dwwhUJ444h',SenatorEnzi,0,0
617859698059018240,2015-07-06 00:56:45,b'Congrats to the @usoccer_wnt team on their World Cup win. #USWNT #FIFAWWCFinal http://t.co/mHmV6Qaf4s',SenatorEnzi,9,5
617368157649534976,2015-07-04 16:23:33,b'Have a wonderful #July4th http://t.co/KJJoRixPre',SenatorEnzi,5,4
616668190517559296,2015-07-02 18:02:08,"b""States &amp; businesses are burdened by overregulation from fed gov. My amend't would redistribute power back to states. http://t.co/cBZAtCvJ7f""",SenatorEnzi,1,1
616657108725968896,2015-07-02 17:18:06,b'States need options to provide relief from one-size-fits-all policies. It\xe2\x80\x99s time to shift power back to the states. http://t.co/cBZAtCvJ7f',SenatorEnzi,1,1
616648814875639809,2015-07-02 16:45:08,b'I recently introduced a constitutional amendment to give states the power to repeal any federal regulation or law. http://t.co/cBZAtCvJ7f',SenatorEnzi,1,1
615631787717435392,2015-06-29 21:23:50,b'Recently Senator @alfranken &amp; his wife Franni joined Diana &amp; me in hosting the Senate pages w/ root beer floats. http://t.co/RsTqjLGtmE',SenatorEnzi,9,3
615614493289267201,2015-06-29 20:15:07,b'In Congress we\xe2\x80\x99ll continue our efforts to stand up to this runaway agency. (4/4)',SenatorEnzi,0,3
615614424230047744,2015-06-29 20:14:50,b'Americans who are having a hard time paying their bills don\xe2\x80\x99t have the luxury of ignoring the costs of EPA actions. (3/4)',SenatorEnzi,0,3
615614354701090816,2015-06-29 20:14:34,b'But this Admin\xe2\x80\x99s divorce from reality continues to be messy &amp; the casualties for our economy continue to pile up. (2/4)',SenatorEnzi,0,1
615614278574436352,2015-06-29 20:14:16,"b""I'm pleased with the court's ruling today against the EPA for not considering the cost of energy regs. (1/4) http://t.co/zsnF1HrASx""",SenatorEnzi,0,0
615572980333031424,2015-06-29 17:30:09,"b""I answer your questions on why Congress shouldn't spend more than it agreed to. #BalancedBudget http://t.co/7S0HZBlLFj""",SenatorEnzi,0,0
615559755386486784,2015-06-29 16:37:36,"b'We just passed a #BalancedBudget, but the minority party in the Senate already wants to spend more. http://t.co/7S0HZB4aNL'",SenatorEnzi,0,1
614205707122913281,2015-06-25 22:57:06,"b""In six months we've passed a #BalancedBudget, 110 bills out of committee, 40 through the Senate and 18 are now law. http://t.co/exY17itV2R""",SenatorEnzi,2,2
614200660230213632,2015-06-25 22:37:03,"b'We are making progress by moving bills through, but we must keep going. #BackToWork http://t.co/qKDL1bJu6L'",SenatorEnzi,1,1
614188261964165120,2015-06-25 21:47:47,b'What we have to do is put on the president\xe2\x80\x99s desk what we think is right and then he can do what he thinks is right. http://t.co/exY17iLwrr',SenatorEnzi,0,1
614147671364902913,2015-06-25 19:06:29,b'RT @kellywalshband: Thanks for meeting with us and  talking WYO Music ED! @SenatorEnzi #NAfMEHD15 @WyoBand @StephenWadsack http://t.co/tSbJ\xe2\x80\xa6',SenatorEnzi,0,7
614133536501669888,2015-06-25 18:10:19,"b'No couch potatoes here. Wyoming \xe2\x80\x9cleast lazy\xe2\x80\x9d state, according to Washington Post blog. http://t.co/DxC3O6KW86'",SenatorEnzi,6,4
614099492892078080,2015-06-25 15:55:03,"b""No matter the court\xe2\x80\x99s ruling it's time for Dems &amp; GOP to deliver what the president promised but failed to deliver. https://t.co/7S0ZlExRyw""",SenatorEnzi,1,1
614093863171567616,2015-06-25 15:32:40,b'My statement on the Supreme Court\xe2\x80\x99s #KingVsBurwell decision. #SCOTUS  http://t.co/r3lh3yNAh0',SenatorEnzi,1,1
613841298596892672,2015-06-24 22:49:04,b'Finance committee passed 2 of my bills today that would improve Medicare and Medicaid &amp; help put patients first. http://t.co/WomDRUHfrJ',SenatorEnzi,1,1
613833394309300224,2015-06-24 22:17:40,b'RT @SenToomey: My bill to provide more funds to victims of crime just passed the @SenateBudget Committee. Read more here: http://t.co/hmzAw\xe2\x80\xa6',SenatorEnzi,0,3
613831728331816960,2015-06-24 22:11:03,"b'Great work in the Senate Finance committee where we passed 12 bipartisan health bills, including two I sponsored.  http://t.co/WomDRUHfrJ'",SenatorEnzi,2,2
613830054229975040,2015-06-24 22:04:23,"b'RT @BudgetGOP: The U.S. Senate is #BackToWork under @SenateMajLdr &amp; @Senate_GOPs, and produced 1st #BalancedBudget since 2001. http://t.co/\xe2\x80\xa6'",SenatorEnzi,0,11
613825567608209408,2015-06-24 21:46:34,"b'Senate committee passed bipartisan bills to curb Medicare fraud, identity theft and clarify patient hospital status. http://t.co/WomDRUpEAb'",SenatorEnzi,1,1
613784438384623616,2015-06-24 19:03:08,b'An unprecedented policy decision decided by a judge is an example of real world impacts of shutting down fossil fuels http://t.co/Q5lRIOCu58',SenatorEnzi,2,2
613783200809283584,2015-06-24 18:58:13,"b'RT @SenOrrinHatch: Hatch, other GOP Senate leaders are speaking at a press conference on #TPA and their efforts to restore the Senate. http\xe2\x80\xa6'",SenatorEnzi,0,5
613777132251025408,2015-06-24 18:34:06,b'A Colorado coal mine may shut down after an unfair court ruling changed a gov environmental approval from 2007. http://t.co/Q5lRIOCu58',SenatorEnzi,1,0
613769858900197376,2015-06-24 18:05:12,"b""Sent letter w/ @CoryGardner requesting gov appeal court's unfair ruling that could shut down an important coal mine. http://t.co/Q5lRIOkTdA""",SenatorEnzi,0,1
613731875991998464,2015-06-24 15:34:16,"b'RT @BudgetBulletin: LEARN MORE #BudgetBulletin: ACA, Reconciliation &amp; the 2016 Budget Process http://t.co/x5avzcQixB http://t.co/8uD79ETRhI'",SenatorEnzi,0,3
613420517303803904,2015-06-23 18:57:02,b'True regulatory reform can help all Americans grow and prosper. http://t.co/DJml44ZpKm  http://t.co/ek41L7t2uq',SenatorEnzi,1,1
613414480626581505,2015-06-23 18:33:03,"b'The regulatory burden in the US in 2014 was more than $1.8 trillion, which is bigger than the entire GDP of India. http://t.co/DJml44ZpKm'",SenatorEnzi,3,4
613401387615977472,2015-06-23 17:41:01,"b""It's time to demand results to ensure that gov works for the people, instead of the people working for the gov. http://t.co/ek41L7t2uq""",SenatorEnzi,2,4
613397264883687424,2015-06-23 17:24:38,b'Spoke today at joint Budget/HSGAC hearing on how gov needs to make it easier for Americans to grow their businesses. http://t.co/DJml44HOSO',SenatorEnzi,2,6
613373997661745152,2015-06-23 15:52:11,b'RT @SpeakerBoehner: The #EPA needs more accountability. NOT more money. \xe2\x86\x90 Retweet to agree. http://t.co/c1Jtoy7G6s',SenatorEnzi,0,80
613351077610680320,2015-06-23 14:21:07,"b'RT @BudgetGOP: @SenatorEnzi: It is time for government to work for the people, instead of the people working for the government. #BalancedB\xe2\x80\xa6'",SenatorEnzi,0,2
613349545251106816,2015-06-23 14:15:01,"b'RT @BudgetGOP: @SenatorEnzi In  2014, regulatory burdens in US cost more than $1.8 trillion &amp; was bigger than entire GDP of India. http://t\xe2\x80\xa6'",SenatorEnzi,0,1
613087771910082560,2015-06-22 20:54:50,b'RT @BudgetGOP: TOMORROW: Joint Hearing with HSGAC Chair @SenRonJohnson on the need for regulatory reform. http://t.co/8K3ntV0Vt5 http://t.c\xe2\x80\xa6',SenatorEnzi,0,1
612998995871297536,2015-06-22 15:02:04,b'See what I am working on in this week\xe2\x80\x99s Enzi Insider. http://t.co/cxc6ePQik2',SenatorEnzi,1,1
