id,created_at,text,user,favorite_count,retweet_count
776498836948647936,2016-09-15 19:12:04,b'As costs rise under Obamacare small business owners find it more difficult to provide health insurance for employees.https://t.co/WqzE1hvzdQ',SenatorEnzi,2,2
776458871888023552,2016-09-15 16:33:15,"b'If you\xe2\x80\x99re an inventor/entrepreneur, head to Gillette College on Oct 1 to take part in my annual Inventors Conference https://t.co/pkKkJap59C'",SenatorEnzi,1,1
776149030124396545,2016-09-14 20:02:03,"b'5 Military Academies, which one\xe2\x80\x99s for you? Come get info with representatives at Cheyenne East High School Sept. 17. https://t.co/YWplWfmSB3'",SenatorEnzi,1,0
776145806969757700,2016-09-14 19:49:15,"b'RT @BudgetGOP: @USCBO tells us deficits will hit $1 trillion in 2024 &amp; by 2026, our mammoth debt will reach more than $28 trillion https://\xe2\x80\xa6'",SenatorEnzi,0,4
775813839484882944,2016-09-13 21:50:07,b'Meet with Academy reps in Wyoming September 17 to learn how to get the equivalent of a fully paid scholarship. https://t.co/YWplWfmSB3',SenatorEnzi,2,1
775734051630043140,2016-09-13 16:33:05,b'I will oppose Pres. Obama\xe2\x80\x99s efforts to give UN Security Council authority over US nuke testing. https://t.co/C49S4HkpeV',SenatorEnzi,6,1
775725994892070912,2016-09-13 16:01:04,"b'Nuke test ban or not, ceding U.S. sovereignty to foreign powers and undermining Constitution is a bad idea. https://t.co/C49S4HkpeV'",SenatorEnzi,4,1
775707162811174912,2016-09-13 14:46:14,b'President Obama is attempting to go around the Senate by imposing a nuclear test ban through the United Nations. https://t.co/C49S4H2Onn',SenatorEnzi,4,5
775464020371394560,2016-09-12 22:40:04,b'Sent letter with @SenJohnBarrasso &amp; @CynthiaLummis to help protect Wyoming\xe2\x80\x99s market to export soda ash. https://t.co/gfeUtL0w42',SenatorEnzi,10,5
775452021159854080,2016-09-12 21:52:23,b'China needs to resolve soda ash overcapacity issue that is hurting Wyoming\xe2\x80\x99s ability to export.  https://t.co/gfeUtLi7sC',SenatorEnzi,1,0
775163504789639168,2016-09-12 02:45:56,b'Today we remember the heroic first responders and police officers who lost their lives on 9/11. #NeverForget https://t.co/5EzFQMrUuV',SenatorEnzi,14,4
775147159809302529,2016-09-12 01:40:59,"b'Today is the 15th anniversary of #9/11, when we stood together as one nation in the face of terrorism. https://t.co/v8PQIpU59C'",SenatorEnzi,11,4
774707404097347585,2016-09-10 20:33:33,"b'This beautiful area is frequently used for outdoor sports including climbing, hiking, biking and caving.  #ThatsWY'",SenatorEnzi,4,2
774707298090491904,2016-09-10 20:33:07,b'Ten Sleep Canyon in Washakie County is a dream for recreationists. #ThatsWY https://t.co/4KewoZIt4q https://t.co/GPnTLpiShu',SenatorEnzi,3,3
774706949900345344,2016-09-10 20:31:44,b'Every week I am sharing a new amazing location to visit in one of Wyoming\xe2\x80\x99s 23 counties. #ThatsWY',SenatorEnzi,3,2
773645297612300288,2016-09-07 22:13:07,"b'Freedom, flexibility, choice will improve health care system, not more Obamacare federal mandates or higher taxes.  https://t.co/oZdpuNE21V'",SenatorEnzi,6,3
773634797914746881,2016-09-07 21:31:23,b'In 2009 president complained health insurance controlled by too few companies. Obamacare made that situation worse.  https://t.co/oZdpuNVDqv',SenatorEnzi,3,2
773274446354198529,2016-09-06 21:39:29,b'My state staff will be holding office hours in #Gillette and #Wright on Sept. 8. Stop by &amp; share your thoughts. https://t.co/RPugGHugsu',SenatorEnzi,0,1
773265965937287170,2016-09-06 21:05:47,b'My state staff will be holding office hours in #LaGrange and #Torrington on Sept. 8. Stop by &amp; share your thoughts. https://t.co/ycdwIOWEM1',SenatorEnzi,4,2
772096723812507648,2016-09-03 15:39:38,b'Go back in time at this museum. Learn more at: https://t.co/tGg8f77vMY',SenatorEnzi,1,2
772096519067541504,2016-09-03 15:38:49,b'Today I am featuring the Stagecoach Museum in Niobrara County. #WyoHistory https://t.co/6Y7xYbhuPs',SenatorEnzi,0,2
772096218226954241,2016-09-03 15:37:37,b'Every week I am sharing a new amazing location to visit in one of Wyoming\xe2\x80\x99s 23 counties.',SenatorEnzi,1,2
770673951471198208,2016-08-30 17:26:03,"b"".@SenJohnBarrasso &amp; I joined a letter calling out the Administration's latest infringement on the #SecondAmendment. https://t.co/yON7wSVyBi""",SenatorEnzi,2,1
770673744138428421,2016-08-30 17:25:13,"b""@SenJohnBarrasso and I joined a letter calling out the Administration's latest infringement on the #SecondAmendment. https://t.co/yON7wSVyBi""",SenatorEnzi,5,4
770672192900128768,2016-08-30 17:19:03,b'Unnecessary expansion on International Traffic in Arms Regulations may require firearms hobbyists to pay fees. https://t.co/yON7wTd9sQ',SenatorEnzi,0,2
770662907583475712,2016-08-30 16:42:10,"b""Joined @SteveDaines in a letter calling out the Administration's latest infringement on the #SecondAmendment. https://t.co/yON7wTd9sQ""",SenatorEnzi,3,2
770654862765940736,2016-08-30 16:10:12,b'DOS policy guidance expansion would have negative consequences on thousands of gunsmiths in the US. #SecondAmendment https://t.co/yON7wSVyBi',SenatorEnzi,0,1
770384310394204160,2016-08-29 22:15:07,"b'Met with @YellowstoneNPS Superintendent, Dan Wenk for the National Park Service Centennial Celebration. #NPS100 https://t.co/hOFmn9656w'",SenatorEnzi,8,3
770375266732380165,2016-08-29 21:39:11,b'With @GovMattMead by the Roosevelt Arch in @YellowstoneNPS for the centennial celebration. #NPS100 https://t.co/ergOvreLKU',SenatorEnzi,6,1
770368180535558144,2016-08-29 21:11:01,b'Standing by the Roosevelt Arch in @YellowstoneNPS at north entrance. #NPS100 https://t.co/TbJt5x7Utl',SenatorEnzi,7,2
770284750552625152,2016-08-29 15:39:30,"b'I toured @AmericanSummits water facility in Clark Wyoming this week and spoke with owner, Philip Lajaunie. https://t.co/vhfcID3FDa'",SenatorEnzi,5,1
769574649558605824,2016-08-27 16:37:49,"b'Visit this breathtaking area and its mountains, rivers, forests and wildlife.  https://t.co/2dpxbq8whH'",SenatorEnzi,2,0
769574552804401152,2016-08-27 16:37:26,"b'One of the most famous Wyoming landmarks, @GrandTetonNPS is a majestic sight. #Tetons #NPS100 https://t.co/RdLKys7XZL'",SenatorEnzi,4,2
769574035252473856,2016-08-27 16:35:22,b'Every week I am sharing a new amazing location to visit in one of Wyoming\xe2\x80\x99s 23 counties.',SenatorEnzi,3,1
769246824573997056,2016-08-26 18:55:09,b'Shared some photos from my recent trip to @YellowstoneNPS for 100th anniversary of the @NatlParkService. #NPS100 https://t.co/BTLi9SXn1Q',SenatorEnzi,6,3
769244769641963520,2016-08-26 18:46:59,b'Toured the Kendrick Mansion @ the Trail End State Historic Site in Sheridan. Thanks Cynde Georgen for the tour. https://t.co/HhkP8PXHxU',SenatorEnzi,5,1
769202549899530240,2016-08-26 15:59:13,b'Check out my medium story with many photos from my recent trip to @YellowstoneNPS. #NPS100 https://t.co/BTLi9TeYqq',SenatorEnzi,1,0
769188503477444608,2016-08-26 15:03:24,"b'I visited West Park Hospital  to tour the new ER with Doug McMillian, CEO of West Park Hospital, as my tour guide. https://t.co/7CJmfIfnTk'",SenatorEnzi,3,3
769007223422889985,2016-08-26 03:03:04,b'Check out my trip to @YellowstoneNPS as @NatlParkService celebrates its 100th birthday. https://t.co/e5jXNgV3uc',SenatorEnzi,4,1
768977886422327297,2016-08-26 01:06:29,b'It is an especially good time to visit  @YellowstoneNPS as @NatlParkService celebrates its 100th birthday. #NPS100 https://t.co/e5jXNgV3uc',SenatorEnzi,5,0
768900749279449089,2016-08-25 19:59:58,"b'Recently visited @YellowstoneNPS, a place of wonder for me almost my entire life. https://t.co/e5jXNgV3uc #NPS100'",SenatorEnzi,5,1
768872500562309120,2016-08-25 18:07:43,b'Congrats to Penne Ainsworth as the winner of the 2016 @AICPA Distinguished Achievement in Accounting Education Award https://t.co/gRYUluMI2c',SenatorEnzi,6,0
768841676685049856,2016-08-25 16:05:14,b'Diana &amp; I went for a trip to Yellowstone to once again explore the magic of America\xe2\x80\x99s first national park.  https://t.co/e5jXNgV3uc #NPS100',SenatorEnzi,6,1
768816414912229376,2016-08-25 14:24:51,b'Today @NatlParkService celebrates 100th birthday. Diana &amp; I went to Yellowstone to enjoy the 1st natl park. #NPS100 https://t.co/e5jXNgV3uc',SenatorEnzi,9,1
768594555679612929,2016-08-24 23:43:16,b'Always wonderful to be a part of the Wyoming State Fair parade in Douglas. https://t.co/Ur3DWkTijl',SenatorEnzi,9,3
768527507674898432,2016-08-24 19:16:51,b'Great to tour Kitty Moats Complex in Osage to see how they renovated an elementary school into a community space. https://t.co/3pJZa2K6jb',SenatorEnzi,7,1
768445756734701569,2016-08-24 13:52:00,b'Wonderful to tour the Kendrick Mansion at the Trail End State Historic Site in Sheridan. https://t.co/RTQNBdExkZ',SenatorEnzi,7,3
768124901593079808,2016-08-23 16:37:02,b'Lots of fun touring the Koltiska Distillery in Sheridan. Thanks to Jason Koltiska for the tour. https://t.co/QuftCrmIkc',SenatorEnzi,9,3
767875963073933313,2016-08-23 00:07:50,b'I was impressed by the Edward A. Whitney Academic Center building at Sheridan College and the performing arts wing. https://t.co/kuFX1g3FRF',SenatorEnzi,7,1
767842556591742976,2016-08-22 21:55:05,b'It was interesting to learn more about the Wyoming Life Flight helicopter in Sheridan. https://t.co/qQDsRmNI5v',SenatorEnzi,3,1
767824005730594816,2016-08-22 20:41:23,b'Toured Air Methods Wyo Life Flight helicopter in Sheridan to learn how they provide critical medical transportation. https://t.co/PIMrsctVWI',SenatorEnzi,7,0
767814117688094720,2016-08-22 20:02:05,b'Thanks to all those who showed me the Welch Cancer Center &amp; new ICU Unit in Sheridan. https://t.co/v5EgMkAxYD',SenatorEnzi,5,2
767795673651638273,2016-08-22 18:48:48,b'Toured the Welch Cancer Center &amp; new ICU Unit at Sheridan Memorial Hospital. https://t.co/TPkBiRLJHf',SenatorEnzi,1,2
767367590696001537,2016-08-21 14:27:45,b'The Wyoming Pioneer Museum preserves materials from the westward expansion. Learn more here: https://t.co/3hCJJul98E',SenatorEnzi,1,1
767367440036601857,2016-08-21 14:27:09,"b'\xe2\x80\x9cGo west young man, go west!\xe2\x80\x9d Today I am featuring the Wyoming Pioneer Museum in Douglas. #wyohistory https://t.co/Z57c0geSg8'",SenatorEnzi,7,2
767367021478547457,2016-08-21 14:25:29,b'Every week I am sharing a new amazing location to visit in one of Wyoming\xe2\x80\x99s 23 counties.',SenatorEnzi,6,9
766777286439743489,2016-08-19 23:22:05,b'Was honored to present U.S. Rep. @CynthiaLummis with the Ag Hall of Fame Award at the Wyo Livestock Roundup Picnic https://t.co/aGv5qPOogo',SenatorEnzi,16,1
766750495738331136,2016-08-19 21:35:38,b'Congrats to Rep. @CynthiaLummis  and Dennis Thaler for being inducted into the Wyo Ag Hall of Fame. https://t.co/iPn9NlKiDy',SenatorEnzi,9,1
766731132880707584,2016-08-19 20:18:41,b'I enjoyed taking a tour of the Casper-Natrona County International Airport. https://t.co/dA3dHwYsjn',SenatorEnzi,5,0
766606516103282688,2016-08-19 12:03:30,b'RT @SenJohnBarrasso: Congrats to @CynthiaLummis &amp; Dennis Thaler on being inducted into the WY Ag Hall of Fame yesterday in Douglas. https:/\xe2\x80\xa6',SenatorEnzi,0,6
766410103654223872,2016-08-18 23:03:02,b'America and Wyoming will continue to be an energy leader only if we continue to encourage production. https://t.co/CR7ua7MTSN',SenatorEnzi,4,2
766409859424137216,2016-08-18 23:02:04,b'Attended the Petroleum Association of Wyoming Annual Meeting &amp; Tradeshow Wed w/ @SenJohnBarrasso &amp; @CynthiaLummis https://t.co/TloM1Lyftu',SenatorEnzi,4,2
766377921153933312,2016-08-18 20:55:09,"b'Visited the Wind River Tribal College in Ethete on Tuesday with president of the college, Marlin Spoonhunter. https://t.co/53IYscv150'",SenatorEnzi,6,1
766346281417641984,2016-08-18 18:49:26,"b""Enjoyed speaking to the Lander &amp; Casper Chambers of Commerce about America's #BrokenBudget process &amp; Wyo's economy. https://t.co/rbkDHUInKK""",SenatorEnzi,3,1
765905178558070784,2016-08-17 13:36:39,b'RT @SenJohnBarrasso: Just wrapped up another great teletown hall with @SenatorEnzi. Great to hear from so many people across #Wyoming. http\xe2\x80\xa6',SenatorEnzi,0,7
765618000569466880,2016-08-16 18:35:30,b'Stopped by Coffee Time on KOVE radio in Lander today to discuss the important issues facing Wyoming w/ Joe Kenney. https://t.co/KGfHzOCw1e',SenatorEnzi,8,3
764501778167689216,2016-08-13 16:40:02,b'Take a dip in the natural waters and check out the bison herd at feeding time. More at: https://t.co/GuWMMX6Yar',SenatorEnzi,2,1
764501650069458946,2016-08-13 16:39:31,b'Today we have one of Wyoming\xe2\x80\x99s hottest attractions! Check out the Hot Springs State Park in Thermopolis. https://t.co/fEpcpo05xP',SenatorEnzi,8,3
764501521971249153,2016-08-13 16:39:01,b'Every week I am sharing a new amazing location to visit in one of Wyoming\xe2\x80\x99s 23 counties.',SenatorEnzi,10,0
762633365052940288,2016-08-08 12:55:37,b'I had a great time visiting the Grand Encampment Museum in 2014. #WyoTourism https://t.co/mvYfRLlmeQ',SenatorEnzi,4,0
761979573164646400,2016-08-06 17:37:41,"b'Also learn about Wyo\xe2\x80\x99s timber, mining and agricultural history. More here: https://t.co/7ow1Nel4Uq #wyotourism'",SenatorEnzi,5,1
761979312245309440,2016-08-06 17:36:39,b'See how in 1902 engineers built the world\xe2\x80\x99s longest non-motorized aerial tramway to help transport ore. https://t.co/2tmmDZcaez',SenatorEnzi,6,4
761979146117406720,2016-08-06 17:35:59,b'Today I am featuring a \xe2\x80\x9cGEM\xe2\x80\x9d from the state. The Grand Encampment Museum preserves Wyo history in Carbon County.',SenatorEnzi,4,2
761979045231759360,2016-08-06 17:35:35,b'Every week I plan to share a new amazing location to visit in one of Wyoming\xe2\x80\x99s 23 counties.',SenatorEnzi,10,0
761669390207062019,2016-08-05 21:05:08,b'Want to understand just how much debt our country has? Check out these examples for some perspective. https://t.co/cSHA3LQqFo',SenatorEnzi,7,7
761651777347260416,2016-08-05 19:55:09,b'It can be hard to grasp just how large our nation\xe2\x80\x99s debt is. Here are some examples. https://t.co/RaUuSNNF5B',SenatorEnzi,5,3
761629795939708928,2016-08-05 18:27:48,"b'Our country is $19 trillion dollars in debt, but how much is that really? https://t.co/h1P4fFeJfw'",SenatorEnzi,6,11
760957460311977984,2016-08-03 21:56:11,"b""If the Obama Administration's payment to Iran was a ransom payment it puts Americans more at risk, not less. https://t.co/GfgPg6VoJ8""",SenatorEnzi,6,8
760944920484016128,2016-08-03 21:06:21,b'Timing of payment to Iran sure seems like a ransom payment. My full statement. https://t.co/cTBczJGyCE',SenatorEnzi,11,11
760926000704131073,2016-08-03 19:51:10,b'Climate change directive would weigh heavily on projects that will make all our lives better. #CEQ #infrastructure https://t.co/dEVRIYHNPk',SenatorEnzi,2,3
760922469884538882,2016-08-03 19:37:08,b'White House prioritizing own ideology over economy and jobs.  #CEQ #NEPA #infrastructure https://t.co/dEVRIYHNPk',SenatorEnzi,2,1
760912341064097792,2016-08-03 18:56:53,b'CEQ climate change directive is attempt by Administration to endear itself to environmental special interests.  #NEPA #infrastructure',SenatorEnzi,2,2
760557160484966400,2016-08-02 19:25:32,b'What can 18 century France tell us about our country today? Debt has consequences. Ignoring it won\xe2\x80\x99t make it go away https://t.co/59sDfFKB5e',SenatorEnzi,2,3
759436198414737408,2016-07-30 17:11:14,"b'Remember to feed the famous fish &amp; view \xe2\x80\x9cThe Sinks\xe2\x80\x9d, where the river vanishes into the mountain. More here: https://t.co/Q7QHDTTAqc'",SenatorEnzi,3,1
759436094630875137,2016-07-30 17:10:49,b'Rise and fall into the beauty. Today I am featuring Sinks Canyon in Fremont County. https://t.co/96uzzf1sUL',SenatorEnzi,14,2
759435904293310466,2016-07-30 17:10:03,b'Every week I plan to share a new amazing location to visit in one of Wyoming\xe2\x80\x99s 23 counties.',SenatorEnzi,6,0
757648513916366849,2016-07-25 18:47:36,b'I was happy to be part of the Cheyenne Frontier Days parade to kick off the \xe2\x80\x9cDaddy of \xe2\x80\x98em all\xe2\x80\x9d. https://t.co/ufBARIuYXe',SenatorEnzi,16,3
756866729347657730,2016-07-23 15:01:04,b'Long live the American Cowboy - a symbol of the West and strong Wyoming values! https://t.co/QUINepmHmm',SenatorEnzi,10,7
756836380387397632,2016-07-23 13:00:29,"b'Today is the National Day of the American Cowboy, honoring those that live the Code of the West! https://t.co/84eQfjApg1'",SenatorEnzi,27,20
756564219936460800,2016-07-22 18:59:00,b'#ThatsWY\nhttps://t.co/h7xsPjmi7n',SenatorEnzi,2,2
756550225116930049,2016-07-22 18:03:24,b'\xe2\x80\x9cVisit once and you\xe2\x80\x99ll wonder why you never did before. #ThatsWy \xe2\x80\x9d @wyomingtourism https://t.co/mPly6XPcAj',SenatorEnzi,4,4
756534783191162882,2016-07-22 17:02:02,b'It was great talking with @kfbcradio today in Cheyenne during the Pardners N\xe2\x80\x99 Prosperity Brunch. https://t.co/NOdWHaxNfR',SenatorEnzi,3,2
755890807677132801,2016-07-20 22:23:06,b'Learn what I am working on in this Enzi Insider. https://t.co/IUTJJtYsFT https://t.co/MvhIWWr57V',SenatorEnzi,1,1
755871067672117248,2016-07-20 21:04:40,b'Cosponsored resolution to stop rule designed to give labor unions unfair advantages. Learn more in the Enzi Insider. https://t.co/IUTJJtGROl',SenatorEnzi,0,0
755480350604693504,2016-07-19 19:12:06,"b""I intro'd legislation that would end one of the tricks that Congress uses to pretend that it is balancing the books. https://t.co/5laJYsYYqF""",SenatorEnzi,8,5
755461646399770624,2016-07-19 17:57:46,b'Congress has a spending problem &amp; tries to use budget gimmicks to act like it has more money than it actually does. https://t.co/5laJYsHnz7',SenatorEnzi,8,2
754056719882260480,2016-07-15 20:55:06,b'White House short circuiting review of federal coal program and its moratorium on new coal-lease sales. https://t.co/dLWBHeb3QQ',SenatorEnzi,1,4
754029218174865408,2016-07-15 19:05:49,"b'Report turns BLM\xe2\x80\x99s review of the fed coal program into a \xe2\x80\x9cpre-baked cake\xe2\x80\x9d, which is not allowed under current law.  https://t.co/dLWBHeb3QQ'",SenatorEnzi,2,2
753379749615939584,2016-07-14 00:05:04,b'Congress sent bill to president today that would help military vets get health care credentials or licenses. https://t.co/XwSzLJ4k6h',SenatorEnzi,31,16
753367340805423104,2016-07-13 23:15:45,b'Bill would help veterans use training from the military toward a health care career. https://t.co/XwSzLIMJeJ',SenatorEnzi,3,2
753350055994593280,2016-07-13 22:07:04,"b""I intro'd a bill w/ other senators to improve requirements for hospitals operating under the meaningful use program. https://t.co/Tr4sLBLnhB""",SenatorEnzi,1,0
753346873797279744,2016-07-13 21:54:25,"b'As hospitals transition to using electronic health records, regulations should not get in the way of patient care. https://t.co/Tr4sLC2YGb'",SenatorEnzi,3,0
753338477882642432,2016-07-13 21:21:04,b'Language I introduced to help Wyoming small airports get needed funds is expected to be signed into law. https://t.co/p0zfkidzzk',SenatorEnzi,3,1
753332457173241856,2016-07-13 20:57:08,"b'We can unstick the budget gridlock that has gripped DC &amp; put our nation on not just another path, but a better path. https://t.co/eMNP5Lxn8w'",SenatorEnzi,5,6
753328684015247360,2016-07-13 20:42:09,b'Small airports set to receive critical funds with passage of FAA bill. https://t.co/p0zfkivaXU https://t.co/H7I1Mb6ZJQ',SenatorEnzi,4,1
753323990001725440,2016-07-13 20:23:29,"b""America\xe2\x80\x99s budget process is broken, and it is preventing Congress from tackling the fiscal challenges we're facing.\nhttps://t.co/NDbGoDi4Yn""",SenatorEnzi,9,9
753296084152225792,2016-07-13 18:32:36,b'RT @BudgetGOP: @SenatorEnzi: Congress adopted only 7 budgets in previous 15 yrs - Time for #aBetterBudget https://t.co/8H3VCCyn5c https://t\xe2\x80\xa6',SenatorEnzi,0,4
753296029445939200,2016-07-13 18:32:23,"b""RT @BudgetGOP: @SenatorEnzi: Autopay spending is crowding out funding for other programs Time to fix America's #BrokenBudget https://t.co/P\xe2\x80\xa6""",SenatorEnzi,0,3
753253320651857920,2016-07-13 15:42:41,"b""RT @BudgetGOP: TUNE IN: How to fix America's #BrokenBudget process https://t.co/apJpBrUBUx https://t.co/8H3VCCyn5c #aBetterBudget https://t\xe2\x80\xa6""",SenatorEnzi,0,5
753248571357618176,2016-07-13 15:23:48,b'RT @BudgetGOP: ICYMI: @SenatorEnzi to propose bipartisan overhaul of Congress\xe2\x80\x99 #BrokenBudget process https://t.co/bnXSp3Q6zh via @washtimes\xe2\x80\xa6',SenatorEnzi,0,3
753215800882917380,2016-07-13 13:13:35,"b""RT @BudgetGOP: MUST READ: How to Break Through America's Budget Gridlock https://t.co/8Pd5jjfLTZ #aBetterBudget""",SenatorEnzi,0,1
752993797206859777,2016-07-12 22:31:25,"b'RT @BudgetGOP: DYK: On July 12, 1974 the law creating the current budget process was signed into law. https://t.co/47Qpse59yf https://t.co/\xe2\x80\xa6'",SenatorEnzi,0,1
752985970354577409,2016-07-12 22:00:19,"b""Courts points out (again) that the Administration doesn't have the authority to go beyond the law. https://t.co/DisE7nK2jB""",SenatorEnzi,0,0
752972445972246528,2016-07-12 21:06:35,b'Policy proposal does nothing for miners who are not members of the #UMWA https://t.co/YMkE8VhHwC',SenatorEnzi,0,0
752966269482115072,2016-07-12 20:42:02,"b'Miner union agreed to pay its members pensions, agreement not with the federal gov. Fed. gov $19 trillion in debt. https://t.co/YMkE8VhHwC'",SenatorEnzi,2,6
752964004734087168,2016-07-12 20:33:02,"b""Thousands of miners have been laid off because of this Obama's war on coal.  We need to find ways to help them all. https://t.co/YMkE8VhHwC""",SenatorEnzi,2,3
752959245117599744,2016-07-12 20:14:07,b'Gov support for a private pension fund would cost lots of taxpayer $. https://t.co/YMkE8VhHwC',SenatorEnzi,1,1
752952333307293696,2016-07-12 19:46:40,b'Supporting pensions with taxpayer dollars is a slippery slope.\nhttps://t.co/OpZvtWe0Xp',SenatorEnzi,1,0
752852248535990272,2016-07-12 13:08:58,b'RT @RepSanfordSC: Glad to join @SenatorEnzi to introduce One Percent Spending Reduction Act of 2016 aka #PennyPlan   https://t.co/IFCnckKWFk',SenatorEnzi,0,4
752591980534824961,2016-07-11 19:54:45,"b'My state staff will be holding office hours in #Sheridan on Wednesday, July 13. Stop by &amp; share your thoughts. https://t.co/VqpSMfMpnh'",SenatorEnzi,2,1
752575711181959168,2016-07-11 18:50:06,"b'My state staff will be holding office hours in #Worland on Tuesday, July 12. Stop by &amp; share your thoughts. https://t.co/Wp2kkhV9uG'",SenatorEnzi,3,1
752155480412139522,2016-07-10 15:00:15,b'Today we celebrate the cowboy way and everything that we have accomplished as a state. https://t.co/Zusbcmck2W',SenatorEnzi,28,11
752110234936619008,2016-07-10 12:00:28,b'It\xe2\x80\x99s wonderful Wyoming\xe2\x80\x99s birthday! #44state #WyoHistory https://t.co/X2qrd3mEE5',SenatorEnzi,10,7
751529556389949440,2016-07-08 21:33:03,b'Fed gov needs to learn how to spend within its means. It can learn from Wyoming. https://t.co/W9ALGxoyv2',SenatorEnzi,2,3
751499363516452864,2016-07-08 19:33:05,"b'If Wyoming can find a way to cut its budget, the federal government should be able to do the same. https://t.co/W9ALGxoyv2'",SenatorEnzi,4,1
751480890044198912,2016-07-08 18:19:40,b'Time for Congress to take a page out of Wyoming\xe2\x80\x99s fiscal handbook. Learn more here: https://t.co/4bFwYLvyM0\nhttps://t.co/Zx0TYgQ4pm',SenatorEnzi,4,3
751415046400380928,2016-07-08 13:58:02,b'New legislation would end government overspending and balance the budget with a simple solution. https://t.co/XCE8NmuAXX',SenatorEnzi,4,1
751215489922117633,2016-07-08 00:45:04,b'#PennyPlan would balance the #budget by cutting the equivalent of one penny from every dollar for 5 years. https://t.co/XCE8NmuAXX',SenatorEnzi,6,3
751202903461814273,2016-07-07 23:55:03,b'#PennyPlan is a simple &amp; smart solution to balance the budget. https://t.co/XCE8NmuAXX https://t.co/r4vrr1ob3L',SenatorEnzi,6,1
751190250828001285,2016-07-07 23:04:46,"b""Intro'd #PennyPlan bill w/ @RepSanfordSC to balance the budget in 5 years by cutting 1% of government spending. https://t.co/XCE8NmMcmx""",SenatorEnzi,7,5
749982368044240896,2016-07-04 15:05:05,b'God bless this nation and all those who live in this land of liberty! https://t.co/UGkddgAfpV',SenatorEnzi,22,9
749937577038229504,2016-07-04 12:07:06,b'Happy Independence Day! https://t.co/B7ZC9UA6qN',SenatorEnzi,14,4
749287030295670784,2016-07-02 17:02:03,b'Wyoming has a new test center designed to spur innovation from carbon capture emissions. https://t.co/tYG9klcU3N',SenatorEnzi,2,1
749242491803537409,2016-07-02 14:05:04,b'Investing in Wyoming coal and the nation\xe2\x80\x99s future through innovation. https://t.co/tYG9klcU3N',SenatorEnzi,1,0
749024556656930816,2016-07-01 23:39:05,"b""Are you a student interested in gov't? I encourage you to apply for my #Internship in DC. https://t.co/PoEaVa7c6k https://t.co/L75rhquwwz""",SenatorEnzi,1,4
749018485909549056,2016-07-01 23:14:57,"b""RT @RoyBlunt: 5 Key Facts that Upend Dems' #Zika Blame Game --&gt; https://t.co/JYviLuhCxb #ZikaVirus""",SenatorEnzi,0,32
748951456879878144,2016-07-01 18:48:36,"b'Apply for my 2016 fall #Internship, a great opportunity for college students. https://t.co/PoEaVaoNuU https://t.co/JjkfPV1SKD'",SenatorEnzi,1,3
748649593705902081,2016-06-30 22:49:07,"b'Obama Administration should be working to help support innovation in the coal industry, not destroy it. https://t.co/yCHmW2oRip'",SenatorEnzi,7,1
748631470600822784,2016-06-30 21:37:06,b'New regulations from Obama Administration are sham aimed at attacking coal and fossil fuels. https://t.co/yCHmW27gqR',SenatorEnzi,1,5
