id,created_at,text,user,favorite_count,retweet_count
935645030873817088,2017-11-28 23:02:13,"b'The Tax Cuts &amp; Jobs Act will raise incomes, add jobs and boost economic growth \xe2\x80\x93 it will not hurt the poor as some\xe2\x80\xa6 https://t.co/d4t1eBm1da'",SenatorEnzi,9,6
935601120533245954,2017-11-28 20:07:44,b'RT @BudgetGOP: BREAKING NEWS - Senate Budget Committee Reports FY 2018 Budget Reconciliation Legislation focused on #TaxReform https://t.co\xe2\x80\xa6',SenatorEnzi,0,222
935600979558445057,2017-11-28 20:07:10,b'RT @GOPSenFinance: The Tax Cuts and Jobs Act will now head to the Senate floor for an open amendment process. Hats off to Chairman @Senator\xe2\x80\xa6',SenatorEnzi,0,93
935558655696625665,2017-11-28 17:19:00,b'RT @SenToomey: The reality is that the American family is going to owe less money to Uncle Sam. Check out this video from @GOPSenFinance on\xe2\x80\xa6',SenatorEnzi,0,52
934421423518633985,2017-11-25 14:00:02,"b'Small, locally-owned businesses are an integral part of our communities, so let\xe2\x80\x99s get out there and show our apprec\xe2\x80\xa6 https://t.co/IGUL8jA0aj'",SenatorEnzi,13,8
934415122696617984,2017-11-25 13:35:00,b'Tucked between Black Friday and Cyber Monday is one of the most important shopping days of the year: Small Business\xe2\x80\xa6 https://t.co/YPoOVt37oy',SenatorEnzi,45,23
933689096932904961,2017-11-23 13:30:02,b'Our ties to home grow stronger during this special time of year. Family and friends return home and people come tog\xe2\x80\xa6 https://t.co/yX9304nXsC',SenatorEnzi,26,9
933043586811158529,2017-11-21 18:45:00,"b'If you\xe2\x80\x99re planning a trip to DC, consider visiting the one-of-a-kind collection at the Museum of the Bible. https://t.co/1RupPRptEp'",SenatorEnzi,18,8
933031614308929536,2017-11-21 17:57:26,b'The Museum of the Bible lets folks learn about the role of the Bible in history and culture. I cosponsored a resolu\xe2\x80\xa6 https://t.co/5LxmYqC9yf',SenatorEnzi,9,4
932738075125567488,2017-11-20 22:31:01,b'What does the Senate tax reform bill mean for Wyoming? It means letting people keep more of what they earn. https://t.co/tBfBSVfYcQ',SenatorEnzi,10,4
931877154769588224,2017-11-18 13:30:01,"b'Nov 18 is National Adoption Day. Together, we can raise awareness for the children in need of supportive and loving\xe2\x80\xa6 https://t.co/GIUAf6NUon'",SenatorEnzi,19,9
931371820854284290,2017-11-17 04:02:00,b'Glad the Senate Finance Committee moved the tax reform proposal forward today. Tax reform is about putting more mon\xe2\x80\xa6 https://t.co/0pbj2QoV31',SenatorEnzi,21,10
931367381204692997,2017-11-17 03:44:22,b'I applaud the Senate Finance Committee\xe2\x80\x99s passage of the #TaxReform bill to help provide tax relief across every tax\xe2\x80\xa6 https://t.co/uBZsV3heeB',SenatorEnzi,24,17
931281443304738818,2017-11-16 22:02:53,b'Glad Senate passed the 2018 NDAA bill which would help strengthen our country\xe2\x80\x99s national security. Would authorize\xe2\x80\xa6 https://t.co/6v5z9GGiKM',SenatorEnzi,12,6
931222614542036997,2017-11-16 18:09:07,"b'The Congressional Award is celebrating its 38th anniversary. Created by Wyoming Senator Malcolm Wallop, this import\xe2\x80\xa6 https://t.co/5P1jhytcDp'",SenatorEnzi,12,4
930947289291485184,2017-11-15 23:55:04,b'People shouldn\xe2\x80\x99t have to worry about being fined by the government because they can\xe2\x80\x99t afford to buy health insuranc\xe2\x80\xa6 https://t.co/HMj3A4w6aC',SenatorEnzi,57,23
930939735291207681,2017-11-15 23:25:03,b'Repealing the individual mandate wouldn\xe2\x80\x99t kick anyone off their insurance according to the independent Joint Commit\xe2\x80\xa6 https://t.co/JVGGBAu84C',SenatorEnzi,16,7
930937350787657728,2017-11-15 23:15:35,b'Repealing the individual mandate tax is about letting people make their own choices without the \xe2\x80\x9chelp\xe2\x80\x9d of the feder\xe2\x80\xa6 https://t.co/D8CyKV5ql1',SenatorEnzi,11,11
930580375398522880,2017-11-14 23:37:05,b'Independent analysis of the Senate tax proposal show it would provide tax breaks for all tax brackets &amp; increase jo\xe2\x80\xa6 https://t.co/n8QO2dCAC6',SenatorEnzi,28,12
930573174915420161,2017-11-14 23:08:28,"b""It's easier to kill a bill than pass it. I hope committee members will offer improvements to the Senate tax bill, n\xe2\x80\xa6 https://t.co/eatUwleNHB""",SenatorEnzi,9,7
930464042803744770,2017-11-14 15:54:49,b'Every business has a story. I would like to hear them. Do you know of a Wyoming business with unique signs or perso\xe2\x80\xa6 https://t.co/PZ2Ro0Emix',SenatorEnzi,3,4
930239374914076673,2017-11-14 01:02:04,b'Tax reform is about simplifying an outdated and messy tax code that hasn\xe2\x80\x99t been updated since 1986. https://t.co/FeqKH7ZsU1',SenatorEnzi,19,6
930238541526962179,2017-11-14 00:58:45,b'Over 300 amendments have been filed in committee on the Senate #TaxReform plan &amp; eventually every senator will be a\xe2\x80\xa6 https://t.co/j5NQqrO3KO',SenatorEnzi,6,4
930233598300577792,2017-11-14 00:39:07,"b'#TaxReform is about putting more money back in people\xe2\x80\x99s pockets to create more jobs, grow the economy and help hard\xe2\x80\xa6 https://t.co/xZwsY7vMsG'",SenatorEnzi,17,8
930192123030327302,2017-11-13 21:54:18,b'Great to see folks in Wyoming gathering to pay tribute to our veterans over the weekend at Sage Elementary in Rock\xe2\x80\xa6 https://t.co/GsFz8QDoJX',SenatorEnzi,11,3
929415001751744512,2017-11-11 18:26:18,"b'Our communities, throughout our state and all across the country are better places for us to live because of our ve\xe2\x80\xa6 https://t.co/Fwn1q7kOEC'",SenatorEnzi,31,5
929343002060914690,2017-11-11 13:40:12,"b'This Veterans Day, remember to thank a veteran for what we have received from their efforts. https://t.co/HpuSGG2pDm'",SenatorEnzi,71,34
928765629234122752,2017-11-09 23:25:56,"b'Meaningful #TaxReform will not only simplify our taxes, but help grow the economy, create more jobs and raise wages. https://t.co/uNDirACzqW'",SenatorEnzi,11,3
928765474158055424,2017-11-09 23:25:19,"b'The Senate Finance Committee released a #TaxReform proposal today to help boost America\xe2\x80\x99s economy, create more jobs\xe2\x80\xa6 https://t.co/aXgoBFEKrR'",SenatorEnzi,7,8
928765135337947136,2017-11-09 23:23:58,"b'A lot of things have changed since 1986, but unfortunately our tax code isn\xe2\x80\x99t one of them. #TaxReform'",SenatorEnzi,6,6
928350486792728576,2017-11-08 19:56:18,"b'RT @GOPSenFinance: Finance Committee Republicans are ready to deliver #TaxReform that will create more jobs, increase paychecks and make th\xe2\x80\xa6'",SenatorEnzi,0,17
925806568796499968,2017-11-01 19:27:41,b'Why are we working on tax reform? To put more money in the pockets of folks across the country. https://t.co/Nr4rXQcxoa',SenatorEnzi,17,5
925760950560542721,2017-11-01 16:26:25,b'Why tax reform? https://t.co/lVSClm55Kk',SenatorEnzi,11,10
925414204584185856,2017-10-31 17:28:34,"b""RT @MarketInstitute: WATCH: @CharlesSauer travels to Wyoming for @SenatorEnzi's #Inventor Conference https://t.co/JVHZRlHzvl #innovation #p\xe2\x80\xa6""",SenatorEnzi,0,3
923915005229256705,2017-10-27 14:11:17,b'I\xe2\x80\x99m pleased to see Wyoming rated the \xe2\x80\x9cfriendliest\xe2\x80\x9d state in the country for small businesses! Just one more reason\xe2\x80\xa6 https://t.co/pg7pgXrJo7',SenatorEnzi,26,7
923615264339628035,2017-10-26 18:20:13,"b'When the system fails those who never failed us, trust degrades. We can do better than this. https://t.co/dtAmWBcy4e https://t.co/lbUQJtrzPf'",SenatorEnzi,7,6
923605395658215424,2017-10-26 17:41:00,b'The consequences of the poorly-run VA Choice program are ultimately borne by our veterans. It is imperative that we improve the program.',SenatorEnzi,7,8
923605314590691333,2017-10-26 17:40:41,"b'I continue to hear stories about veterans who can\xe2\x80\x99t get care under VA Choice, and providers who can\xe2\x80\x99t get paid. https://t.co/3iYSyUzV8U'",SenatorEnzi,7,7
923605237751078913,2017-10-26 17:40:23,b'I spoke on the Senate floor about the need to help our veterans. We must improve the Veterans Choice Program. https://t.co/YDQL3XFbzg',SenatorEnzi,13,3
923569795341193218,2017-10-26 15:19:32,"b'Burdening our energy industry seemed to be a major focus of the last Administration, and it hit Wyoming hard. It\xe2\x80\x99s\xe2\x80\xa6 https://t.co/siUH9WfQLE'",SenatorEnzi,12,7
923567156708638720,2017-10-26 15:09:03,"b""RT @BudgetGOP: BREAKING - House approves Senate's FY 2018 #Budget - paving the way for historic #TaxReform - https://t.co/ezEYEPOCoe""",SenatorEnzi,0,7
923551011964358656,2017-10-26 14:04:54,b'Many of us in Congress have already been helping our energy sector to break free and we\xe2\x80\x99ll continue.',SenatorEnzi,9,3
923550907408756737,2017-10-26 14:04:29,b'I appreciate the Department of Interior\xe2\x80\x99s review of actions that could needlessly burden energy production. https://t.co/yp9lBy1anQ',SenatorEnzi,10,12
923243132963246081,2017-10-25 17:41:30,b'Yesterday the Senate reversed a Consumer Financial Protection Bureau rule that would have benefited trial lawyers m\xe2\x80\xa6 https://t.co/VmytsfVMMB',SenatorEnzi,13,11
922949070586494976,2017-10-24 22:13:00,b'Glad the nominee to be the next Commissioner of U.S. Customs &amp; Border Protection has pledged to enforce sugar trade\xe2\x80\xa6 https://t.co/yIOimqh1tN',SenatorEnzi,12,7
922940125419536385,2017-10-24 21:37:27,b'More info here: https://t.co/MQGSz9BLau',SenatorEnzi,5,4
922939939754561542,2017-10-24 21:36:43,b'Received commitments from U.S. Customs &amp; Border Protection nominee on Wyoming issues w/ Casper\xe2\x80\x99s airport &amp; sugar tr\xe2\x80\xa6 https://t.co/oLPYF3QgVA',SenatorEnzi,6,5
922871933397585920,2017-10-24 17:06:29,b'Big thanks to @DevelopGoshenWY for their help with the Inventors Conference on Saturday. https://t.co/SgQPa1WER1',SenatorEnzi,10,4
922822086367875072,2017-10-24 13:48:25,"b'It was also great to stop by The Bread Doctor in Torrington. They feature their own inventions - but with flour, eg\xe2\x80\xa6 https://t.co/KbNQgm1xDG'",SenatorEnzi,9,5
922821798164647936,2017-10-24 13:47:16,b'Another successful Inventors Conference over the weekend. Speakers were informative &amp; set great examples for Wyomin\xe2\x80\xa6 https://t.co/bOY1Z8UxnL',SenatorEnzi,18,7
921752303970926592,2017-10-21 14:57:29,"b""RT @DevelopGoshenWY: @SenatorEnzi kicks off the Inventor's Conference at @EasternWyoming today with our very own Ashley Harpstreith is the\xe2\x80\xa6""",SenatorEnzi,0,7
921466555719933952,2017-10-20 20:02:01,b'Thanks to Senate colleagues for cooperating on the budget and helping us pass it in an open and quick process. https://t.co/qFE2XYg58j',SenatorEnzi,18,9
921457675879186433,2017-10-20 19:26:44,b'I appreciate that this year\xe2\x80\x99s Senate budget was civil and that senators from both sides offered relevant amendments\xe2\x80\xa6 https://t.co/jBjTL2bxNF',SenatorEnzi,7,4
921457391564181504,2017-10-20 19:25:36,b'The budget will allow the Senate Finance Committee to finalize a tax plan that could help all income brackets by investing more in people.',SenatorEnzi,9,5
921457204733104128,2017-10-20 19:24:52,"b'We did it. The Senate passed a budget resolution last night after a more open, honest and transparent process. https://t.co/12PPoT2H2d'",SenatorEnzi,44,14
921196833820610560,2017-10-20 02:10:14,"b""RT @SenateMajLdr: The #Senate has passed the 2018 #Budget. Thank you @SenatorEnzi &amp; @BudgetGOP for all of your hard work. Now it's time for\xe2\x80\xa6""",SenatorEnzi,0,270
921189195049242624,2017-10-20 01:39:53,b'RT @SenateGOP: The Senate Republicans just passed a budget that will open the door for tax reform to revitalize the American economy. https\xe2\x80\xa6',SenatorEnzi,0,466
921189005257007104,2017-10-20 01:39:08,b'RT @BudgetGOP: BREAKING - Senate Approves FY 2018 #Budget Resolution Clearing the Way for #TaxReform https://t.co/zOT6lX8h63 https://t.co/O\xe2\x80\xa6',SenatorEnzi,0,8
920769961609408512,2017-10-18 21:54:00,b'Talk about a swamp - our economy has been in stagnant growth for 8 years. Our budget would allow us to improve the\xe2\x80\xa6 https://t.co/Rss0Vsw7z4',SenatorEnzi,18,11
920761376473255937,2017-10-18 21:19:53,"b'The budget we are considering now would allow us the opportunity to declutter our tax code, make it simpler.  It ce\xe2\x80\xa6 https://t.co/DGNiU7WYdE'",SenatorEnzi,9,4
920761292356546560,2017-10-18 21:19:33,"b'Taxes vs. Tolstoy? Sorry, Leo. The tax code is miles longer and some would even say more complex than War and Peace\xe2\x80\xa6 https://t.co/zk5i1zdvry'",SenatorEnzi,22,8
920400708901462016,2017-10-17 21:26:43,"b'If Congress &amp; the Administration can adhere to this budget blueprint, we\xe2\x80\x99ll be on a better fiscal track with a comb\xe2\x80\xa6 https://t.co/jxVnpI4OFp'",SenatorEnzi,3,6
920400620095451136,2017-10-17 21:26:22,"b'Our nation needs a simpler, fairer and more transparent tax system that will leave more dollars in the pockets of w\xe2\x80\xa6 https://t.co/th2WYW8inl'",SenatorEnzi,7,4
920400531541184517,2017-10-17 21:26:01,"b'Senate began debating the budget blueprint today, which is the first step in providing Congress w/ tools it needs t\xe2\x80\xa6 https://t.co/MfRykGbZNj'",SenatorEnzi,16,13
920326923913515010,2017-10-17 16:33:32,"b'RT @BudgetGOP: ""This budget reflects our belief in the American spirit."" @SenatorEnzi https://t.co/sFIDA6XX4D #TaxReform https://t.co/PEHBp\xe2\x80\xa6'",SenatorEnzi,0,16
920326180233981952,2017-10-17 16:30:34,b'RT @BudgetGOP: BREAKING NEWS - Senate Begins Debate on FY 2018 #Budget Resolution Supporting #TaxReform to Help American Families https://t\xe2\x80\xa6',SenatorEnzi,0,3
920313998037475330,2017-10-17 15:42:10,b'I am glad to hear the EPA wants to undo the dangerous practices of \xe2\x80\x98sue and settle\xe2\x80\x99 set under the Obama Administrat\xe2\x80\xa6 https://t.co/AdTdOwEVqa',SenatorEnzi,3,4
919969477974003713,2017-10-16 16:53:10,"b""If you're a high school junior &amp; want a unique experience, apply to be a U.S. Senate page this spring. Don't miss o\xe2\x80\xa6 https://t.co/FOdJw2A3fY""",SenatorEnzi,1,3
919929424371441664,2017-10-16 14:14:00,b'It\xe2\x80\x99s vital for workers to be aware of saving options &amp; understand the importance of retirement planning. https://t.co/NBAn2WqrbZ',SenatorEnzi,5,3
919920114928992256,2017-10-16 13:37:01,"b'Regardless of age, it\xe2\x80\x99s never too early to look at options to provide financial security you\xe2\x80\x99ll need in the future. https://t.co/NBAn2WI23x'",SenatorEnzi,2,2
919913669705814016,2017-10-16 13:11:24,b'Introduced a resolution to designate Oct 15-21 as National Retirement Security Week. https://t.co/NBAn2WqrbZ',SenatorEnzi,3,3
918585162455244801,2017-10-12 21:12:23,b'I appreciate @realDonaldTrump taking action to provide relief to Americans struggling under the failures of Obamaca\xe2\x80\xa6 https://t.co/qV7j5Y2kmV',SenatorEnzi,8,5
918576527712882689,2017-10-12 20:38:05,b'Action today by @realDonaldTrump is similar to my legislation to provide better health care options for employees o\xe2\x80\xa6 https://t.co/NWK2IoVfU5',SenatorEnzi,4,6
918557925911814145,2017-10-12 19:24:10,"b""Appreciate that @realDonaldTrump's executive order today included change I have worked on to allow small businesses\xe2\x80\xa6 https://t.co/Kvg5FLycW0""",SenatorEnzi,24,3
918178774746836993,2017-10-11 18:17:33,b'RT @Interior: Enjoy a close encounter with the outdoors @DevilsTowerNM. Pic by Lori Eckhart #Wyoming https://t.co/oyIDdDJJ3I',SenatorEnzi,0,264
917846183162281986,2017-10-10 20:15:57,b'REMINDER: The deadline for Wyoming students to apply for a nomination to a U.S. Military Service Academy is one mon\xe2\x80\xa6 https://t.co/IJuvGEdRw7',SenatorEnzi,1,5
917814992002584577,2017-10-10 18:12:00,b'It is great to see the Trump Administration taking action to roll back the unfair and poorly-named Clean Power Plan. https://t.co/saSpXiKKY9',SenatorEnzi,13,15
917808210790187008,2017-10-10 17:45:04,b'I join @SenJohnBarrasso &amp; @RepLizCheney in applauding the EPA\xe2\x80\x99s decision to end the Obama-era Clean Power Plan regu\xe2\x80\xa6 https://t.co/74dcOgE8L2',SenatorEnzi,5,4
917801492182167552,2017-10-10 17:18:22,b'The Clean Power Plan was a direct attack on coal. I applaud Trump Administration for proposing a new rule to end th\xe2\x80\xa6 https://t.co/w1ucJ5tSdp',SenatorEnzi,12,7
916049097236328449,2017-10-05 21:14:58,"b""Pleased Budget Committee approved '18 Budget Resolution. Would help enact tax reform &amp; encourage policies to help W\xe2\x80\xa6 https://t.co/RLN3PB5Nco""",SenatorEnzi,9,6
916038978532466689,2017-10-05 20:34:46,"b'It also encourages committees to act on legislation addressing forest health &amp; wildfire prevention, state mineral r\xe2\x80\xa6 https://t.co/hT9IBpYKPZ'",SenatorEnzi,5,5
916038924723736576,2017-10-05 20:34:33,b'This budget is a step toward a brighter future. By allowing families and small businesses to keep more of their har\xe2\x80\xa6 https://t.co/dv0xUVGhEl',SenatorEnzi,12,8
916038748349059072,2017-10-05 20:33:51,b'Today the Budget Committee approved the 2018 Budget Resolution focused on providing Congress w/ tools to enact tax\xe2\x80\xa6 https://t.co/dzTYDsr93m',SenatorEnzi,8,9
915969090421952514,2017-10-05 15:57:03,b'RT @BudgetGOP: LIVE NOW on @cspan - Senate Budget Committee continues its markup of the FY 2018 #Budget focused on #TaxReform https://t.co/\xe2\x80\xa6',SenatorEnzi,0,5
915698365995905024,2017-10-04 22:01:17,b'Glad to hear the BLM is proposing delaying the duplicative and harmful methane rule. Hopefully this leads to them e\xe2\x80\xa6 https://t.co/B3TSC16FQ0',SenatorEnzi,11,4
915691094150668288,2017-10-04 21:32:24,"b'Today the BLM proposed delaying the methane rule. This is good news, but eventually, they need to get rid of the ru\xe2\x80\xa6 https://t.co/nF0pW8a9W3'",SenatorEnzi,8,4
915658062198960130,2017-10-04 19:21:08,"b'RT @BudgetGOP: Our nation needs a simpler, fairer, &amp; more transparent tax system that will leave more $$ in the pockets of working families\xe2\x80\xa6'",SenatorEnzi,0,4
915289915323244544,2017-10-03 18:58:15,"b'Congrats to Burlington Elementary School, Sheridan Junior High School and Sheridan\xe2\x80\x99s Woodland Park Elementary Schoo\xe2\x80\xa6 https://t.co/bhGtoyIdKC'",SenatorEnzi,5,4
915267276160536577,2017-10-03 17:28:18,"b'RT @BudgetGOP: SAVE THE DATE: Senate Budget Committee to Mark Up FY 2018 #Budget Resolution, Oct. 4 and Oct. 5 #TaxReform https://t.co/qC3c\xe2\x80\xa6'",SenatorEnzi,0,6
915201729372835840,2017-10-03 13:07:50,b'Great to attend the Wyoming Buddy Walk and Veterans Memorial Plaza re-dedication ceremony in Laramie. Also spoke at\xe2\x80\xa6 https://t.co/p8rJnSpMd9',SenatorEnzi,7,6
914853595169869824,2017-10-02 14:04:28,b'A senseless act of violence that is difficult to comprehend. God bless the emergency service members who responded to help save lives.',SenatorEnzi,28,7
914853541453365253,2017-10-02 14:04:16,b'Our thoughts and prayers are with the victims and their family members affected by the terrible tragedy in #LasVegas.',SenatorEnzi,29,9
914126184266350592,2017-09-30 13:54:00,b'How it\xe2\x80\x99s made: Sugar from Wyoming sugar beets. Congratulations on 100 years! https://t.co/m6icAHjfXI',SenatorEnzi,9,4
913793344064622592,2017-09-29 15:51:25,b'RT @BudgetGOP: BREAKING - Enzi Unveils FY 2018 #Budget Resolution Supporting Tax Reform to Help American Families #TaxReform https://t.co/E\xe2\x80\xa6',SenatorEnzi,0,7
913793320467525632,2017-09-29 15:51:19,b'RT @elwasson: NEWS:  Senate budget unveiled    https://t.co/uDIzeRk7Gn',SenatorEnzi,0,25
913428336927498240,2017-09-28 15:41:00,b'Military service academies open doors &amp; provide experiences graduates will carry with them throughout their careers. https://t.co/asE1A3SGlf',SenatorEnzi,0,2
913414028399169536,2017-09-28 14:44:09,"b'Each year, I\xe2\x80\x99m able to nominate a select few to the U.S. military service academies. The deadline is Nov 10.\xe2\x80\xa6 https://t.co/lmN4OHSVd8'",SenatorEnzi,3,4
913164848950689792,2017-09-27 22:14:00,"b'The Voluntary Protection Program is a win for employers, employees &amp; the fed gov. Time to make it permanent. https://t.co/dxI5908wfc'",SenatorEnzi,2,3
913157803048660993,2017-09-27 21:46:00,b'Introduced bill with @SenBennetCo to set into law a successful worker safety program. https://t.co/dxI590q7DM',SenatorEnzi,2,2
913156649170423808,2017-09-27 21:41:25,b'Hard-working Americans deserve a tax system that works for everyone and will put more money in the pockets every American.',SenatorEnzi,3,2
913156589556822022,2017-09-27 21:41:11,b'Great to attend the unveiling of the tax reform framework with leaders in the House and Senate. https://t.co/aUhYrkBcxK',SenatorEnzi,0,1
913150339397902339,2017-09-27 21:16:21,b'The Voluntary Protection Program has proven its worth by saving gov and businesses hundreds of millions of dollars\xe2\x80\xa6 https://t.co/vLxW8VUGAv',SenatorEnzi,1,4
913116280974168065,2017-09-27 19:01:00,"b'Tax relief helps grow economy because Americans, not the fed gov, know best how to spend their hard-earned money. https://t.co/VdNx6E0agg'",SenatorEnzi,60,20
913107222036664320,2017-09-27 18:25:01,b'Congress needs pass meaningful tax reform that will make our tax code simpler and fairer for all Americans. https://t.co/VdNx6E0agg',SenatorEnzi,10,4
913100941829840898,2017-09-27 18:00:03,b'Why tax reform? Because high paychecks \xe2\x86\x92 business growth \xe2\x86\x92 more jobs \xe2\x86\x92 more competition \xe2\x86\x92 higher wages.\xe2\x80\xa6 https://t.co/zXoABjGP1f',SenatorEnzi,7,5
913098809290436608,2017-09-27 17:51:35,b'America needs tax reform to jumpstart our economy. https://t.co/VdNx6E0agg',SenatorEnzi,7,5
913045864381321217,2017-09-27 14:21:12,b'Today my staff will be at the UW BIG Job Fair to talk about internships in my D.C. office. https://t.co/DAGuCqOfgo',SenatorEnzi,4,3
912782477793595392,2017-09-26 20:54:36,"b'My staff will be at the UW BIG Job Fair on Wed., Sept 27 to talk about my internship program. https://t.co/jpxP8qUcEk'",SenatorEnzi,1,4
912362471490547717,2017-09-25 17:05:38,b'Speakers and inventors will share knowledge and expertise. It is free and open to the public. Hope to see you there. https://t.co/fsHz3ahA1K',SenatorEnzi,4,3
912362404318781441,2017-09-25 17:05:22,"b'If you\xe2\x80\x99re an inventor, I encourage you to attend my Inventors Conference. Learn how to turn an idea into a reality. https://t.co/7NtbYPzqUG'",SenatorEnzi,3,3
912321275116257281,2017-09-25 14:21:56,"b'Interested in an internship in my D.C. office? Learn more at the UW BIG Job Fair on Wed., Sept. 27. https://t.co/DAGuCqOfgo'",SenatorEnzi,2,4
911300187003420673,2017-09-22 18:44:30,b'We have to continue to promote the concept of service to others. I encourage young volunteers to apply for this award.',SenatorEnzi,3,2
911299846765719552,2017-09-22 18:43:09,"b'If you\xe2\x80\x99ve volunteered within the past year, consider applying for the Prudential Spirit of Community Award by Nov 7. https://t.co/hIMXNVk6y5'",SenatorEnzi,2,2
909930539452420096,2017-09-19 00:02:00,b'The world is a dangerous place and it is important that we as a nation are prepared. #NDAA\n https://t.co/VNpKwhPFR9 https://t.co/GfVUAi7ywR',SenatorEnzi,3,3
909918711112486913,2017-09-18 23:15:00,"b'Senate passed a defense bill to authorize significant resources for our military, strengthening national security.\xe2\x80\xa6 https://t.co/4LsZRc0z4C'",SenatorEnzi,10,7
909803008380334080,2017-09-18 15:35:15,b'Happy 70th birthday to our outstanding @usairforce. https://t.co/hz4dRBIsq0',SenatorEnzi,17,9
909065588970082304,2017-09-16 14:45:00,b'I saw this on a coaster in Yellowstone and thought it was good advice coming from Wyoming\xe2\x80\x99s state mammal. https://t.co/oGmjhbhPU3',SenatorEnzi,75,32
908467900368990210,2017-09-14 23:10:00,"b""Intro'd bill to allow small businesses to work together to provide better health insurance for their employees.\xe2\x80\xa6 https://t.co/HOmcHI63EP""",SenatorEnzi,13,5
908451212957241344,2017-09-14 22:03:42,b'Introduced bill to allow small businesses to provide better health care for employees. https://t.co/lh8L5DSvou https://t.co/64F2XYGT7z',SenatorEnzi,4,2
907682475534667777,2017-09-12 19:09:00,b'Called on Congress w/ @SenatorBurr to ensure IRS does not continue to hire employees with history of misconduct. https://t.co/l3QMrVvLBZ',SenatorEnzi,20,16
907670311046348805,2017-09-12 18:20:40,b'IRS should have to consider history of misconduct when rehiring former employees. #CommonSense  https://t.co/l3QMrVvLBZ',SenatorEnzi,7,6
907372435330052096,2017-09-11 22:37:01,"b'Waivers to #Obamacare could provide health care flexibility, but governors say the process takes too long.\xe2\x80\xa6 https://t.co/hYAWOdaBZx'",SenatorEnzi,4,5
907361177092714496,2017-09-11 21:52:17,"b'Governors indicated flexibility for states, along with less bureaucracy, could help improve our #healthcare system.\xe2\x80\xa6 https://t.co/lLTLWRXQ3p'",SenatorEnzi,11,9
907305114960097280,2017-09-11 18:09:30,"b'Despite being a nation of individuals with our own stories, ambitions and plans for our lives, today we come togeth\xe2\x80\xa6 https://t.co/xbWgQWTxRB'",SenatorEnzi,29,7
907222192777252864,2017-09-11 12:40:00,"b'September 11, 2001 was a day our country will never forget. The memory of the Americans who lost their lives remain\xe2\x80\xa6 https://t.co/D0DZJAQqWM'",SenatorEnzi,22,12
905529989986123776,2017-09-06 20:35:48,"b'I appreciated suggestions for increasing choice, especially allowing small businesses to pool together to offer better health insurance.'",SenatorEnzi,9,5
905529597718093825,2017-09-06 20:34:14,b'Today was the first of four HELP Committee hearings on stabilizing the market and making health care more affordabl\xe2\x80\xa6 https://t.co/swSofS0nhZ',SenatorEnzi,15,6
