id,created_at,text,user,favorite_count,retweet_count
536934211035623425,2014-11-24 17:27:46,"b'RT @SenateHistory: #OTD in 1929, Francis Warren of #Wyoming, the last Union veteran in the #Senate, died http://t.co/055IcYdbYD http://t.co\xe2\x80\xa6'",SenatorEnzi,0,14
535834687114317824,2014-11-21 16:38:39,"b""Fact checking President Obama's amnesty speech from Thursday night. http://t.co/8qvKxqJ1yU""",SenatorEnzi,1,2
535608169113059328,2014-11-21 01:38:33,"b'By circumventing Congress on immigration, President Obama is eroding the very foundation of our country and form of government.'",SenatorEnzi,8,22
535607799200612352,2014-11-21 01:37:05,b'Each branch of government is to act as a check against the others and not sit idly by as one exercises authority it does not have.',SenatorEnzi,10,19
535568394251018242,2014-11-20 23:00:30,"b""From legislation to letters, the Enzi Insider is a great way to stay informed on what I'm working on in Washington. http://t.co/kX9gs2pWLl""",SenatorEnzi,1,1
535558357508440066,2014-11-20 22:20:37,"b""Want to stay informed on what I'm working on in Washington? Take a look at the Enzi Insider! http://t.co/nBlbYhxtZD""",SenatorEnzi,1,0
535237388914536448,2014-11-20 01:05:12,b'Executive amnesty is wrong. The president is contradicting his own words. http://t.co/9mPasIQCak',SenatorEnzi,3,10
535203201784770560,2014-11-19 22:49:21,b'President Obama himself has called into question the executive actions he is contemplating on immigration.  http://t.co/HTlt0iK7LC',SenatorEnzi,0,9
534873795622748160,2014-11-19 01:00:25,b'Responses to disasters should be guided and directed by those closest to the folks back home. http://t.co/dZZOKQypxl',SenatorEnzi,0,2
534863665074171904,2014-11-19 00:20:09,b'#KeystoneXL Pipeline should move forward. I\xe2\x80\x99m hopeful it will when there is new majority in Senate.',SenatorEnzi,5,3
534859894193545216,2014-11-19 00:05:10,b'Approving the #KeystoneXL Pipeline was right six years ago and now.',SenatorEnzi,6,4
534857840444571648,2014-11-18 23:57:00,"b'I voted for the #KeystoneXL Pipeline today, but a majority of Senate Democrats voted it down.'",SenatorEnzi,6,6
534842670230011904,2014-11-18 22:56:44,b'Spoke at hearing today about ensuring that natural disaster relief is directed to those who need it the most. http://t.co/ONIVemE9Dk',SenatorEnzi,1,3
534474544174858241,2014-11-17 22:33:56,b'Thanks to the team at SignBoss for the tour in Gillette. Great to hear about their expansion. #WyoWorks http://t.co/I5tGi2MmQ9',SenatorEnzi,0,2
534474137180585984,2014-11-17 22:32:19,b'Thanks to CEO Brian Worthen explaining how Visionary found success providing internet. #WyoWorks http://t.co/ncrdDaGMQD',SenatorEnzi,0,0
533756343778156546,2014-11-15 23:00:03,b'Visited Rehab Solutions in Gillette to talk about ways they treat patients to heal quicker with less cost. #WyoWorks http://t.co/pOktZNWjj6',SenatorEnzi,2,1
533696015807700993,2014-11-15 19:00:20,"b""I was proud &amp; impressed to talk with the Gillette Chamber of Commerce '14 Young Entrepreneur Academy class. #WyoWorks http://t.co/Z8Lu536MW8""",SenatorEnzi,1,1
533665816986673152,2014-11-15 17:00:20,b'Stopped at Unkers in Upton on Oct 31 to see how they makes their multi-purpose therapeutic products. #WyoWorks http://t.co/48turQVpUS',SenatorEnzi,3,1
533605417813696512,2014-11-15 13:00:20,b'Had fun at Deluxe Harley Davidson in Sundance. Great to see them working w/ Wyo Tourism Dept to help Wyo. #WyoWorks http://t.co/dYTaGA0NUt',SenatorEnzi,2,1
533394004042194944,2014-11-14 23:00:15,b'Great lunch with the Laramie Chamber Business Alliance Young Professionals on October 27. #WyoWorks http://t.co/tMEH6M7xxv',SenatorEnzi,1,1
533368799303827457,2014-11-14 21:20:05,"b'Vacutech moved their headquarters to Sheridan in 2011, recognizing the great business benefits in Wyoming. #WyoWorks http://t.co/dnSr4NL0Xf'",SenatorEnzi,2,1
533354992199946240,2014-11-14 20:25:14,b'President\xe2\x80\x99s solo initiatives are putting a dent in American family budgets and the recent climate agreement with China continues that.',SenatorEnzi,1,2
533352688004521986,2014-11-14 20:16:04,"b'President\xe2\x80\x99s climate change agreement could help grow economy, jobs, and keep energy rates affordable\xe2\x80\x94in China. http://t.co/AYPgEgFDjA'",SenatorEnzi,0,2
533350943551946752,2014-11-14 20:09:08,b'President\xe2\x80\x99s China climate change agreement a surrender of America\xe2\x80\x99s interests now for China promising a non-binding resolution later.',SenatorEnzi,2,4
533337657112547328,2014-11-14 19:16:21,"b'Visited Holly Seed in Sheridan who produces sugar beet seeds, a vital crop for America. #WyoWorks http://t.co/DdZmMxjKzN'",SenatorEnzi,0,0
533040370125258754,2014-11-13 23:35:02,b'Thanks to Wahoo Frontier Topping &amp; Johnny Midnite &amp; Co in Buffalo for the tour on Oct 29. #WyoWorks http://t.co/PIpU1D6jXh',SenatorEnzi,3,1
533024950433906688,2014-11-13 22:33:45,b'I helped auction a cowboy hat at 20th annual Cowboys Against Cancer benefit in Rock Springs on Nov. 1. http://t.co/hunRrfeKEo',SenatorEnzi,1,0
532961447991836672,2014-11-13 18:21:25,b'Congratulations to our leaders including @SenJohnBarrasso who was re-elected GOP Policy Chairman.',SenatorEnzi,5,4
532961025860337665,2014-11-13 18:19:45,"b'Looking forward to legislating in new Congress the way it should be done --with committees, debate, amendments, votes &amp; an open process'",SenatorEnzi,6,8
532880624269291524,2014-11-13 13:00:15,b'I was honored to speak to the detention officers graduating from Wyo Law Enforcement Academy on Oct 28 in Douglas. http://t.co/7DO5peihMU',SenatorEnzi,2,3
532676737407012864,2014-11-12 23:30:05,"b'EMIT Technologies in Sheridan employees 116, creating emission control products. Thanks to VP Sue Osborn. #WyoWorks http://t.co/7ueKLhxpTt'",SenatorEnzi,1,0
532672957848383488,2014-11-12 23:15:04,b'At Wyo Technology Business Center they are helping Wyo entrepreneurs turn ideas into successful businesses. #WyoWorks http://t.co/dCBnY4KadV',SenatorEnzi,1,1
532666913118109696,2014-11-12 22:51:03,b'Visiting the School of Energy Resources at UW I toured their amazing 3-D Visualization research laboratory. #WyoWorks http://t.co/sdsDEjwePm',SenatorEnzi,0,0
532666713494388736,2014-11-12 22:50:15,b'Visiting the School of Energy Resources at UW I toured their amazing 3-D Visualization research laboratory. #WyoWorks http://t.co/Cnm8WBNWkl',SenatorEnzi,1,2
532662385803534336,2014-11-12 22:33:03,b'Enjoyed meeting Olympian @TommyMoeUSA and @jhski President Jerry Blann in my office in DC w/@SenJohnBarrasso http://t.co/Ygqr0UzbcD',SenatorEnzi,6,2
532216264853159936,2014-11-11 17:00:20,b'Today take the time to thank veterans you know for their willingness to serve. #VeteransDay http://t.co/cFAN4Q7RPs',SenatorEnzi,1,5
532186021039845376,2014-11-11 15:00:09,b'Down through the years our veterans have established a proud legacy with their service. #VeteransDay http://t.co/cFAN4Q7RPs',SenatorEnzi,1,1
532155860332474368,2014-11-11 13:00:18,b'Today we thank our veterans for their sacrifice and service to protect our nation and our rights. God bless them all. http://t.co/cFAN4Q7RPs',SenatorEnzi,3,5
531912641296760832,2014-11-10 20:53:50,"b'Visiting Western Wyoming Community College on Oct 23, I was impressed by the advanced training facilities. #WyoWorks http://t.co/mvjX6SXrX7'",SenatorEnzi,0,1
531911887949402112,2014-11-10 20:50:51,"b'Started over 100 years ago, John Bunning Transfer Co., Inc is a proud Wyoming company with over 75 trucks. #WyoWorks http://t.co/JARIua9GiT'",SenatorEnzi,1,0
531129101965213696,2014-11-08 17:00:20,"b'Over 10,000 followers! Thanks for keeping up on my tweets Wyoming. http://t.co/kDOeyfQyOe'",SenatorEnzi,6,2
530846592161841152,2014-11-07 22:17:44,b'Stopped at Cowboy Donuts in Rock Springs on Oct 24 to get some of the best donuts in the state. #WyoWorks http://t.co/jsy7e7Ux7o',SenatorEnzi,3,1
530843477945643008,2014-11-07 22:05:22,b'Impressed by my tour of MESSCO in Rock Springs on Oct 24. Great to see a Wyo company find success through innovation. http://t.co/zpV1c7dDWk',SenatorEnzi,0,1
530731910365216770,2014-11-07 14:42:02,b'Had a wonderful time attending Wyoming Cowboy Hall of Fame induction ceremony in Douglas on November 2. #WyoWorks http://t.co/mgjUY91sNW',SenatorEnzi,2,1
530408504772009985,2014-11-06 17:16:56,"b'Don\xe2\x80\x99t forget, today is the last day to apply for a spring internship in my office in Washington, D.C. http://t.co/p6J42pxFck'",SenatorEnzi,0,4
530118590616580096,2014-11-05 22:04:55,b'People sent reps to Washington Nov. 4 who promised to send back some of the power and freedoms that have been taken. http://t.co/DWIWZxgyPm',SenatorEnzi,0,4
530104808716632065,2014-11-05 21:10:09,b'I appreciate all candidates no matter how they finished Nov 4. We all want to make the world a better place.  http://t.co/DWIWZxgyPm',SenatorEnzi,5,4
530099762406907904,2014-11-05 20:50:06,b'Pleased people in other states said Nov. 4 what Wyo people been saying for a long time. They want functional Senate. http://t.co/DWIWZxgyPm',SenatorEnzi,3,4
530053342077390849,2014-11-05 17:45:39,b'Great tour of PacifiCorp\xe2\x80\x99s Naughton Power Plant near Kemmerer on Oct 23. #WyoWorks http://t.co/oPo0uqERlG',SenatorEnzi,1,1
529769517161795584,2014-11-04 22:57:50,b'Wonderful time speaking at the Chief Officers of State Library Agencies\xe2\x80\x99 Annual Meeting in Jackson Oct 22. #WyoWorks http://t.co/5wGcENawbq',SenatorEnzi,0,2
529759193788866561,2014-11-04 22:16:48,"b'Thanks to Jeff Leisy, Tom Buckner, John Burns &amp; the team at Performance Oil Tools/Wyoming Arms LLC in Cody. #WyoWorks http://t.co/yP71twtiaH'",SenatorEnzi,1,1
529755196868820992,2014-11-04 22:00:55,"b'Visited Performance Oil Tools/Wyoming Arms in Cody on Oct 21, to see how they create products right in Wyo. #WyoWorks http://t.co/ZdgfByBehK'",SenatorEnzi,2,2
529388458804932609,2014-11-03 21:43:38,b'We should protect &amp; reinforce states\xe2\x80\x99 &amp; private land owners\xe2\x80\x99 jurisdiction over their water &amp; land.  http://t.co/GYzO1HpP6G',SenatorEnzi,4,2
529362264928043008,2014-11-03 19:59:33,"b'RT @SenJohnBarrasso: ICYMI @SenatorEnzi @CynthiaLummis &amp; I wrote in @CSTribune how #WOTUS rule will hurt WY farmers, ranchers &amp; businesses \xe2\x80\xa6'",SenatorEnzi,0,4
529336998629474305,2014-11-03 18:19:09,b'EPA seeks absolute power to regulate Wyoming water.  EPA should withdraw misguided rule.  http://t.co/114XC2RKmj',SenatorEnzi,0,3
528531942463901697,2014-11-01 13:00:09,b'At Northwest College they showed me how they use new technology to help students practice important skills. #WyoWorks http://t.co/Z7XSr65dLl',SenatorEnzi,2,1
528290701453578240,2014-10-31 21:01:33,b'Toured Cody Laboratories to see how they research and produce important medicine right here in Wyoming. #WyoWorks http://t.co/zdxVyJ9DpQ',SenatorEnzi,0,2
528270984428941312,2014-10-31 19:43:12,b'Right! RT @scottincody  @SenatorEnzi The Irma in #CodyWyo!',SenatorEnzi,3,0
528190471710199808,2014-10-31 14:23:16,b'Visited this hauntingly decorated hotel/restaurant in Wyoming last week. Can you name this famous building? http://t.co/vwmBkuV3sA',SenatorEnzi,1,3
527567860261199872,2014-10-29 21:09:14,"b""Visited Firenze, the new steakhouse in Worland. Thanks to the Scheuerman's &amp; Lance Martinez for the tour. #WyoWorks http://t.co/YPveqUaTY1""",SenatorEnzi,2,3
527564903352385536,2014-10-29 20:57:29,"b'Thanks Richard McKamey, Vince Salzman, John Snyder Jr. &amp; Todd Bryngelson for tour of Worland Wyoming Sugar refinery. http://t.co/GNeWp8YT9C'",SenatorEnzi,3,2
527542424349204480,2014-10-29 19:28:09,"b'At the Wyoming Sugar Company refinery in Worland, they are going through 23 tons of sugar beets a day.  #WyoWorks http://t.co/YcjHSItABv'",SenatorEnzi,1,2
527481809257656320,2014-10-29 15:27:18,b'Washington could learn from Wyoming\xe2\x80\x99s financial management.  http://t.co/Ht4G0LiAA2',SenatorEnzi,1,1
527468249509031937,2014-10-29 14:33:25,b'We\xe2\x80\x99re number one! Wyoming ranks best in nation for tax climate according to @taxfoundation. http://t.co/Ht4G0LiAA2',SenatorEnzi,4,5
527204791005765632,2014-10-28 21:06:31,b'Thanks to Al Jenness for showing me the bottling facility at Admiral Beverages in Worland Oct 20. #WyoWorks http://t.co/HaBDzFkruM',SenatorEnzi,0,0
527200563478679554,2014-10-28 20:49:43,b'The MillerCoors Barley station in Worland collects enough barley in a year to make 87 million cases of beer. #WyoFact http://t.co/Z2rXqfVhT5',SenatorEnzi,0,3
527194604580642816,2014-10-28 20:26:03,"b'#WyoFact - Nearly every Coors and Miller beer is made with some Wyoming barley, the best in the world. #WyoWorks http://t.co/X1asKv5gm1'",SenatorEnzi,1,3
527177968322641921,2014-10-28 19:19:56,"b'My Penny Plan and Biennial Appropriations Act are simple, no-nonsense plans to help put our fiscal house in order. http://t.co/VnpVELBXR5'",SenatorEnzi,1,2
527168810114359296,2014-10-28 18:43:33,"b'RT @taxfoundation: Out now, our ""2015 State Business Tax Climate Index"" rankings. Where does your state rank? http://t.co/2fUKuAo8kD http:/\xe2\x80\xa6'",SenatorEnzi,0,11
527133254890295296,2014-10-28 16:22:16,b'It\xe2\x80\x99s time to use common sense to save cents. http://t.co/VnpVELBXR5',SenatorEnzi,0,2
527127086964936704,2014-10-28 15:57:45,b'RT @rollcall: Use Common Sense to Save Cents http://t.co/cBTgSEkpqz Commentary via @SenatorEnzi',SenatorEnzi,0,3
526838138019528704,2014-10-27 20:49:34,"b""I'm learning from Wyo workers &amp; employers what they do, how they do it &amp; what they need to do it better. #WyoWorks http://t.co/XBSehivG00""",SenatorEnzi,2,2
526834476954161152,2014-10-27 20:35:02,b'You should see where I\xe2\x80\x99ve been.  #WyoWorks ! http://t.co/XBSehivG00',SenatorEnzi,1,0
526815659054071808,2014-10-27 19:20:15,"b""RT @UW_WTBC: It wouldn't be a tour w/out meeting Nate Storey from @BrightAgrotech &amp; learning about #verticalgrowing @SenatorEnzi http://t.c\xe2\x80\xa6""",SenatorEnzi,0,3
526815645976248321,2014-10-27 19:20:12,b'RT @UW_WTBC: Such a pleasure to host @SenatorEnzi this morning at the WTBC!',SenatorEnzi,0,2
526791995453624320,2014-10-27 17:46:13,b'Visited WyoTech in Laramie to see how they teach students important skills to compete for the best job. #WyoWorks http://t.co/Lygm0sr7wu',SenatorEnzi,1,1
526790645646913537,2014-10-27 17:40:51,b'Visited the new Carbon County Higher Education Career and Technical Education Center in Rawlins on Oct 16. http://t.co/vS43BAbZup',SenatorEnzi,1,3
525743621312872448,2014-10-24 20:20:21,"b'Thanks to Ed Spal, John Pope, and Mike Thomas, from Centennial Woods for showing us around their facility on Oct 17. http://t.co/fONb2qeWTG'",SenatorEnzi,2,1
525299574475599873,2014-10-23 14:55:52,b'Enjoyed meeting with Wyoming Community Bank employees in Lander on Oct 15. #WyoWorks http://t.co/ytdTjY144s',SenatorEnzi,1,3
525024493459480576,2014-10-22 20:42:48,b'Thanks to the @pitchengine team for explaining their company and showing us around their offices in Lander on Oct 15. http://t.co/1l7h4DJ9Hw',SenatorEnzi,10,7
524987835104108545,2014-10-22 18:17:08,"b'Thanks to Maven founders Maestas, Lilygren &amp; Weaver for showing me their company. Customized binoculars. #WyoWorks http://t.co/eIWWKZAzUL'",SenatorEnzi,4,3
524942731609513984,2014-10-22 15:17:54,"b'Obamacare is making our economy sick, but it is treatable http://t.co/czlskRPo8Y'",SenatorEnzi,0,1
524920950798950400,2014-10-22 13:51:21,"b'Enjoyed visiting Wyoming Catholic College &amp; meeting w/ President Dr. Kevin Roberts and Fr. Chris Saliga, O.P. http://t.co/2hn9IpXgW0'",SenatorEnzi,1,3
524577681296601088,2014-10-21 15:07:20,b'Really enjoyed taking questions and talking to the kids at Lander Middle School on Oct. 14. #WyoWorks http://t.co/JL5XUF37UN',SenatorEnzi,9,7
524576226711973888,2014-10-21 15:01:33,"b'I toured the Job Corps Center construction site on Oct. 14 with Justin Swift, Glenn Hoyle, and Sandy Luers. #WyoWorks http://t.co/vwpFD3nImP'",SenatorEnzi,2,1
524575869063667712,2014-10-21 15:00:07,"b'Impressed by Central Wyoming College\xe2\x80\x99s pro-technical building, including access to 3D printers. #WyoWorks http://t.co/N7jRNPOH7R'",SenatorEnzi,1,3
524195519837782016,2014-10-20 13:48:45,b'Visited Lander High School metals class Oct. 13. Students are learning skills that can lead to a career. #WyoWorks http://t.co/IPkljn1aed',SenatorEnzi,1,3
524194781485080576,2014-10-20 13:45:49,b'Skills learned in BOCES military science class @ Lander High School provide foundation for students\xe2\x80\x99 future #WyoWorks http://t.co/8WkQ2a08xA',SenatorEnzi,1,2
524194023196868608,2014-10-20 13:42:48,"b'Learned a lot at Bighorn Divide and Wyoming Railroad in Shoshoni, a locally owned shortline railroad. #WyoWorks http://t.co/NZJFmjdQj1'",SenatorEnzi,0,2
523532826642501632,2014-10-18 17:55:27,b'I had a great time riding in the UW homecoming parade. Excited to watch UW take on San Jose State. #GoPokes http://t.co/59RkLpmT5O',SenatorEnzi,6,2
523196060572069888,2014-10-17 19:37:16,"b'Stopped by the Experience Works program in Casper, where they provide employment training for folks 55+. #WyoWorks http://t.co/mJdoj6oEIH'",SenatorEnzi,1,1
523193795186552832,2014-10-17 19:28:15,b'Surprise performance by instructors in Wheeler Concert Hall at Casper College was a beautiful experience. #WyoWorks http://t.co/vZVV31BTyG',SenatorEnzi,0,0
523190391735328768,2014-10-17 19:14:44,"b'In health science classes at Casper College, students work on dummies that breathe, blink &amp; more. #WyoWorks http://t.co/dOoHN673qv'",SenatorEnzi,3,4
522855874487128065,2014-10-16 21:05:29,b'Learning can be fun. At McMurry Training Center tested car that simulates skidding out of control. #WyoWorks http://t.co/l48BZxQ9WD',SenatorEnzi,0,1
522496246704250881,2014-10-15 21:16:27,"b'Calling all Wyo juniors in high school, applications for spring 2015 U.S. Senate page positions due Nov. 5. http://t.co/RxbjfRg2bY'",SenatorEnzi,0,1
522487021659750401,2014-10-15 20:39:47,"b'Last call for all Wyo juniors in HS! Become a U.S. Senate page in Washington, DC this spring! Deadline Nov. 5th. http://t.co/RxbjfRg2bY'",SenatorEnzi,0,1
522436251446935553,2014-10-15 17:18:03,b'RT @CentralWY: More photos of @SenatorEnzi touring CWC http://t.co/vWJJEVQ6vW as professors show off our cool facilities. Did you know we h\xe2\x80\xa6',SenatorEnzi,0,1
522435978494222336,2014-10-15 17:16:58,b'RT @JaredKail: Had a nice conversation with @SenatorEnzi this monring on #banking regulations. Appreciated him coming to speak with us.',SenatorEnzi,0,3
522393634906595328,2014-10-15 14:28:42,b'Toured the Top of the World wind farm near Glenrock. Thanks to Bob Ross &amp; Brian Halstead for the tour. #WyoWorks http://t.co/xV20xKZTmc',SenatorEnzi,3,0
522391199593013248,2014-10-15 14:19:02,b'Thanks to Johnny J\xe2\x80\x99s Diner crew in Casper. I like the broasted chicken if you stop by.  #WyoWorks http://t.co/Pta6Deu9Gb',SenatorEnzi,3,0
522167035099635712,2014-10-14 23:28:17,b'Thanks again to the Dave Johnston Power Plant team for all their hard work and informational tour.  #WyoWorks http://t.co/cfh1GuY91r',SenatorEnzi,2,2
522105249004535809,2014-10-14 19:22:46,b'RT @CentralWY: @SenatorEnzi watches CWC physics professor Dr. Bill Finney demonstrate how engaging education is during a tour of CWC http:/\xe2\x80\xa6',SenatorEnzi,0,1
520997313847001088,2014-10-11 18:00:13,b'Thanks to Sage Truck Driving School  in Cheyenne for showing how they train students. #WyoWorks http://t.co/Fnckpve1W9',SenatorEnzi,3,0
520212859100610560,2014-10-09 14:03:05,b'As part of my Wyoming Works tour I visited the Safeway store on the south side of Cheyenne on Tuesday. #WyoWorks http://t.co/WhiYPHRqVK',SenatorEnzi,2,0
520212438634213376,2014-10-09 14:01:25,b'Deadline to apply for an internship in my D.C. office is Nov. 6. Sign up now! http://t.co/8Oh0cSUPnY',SenatorEnzi,0,0
519963528942616576,2014-10-08 21:32:20,b'Remarkable tour on Tuesday of the NCAR Wyoming Supercomputer Center in Cheyenne. #WyoWorks http://t.co/sD9KKUntEH',SenatorEnzi,1,1
519961188067987457,2014-10-08 21:23:02,"b""See the nation's capital &amp; develop skills to further your education/career with an internship in my DC office. http://t.co/8Oh0cSUPnY""",SenatorEnzi,2,1
519600663089537024,2014-10-07 21:30:26,"b'Thanks to Lance Gold, Danny Horton, &amp; Chris Tetlow for showing me around Microsoft Data Center in Cheyenne. #WyoWorks http://t.co/wrMxA6HwfA'",SenatorEnzi,2,1
519600197869912064,2014-10-07 21:28:35,b'Spoke to members of the Cheyenne chamber of commerce yesterday about importance of small businesses to Wyo. #WyoWorks http://t.co/FBeBkVGmUB',SenatorEnzi,2,1
519598879973462016,2014-10-07 21:23:21,b'Impressed by the new emergency department &amp; regional cancer center at Cheyenne Regional Medical Center. #WyoWorks http://t.co/859hIAWJ4t',SenatorEnzi,3,2
518144319442911232,2014-10-03 21:03:27,"b""Want to stay informed on what I'm working on in Washington? Take a look at the Enzi Insider! http://t.co/pOqcv26irM""",SenatorEnzi,0,0
518138364303003649,2014-10-03 20:39:47,"b""Had a great time visiting Bob Herring's A Good Things New antique store in Encampment this last weekend. #WyoWorks http://t.co/YxpsnXJrFs""",SenatorEnzi,0,0
518048434348376064,2014-10-03 14:42:26,b'It was an honor to present Robert James with the Purple Heart award in Saratoga on Saturday. http://t.co/i2y7rrsXIH',SenatorEnzi,3,1
517790623332843520,2014-10-02 21:37:59,b'Thanks to Progress Rail Services team in Bill who showed how they fix rail cars to keep the trains running. #WyoWorks http://t.co/rf4yLicPMV',SenatorEnzi,0,0
517772012505563136,2014-10-02 20:24:02,"b'If EPA\xe2\x80\x99s quest to control all water succeeds one agency will control more than water- business, economy, livelihoods. http://t.co/mcBYuE993a'",SenatorEnzi,1,5
517762880645914624,2014-10-02 19:47:44,b'First Ebola case diagnosed in the U.S. Twitter updates @CDCgov @DrFriedenCDC &amp; web. http://t.co/RKzRlwmh3j',SenatorEnzi,0,2
517750210349785088,2014-10-02 18:57:24,b'EPA water grab bad for business. I\xe2\x80\x99m part of effort to prevent this. Introduced S.J. Res. 34 &amp; cosponsored S. 2496.  http://t.co/mcBYuE993a',SenatorEnzi,0,1
517736055278415873,2014-10-02 18:01:09,b'Administration\xe2\x80\x99s small business watchdog says EPA should withdraw water control rule. http://t.co/mcBYuE993a',SenatorEnzi,1,4
517404528577355777,2014-10-01 20:03:47,b'Decision to deny Wyoming authority to manage wolves on its own lands shows how deficient DC can be of common sense. http://t.co/64n86VFh8i',SenatorEnzi,0,4
517059691248353280,2014-09-30 21:13:31,"b'Congratulations to Wyoming schools in Powell, Sheridan &amp; Cody for being 2014 National Blue Ribbon School recipients. http://t.co/Jwt1xcA2MY'",SenatorEnzi,3,3
516699071709712384,2014-09-29 21:20:33,"b""Proud to speak at the affordable energy rally in Gillette last week. Can't talk about affordable energy without coal. http://t.co/XwO2UShWTU""",SenatorEnzi,2,4
515633807417163776,2014-09-26 22:47:34,b'I enjoyed attending the Westwood High School and Lakeview Elementary School dedications in Gillette on Thursday. http://t.co/VlcBTL88V8',SenatorEnzi,0,0
515615334775402498,2014-09-26 21:34:10,b'Took action today to address rural business and resident concerns over unreliable telephone service. http://t.co/QBOYXJ1TWr',SenatorEnzi,0,0
515267632598380544,2014-09-25 22:32:31,b'Attorney General Eric Holder said he will resign. He was not the right person for the job.',SenatorEnzi,2,3
515223446184525824,2014-09-25 19:36:56,b'RT @SenJohnBarrasso: #TBT to Sept 2013 when we met the 4 newest members of Team Barrasso. We just took a new photo 1 year later: http://t.c\xe2\x80\xa6',SenatorEnzi,0,27
514934314903937025,2014-09-25 00:28:02,b'Moose on the loose in Cheyenne this morning. Must have wanted to protest yesterday\xe2\x80\x99s wolf protection decision. http://t.co/UbwWoYwGKl',SenatorEnzi,9,5
514887830003548160,2014-09-24 21:23:19,"b""I'm disappointed w/ decision by a federal judge to reinstate endangered species protections for the gray wolf in Wyo.http://t.co/Hs0FbPCwmZ""",SenatorEnzi,1,3
514821451019747328,2014-09-24 16:59:33,b'A jobs bill that was signed into law this summer will help train workers to fill hundreds of thousands of good jobs. http://t.co/7OtSmXRmFy',SenatorEnzi,2,2
514500537614884864,2014-09-23 19:44:21,"b'Senate passed a jobs bill that I worked on for over a decade, 95 to 3. Was signed into law this summer. Learn more: http://t.co/7OtSmXRmFy'",SenatorEnzi,1,3
514432311660916737,2014-09-23 15:13:15,"b'Pleased to receive the Champion of the Worker award for my pro-worker voting record, given by @ceidotorg.'",SenatorEnzi,0,1
514075117253844992,2014-09-22 15:33:53,b'I was honored to receive the Guardian of Small Business award last week from @NFIB President and CEO Dan Danner. http://t.co/dswedRiGTP',SenatorEnzi,2,1
513041832197251072,2014-09-19 19:07:59,b'6 years ago today TransCanada applied to build #KeystoneXL pipeline. That\xe2\x80\x99s 6 years without jobs it would create. http://t.co/pzAkIbjP1T',SenatorEnzi,2,4
513026039682191360,2014-09-19 18:05:14,b'These catch-all spending bills with no opportunities for amendments is not how Congress should work. Learn more here: http://t.co/75bekAMCZV',SenatorEnzi,2,1
513003360119951360,2014-09-19 16:35:06,"b'With no amendments or debate &amp; spending beyond budget caps, I voted against gov. funding resolution last night. http://t.co/75bekAMCZV'",SenatorEnzi,1,2
512728827223478272,2014-09-18 22:24:13,b'As Chairman of the Senate Air Force Caucus I\xe2\x80\x99m proud to represent @usairforce. #HappyBirthday http://t.co/QQuEHH1KjD',SenatorEnzi,1,1
512720043038085120,2014-09-18 21:49:18,b'Happy 67th birthday to the @usairforce! http://t.co/qpwhQnwST0',SenatorEnzi,25,24
