id,created_at,text,user,favorite_count,retweet_count
603954679484162049,2015-05-28 16:03:11,b'It is inhumane to hold mothers and children in \xe2\x80\x9cjail like\xe2\x80\x9d family detention facilities. We need to find a better way. http://t.co/36H82eZ6Bl',SenDuckworth,2,0
603667118056411136,2015-05-27 21:00:31,"b'On Friday, my District Office met with yoga instructors from @ElginIL who are working on a Yoga for Veterans program! http://t.co/bnBXr2KsIM'",SenDuckworth,7,4
603625501224247297,2015-05-27 18:15:08,b'Summer travel is right around the corner! Check out these travel tips from @StateDept: http://t.co/T8uzjIOgxK',SenDuckworth,0,1
603594271984332800,2015-05-27 16:11:03,b'Recently I introduced the #FAMAct to provide private lactation rooms in airports. Read more @chicagotribune: http://t.co/nCL6gAbexu',SenDuckworth,5,5
603294750318428160,2015-05-26 20:20:51,b'I spent Memorial Day visiting Abraham Lincoln Cemetery and the Midwest Shelter for Homeless Veterans. http://t.co/4dcuTfEGHX',SenDuckworth,9,9
603278186101809152,2015-05-26 19:15:02,b'Congrats to the Addison Fire Protection District on their @DHSgov and @FEMA grant! More info here: http://t.co/EKZecuGOT8',SenDuckworth,0,1
603232197856894976,2015-05-26 16:12:18,"b'I applaud @Comcast and their commitment to hiring an additional 10,000 Vets and spouses by 2017! #HiringOurHeroes'",SenDuckworth,6,5
602826303860023296,2015-05-25 13:19:25,b'Help @LibraryCongress honor #Veterans this #MemorialDay by contributing histories to http://t.co/F9T0PZgLq2.',SenDuckworth,5,10
601822203492093952,2015-05-22 18:49:29,b'Congrats to Fremd High School in @PalatineIL for making the U.S. News Best High Schools List! http://t.co/lln5HPeAsK',SenDuckworth,3,1
601799205695393792,2015-05-22 17:18:06,"b'Ahead of Memorial Day, I introduced the #ACESAct. Learn more about how this legislation helps our military families: http://t.co/ZoTeuRRTAe'",SenDuckworth,2,3
601779956163686400,2015-05-22 16:01:36,b'The #DuckworthDiary is out! Read about what\xe2\x80\x99s happening in #IL08 and DC: http://t.co/HtTIrOlLPr',SenDuckworth,0,0
601479709575278592,2015-05-21 20:08:32,b'We need to pass a long term High Way and Transit Trust Fund extension now. http://t.co/dKlGWPcPVM',SenDuckworth,2,4
601444263751102464,2015-05-21 17:47:41,b'Congrats to @PalatineHS @northropgrumman and @motosolutions for their involvement in @ISTCoalition\xe2\x80\x99s #STEMChallenge! http://t.co/9Dp38hsylr',SenDuckworth,5,2
601136188347527169,2015-05-20 21:23:30,b'The current minimum wage of $7.25 an hour leaves a family of three below the federal poverty line. #RaiseTheWage',SenDuckworth,3,5
601105262125174786,2015-05-20 19:20:37,b'We had a great turnout at our AAPI Federal Contracting workshop yesterday! http://t.co/TdPqTo2eEF',SenDuckworth,1,1
601049323040833536,2015-05-20 15:38:20,b'Join my office at the Addison Public Library today for Satellite Office Hours! Details here: http://t.co/XslZD80odA',SenDuckworth,1,2
600777910430072832,2015-05-19 21:39:50,b'Congrats to River Trails Middle School in @MountProspect for being a #GreenRibbon school! More info: http://t.co/arbEUfL3B0',SenDuckworth,2,1
600732467423752192,2015-05-19 18:39:15,b'Who\xe2\x80\x99s earning Doctorate degrees these days? Women! Check out the interesting data here: http://t.co/OiyUUERv4P',SenDuckworth,0,2
600702657955758081,2015-05-19 16:40:48,b'Reminder: My office is hosting a Opioid Awareness event tomorrow @ 10 AM at Roosevelt U in Schaumburg. Details here: http://t.co/Ug4VtBP3ih',SenDuckworth,0,2
600413680837201920,2015-05-18 21:32:31,b'REMINDER: Our #AAPI Small Business and Federal Contracting Workshop is tomorrow! Register here: http://t.co/c8aXfOjI1C',SenDuckworth,1,0
600397190104768513,2015-05-18 20:26:59,b'On Saturday my office hosted a Service Academies info session &amp; heard from many great prospective academy students! http://t.co/gxadaxHcKS',SenDuckworth,2,1
600361137176256512,2015-05-18 18:03:43,"b'Early childhood education is so important. Happy anniversary, #Headstart50! http://t.co/Bih8SAVmfw'",SenDuckworth,4,14
599311267153780736,2015-05-15 20:31:55,b'Reminder: My office is hosting a Service Academies Info Session @STDL tomorrow at 10 AM! We hope to see you there.',SenDuckworth,0,1
599304964817690625,2015-05-15 20:06:52,b'Find out where @ElginIL ranks in the list of most diverse cities in the U.S.: http://t.co/XGFFauK6GZ #IL08',SenDuckworth,0,0
599277311150653440,2015-05-15 18:16:59,b'Higher education is an important component in improving our nation\xe2\x80\x99s #STEM education. Via @Illinois_Alma: http://t.co/ZJ4LYH31XT',SenDuckworth,1,1
599268300678438915,2015-05-15 17:41:11,b'I participated in the Dem Caucus Asian Pacific American Roundtable \xe2\x80\x93 a great way to continue AAPI Heritage Month! http://t.co/qEeQJhjbSj',SenDuckworth,4,5
598969323059830784,2015-05-14 21:53:09,b'Did you know our state ranks first in LEED-certified green buildings per capita? Check out the data here: http://t.co/g0bKLedYQx',SenDuckworth,0,2
598921831098245120,2015-05-14 18:44:26,"b'From @USEdGov, how to qualify for student loan forgiveness: http://t.co/S7238vionl'",SenDuckworth,2,2
598906594567593984,2015-05-14 17:43:53,b'There are a lot of great events coming up in #IL08! Check my website for details: http://t.co/6POFAemgBj',SenDuckworth,0,0
598600933971513344,2015-05-13 21:29:18,"b'Did you know 3,000 kids end up in the emergency room every year? Some because of preventable falls. Learn the facts: http://t.co/1h0EvMR0NK'",SenDuckworth,2,3
598564213011918848,2015-05-13 19:03:23,b'Congrats to Arlington Heights for being the fastest fixers of water mains in all of Illinois! http://t.co/DSymhuBMlk',SenDuckworth,2,1
598245629677146112,2015-05-12 21:57:27,b'Interested in applying to one of the Service Academies? We\xe2\x80\x99re hosting an event this Saturday so you can learn more. http://t.co/JALAwKrPtG',SenDuckworth,0,1
598212875392520192,2015-05-12 19:47:18,b'Taking advantage of our Military members is unacceptable. We should be protecting those who\xe2\x80\x99ve served our nation. http://t.co/qjVn5NxuOc',SenDuckworth,4,5
598166917543755777,2015-05-12 16:44:41,b'.@OBaaHealth Thanks for the support! This is such an important issue.',SenDuckworth,2,0
598158529027907584,2015-05-12 16:11:21,b'I\xe2\x80\x99m pleased to announce the Elgin Family Care Center received this @HHSgov grant: http://t.co/v9iSEz4Oir',SenDuckworth,1,0
597881952553828352,2015-05-11 21:52:20,b'Have you seen the @LungAssociation\xe2\x80\x99s new report on the state of our air in IL? Check it out here: http://t.co/kMQPvRkVlF',SenDuckworth,0,3
597856358084534272,2015-05-11 20:10:38,b'Small businesses are a fundamental part of our economy. Read my newsletter on National Small Business Week here: http://t.co/7t42bJQkP8',SenDuckworth,1,0
597827513486802944,2015-05-11 18:16:00,b'My office is hosting a #SmallBiz and Federal Contracting Workshop on 5/19. RSVP here: http://t.co/c8aXfOjI1C',SenDuckworth,1,0
597801862096678912,2015-05-11 16:34:05,"b'RT @RepRickLarsen: With 8 legislative days until Highway Trust Fund expires, @HouseGOP has yet to put fwd bill to continue building America\xe2\x80\xa6'",SenDuckworth,0,93
597424156095991808,2015-05-10 15:33:13,b'What do I want for Mother\xe2\x80\x99s Day? Find out via @SunTimes: http://t.co/XdnwDaYHfB Happy Mother\xe2\x80\x99s Day to all the Moms out there!',SenDuckworth,4,7
596771463463641089,2015-05-08 20:19:39,b'Have you #ThankedATeacher this week? I know we have some great ones in #IL08! http://t.co/pEb18zZ9Yg',SenDuckworth,3,5
596756483506839552,2015-05-08 19:20:07,b'The Duckworth Diary is out! Check my website for updates on #DC and #IL08: http://t.co/yjeiLX59Ar',SenDuckworth,0,0
596730772544954368,2015-05-08 17:37:57,"b'Happy National #NursesWeek! If you can, take the time to thank a nurse for their empathetic and compassionate care. http://t.co/ucBNFgPruD'",SenDuckworth,14,16
596402778668412929,2015-05-07 19:54:37,b'Happy Asian Pacific American Heritage Month! Proud to be @CAPAC Member and serve #AAPI community in my district and across US!  #APAHM2015',SenDuckworth,8,9
596384001759260673,2015-05-07 18:40:00,b'It\xe2\x80\x99s #NatlSmallBizWeek! I introduced H.R. 2221 to help our #Vets in business: http://t.co/hoQot99cbC http://t.co/czcbXDrZgM',SenDuckworth,2,1
596340042718646272,2015-05-07 15:45:20,"b'Congrats to Ryoka Lulu Matsuno, winner of the #IL08 2015 Art Competition! View her art here: http://t.co/zWnSSWy7Su'",SenDuckworth,1,2
596053220579024896,2015-05-06 20:45:36,b'My office is hosting an informational session on applying to the Service Academies on 5/16. We hope you can join us! http://t.co/ctkKyh2RtI',SenDuckworth,2,5
596013277580263424,2015-05-06 18:06:53,"b'Our new office is in the same building(1701 E. Woodfield Rd,Schaumburg)but on a different floor.Come visit Suite 704. http://t.co/NQDCadSA4v'",SenDuckworth,3,0
595952880282120192,2015-05-06 14:06:53,"b""RT @NydiaVelazquez: This National Small Business Week we salute American entrepreneurs who create 3 out of 4 new jobs. Let's help them succ\xe2\x80\xa6""",SenDuckworth,0,130
595688492560179202,2015-05-05 20:36:18,b'The 25th Anniversary of the ADA is this year.Learn more about the history of the ADA in this interactive timeline. http://t.co/Zl7dR16dzP',SenDuckworth,6,9
595364860256464897,2015-05-04 23:10:18,"b'From @USEdGov, 6 things to know about repaying your student loans: http://t.co/EVOZyn7znk'",SenDuckworth,5,8
595326327089168384,2015-05-04 20:37:11,"b""RT @ACSCANIL: .@ACSCAN vols met with @RepDuckworth's office to talk about cancer research funding. Thanks! #OneDegree http://t.co/2fS6WQPAt1""",SenDuckworth,0,1
595297689111240705,2015-05-04 18:43:23,b'Kimball Middle School in @ElginIL has been named a National AVID Demonstration School! http://t.co/wjfMSEe4Tb',SenDuckworth,5,3
595284061767258113,2015-05-04 17:49:14,"b""it's #AAPI Heritage Month! Check out the great work @Chicago_KRCC is doing in our community: http://t.co/F4NbmbkrFI""",SenDuckworth,3,3
595227768704659456,2015-05-04 14:05:33,"b""RT @RepPeterDeFazio: @SpeakerBoehner, let's take up a long-term surface transportation funding bill! Infrastructure investments grow the ec\xe2\x80\xa6""",SenDuckworth,0,96
594219200719286272,2015-05-01 19:17:52,"b""My office put together a Veteran's Resource Guide. Veterans, click here to see what my office can do for you: http://t.co/3Qdpkn2kmt""",SenDuckworth,5,11
594163886456217600,2015-05-01 15:38:04,b'Proud my amendment increasing workload at our nation\xe2\x80\x99s arsenals- including Rock Island Arsenal passed #FY16NDAA #HASC http://t.co/lRrnM5pAEq',SenDuckworth,1,0
593887436868100098,2015-04-30 21:19:33,b'Women should not suffer at work for starting a family. We need to defeat H.J. Res 43. #DontFireMeForMyChoice http://t.co/YSWeq1xjWT',SenDuckworth,16,12
593796239617093632,2015-04-30 15:17:10,b'My amendment protecting ServiceMembers from predatory lending was included in the #FY16NDAA. Now is the time to act. http://t.co/6LBLX4sDyU',SenDuckworth,12,9
593529889556336640,2015-04-29 21:38:47,"b'Glad to see Illinois schools working on #STEM, tech and innovation that will make our whole state stronger: http://t.co/N1CUqTNHvC'",SenDuckworth,6,5
593495707585224705,2015-04-29 19:22:57,b'Need help with #TIGER grants? My office is here to assist! Contact us to learn about upcoming webinars or visit http://t.co/SCJnkCeC9N.',SenDuckworth,1,1
593435839511842816,2015-04-29 15:25:04,b'Watch coverage of #FY16NDAA today - I\xe2\x80\x99ll be speaking on provisions I\xe2\x80\x99m advocating for. Live stream here: https://t.co/Q0TgbpcI3s',SenDuckworth,3,1
593160136090374144,2015-04-28 21:09:31,b'Who do you think should win the #IL08 Art Competition this year? Cast your vote here: http://t.co/GKUIboM52U',SenDuckworth,0,4
593113805607014401,2015-04-28 18:05:25,b'Did you see my e-newsletter on saving taxpayer dollars? Read + sign up for e-newlsetter updates here: http://t.co/9iYKbFVoAI',SenDuckworth,2,4
593055359771738112,2015-04-28 14:13:10,b'#SCOTUS is hearing #MarriageEquality case. I joined 166 House colleagues in amicus brief for #FreedomToMarry bc #LoveMustWin #LoveCantWait',SenDuckworth,144,91
592804449241976833,2015-04-27 21:36:09,"b'From @USEdGov, 5 common mistakes when dealing with student loans: http://t.co/42cW7mW1JK. Important info for our students!'",SenDuckworth,1,4
592764286235189249,2015-04-27 18:56:33,b'Congrats to the Women\xe2\x80\x99s Business Dev. Center for their @SBAgov grant! Learn more about grant opportunities here: http://t.co/dlVWxpTZ6q',SenDuckworth,3,1
592695904471293952,2015-04-27 14:24:50,b'Great @chicagotribune article about the Bruce family and their service as members of the @ElginIL fire department. http://t.co/CAvzwj6nQ9',SenDuckworth,1,1
592325798876598275,2015-04-26 13:54:09,b'I am so saddened by the events in Nepal. My thoughts and prayers are with the victims and their families.',SenDuckworth,15,10
591722299767726080,2015-04-24 21:56:04,"b""I'm proud of @Illinois_Alma! They were awarded a $448,385 dollar grant from @USDA to develop childhood obesity intervention programs.""",SenDuckworth,5,4
591707669167243264,2015-04-24 20:57:56,b'Yesterday Brandon Schabell from @HoffmanTweets presented his research on Capitol Hill. Learn more here: https://t.co/FrHHFyanXY.',SenDuckworth,2,3
591658125507358720,2015-04-24 17:41:04,b'The latest Duckworth Diary is out! Check out what\xe2\x80\x99s happening in #IL08: http://t.co/uBPStkuvs0',SenDuckworth,2,2
591332604596498434,2015-04-23 20:07:34,b'Women should not suffer at work for starting a family. Watch me propose my amendment to protect women\xe2\x80\x99s choices: http://t.co/m6tZ8obIBo',SenDuckworth,6,7
591280983162363905,2015-04-23 16:42:26,b'The Healthy Lunchtime Challenge is back! http://t.co/SN5KiVmUKA',SenDuckworth,0,1
590993408426139648,2015-04-22 21:39:43,"b'This #EarthDay, check out all the growth in sustainable jobs in the US! http://t.co/cCNkmUFic2'",SenDuckworth,12,11
590944226629853185,2015-04-22 18:24:17,b'The @CDCgov recently launched a new website on prescription drug overdose. Check it out here: http://t.co/br1Hl41cRL',SenDuckworth,2,1
590629527971332096,2015-04-21 21:33:47,b'Proud to introduce legislation to end Franking privilege and make Members of Congress more accountable to taxpayers. http://t.co/3GfSpD2sUi',SenDuckworth,7,6
590236028373458944,2015-04-20 19:30:09,b'I was proud to join @sierraclub for @EarthDay and help clean up Deer Grove East Forrest Preserve in Palatine. http://t.co/7Cb7AZA7Pz',SenDuckworth,18,8
590191792106168321,2015-04-20 16:34:23,b'Honored to attend launch of #ADA25Chicago and recommit to making sure that all persons with disabilities can live fulfilling lives.',SenDuckworth,6,4
589453665846566913,2015-04-18 15:41:20,b'Hope you can join me for a Congress at Your Corner today in Hoffman Estates.  http://t.co/S5t3uCa9A4',SenDuckworth,0,4
589113496584986625,2015-04-17 17:09:37,b'My amendment to establish joint combat uniform will save the taxpayers $4.2 billion\n#commonsense. http://t.co/P9CFWpU1Pc',SenDuckworth,5,4
588766339935895552,2015-04-16 18:10:08,b'Proud to have #IL08 residents like Gayle in our community. https://t.co/VWZ4OdP3kz',SenDuckworth,4,4
588413027470467072,2015-04-15 18:46:12,b'.@usedgov has a great resource for filing your FAFSA after updating your taxes. http://t.co/Ne4RACIO3Z',SenDuckworth,3,0
588382680644988928,2015-04-15 16:45:37,b'Glad to see @krmaehr and Keleigh testify in House Ag Cmte on importance of #SNAP and @FoodDepository. http://t.co/4uQL1M0lVU',SenDuckworth,8,2
588039562653491200,2015-04-14 18:02:11,b'4/14 is Equal Pay Day \xe2\x80\x93 or the date when women\xe2\x80\x99s wages finally catch up to what men were paid last year. We need #EqualPayNow.',SenDuckworth,7,7
587666315055394816,2015-04-13 17:19:02,b'I had a great time at Plum Grove Jr. High in Rolling Meadows for Career Day! https://t.co/ymIt9IImqX',SenDuckworth,1,2
586567932131614720,2015-04-10 16:34:27,b'The #DuckworthDiary is out! Find out what I\xe2\x80\x99ve been up to in DC and #IL08 http://t.co/kmAiS7TLRg',SenDuckworth,1,2
586219329424883714,2015-04-09 17:29:14,"b'With our severe weather today, please be prepared and stay safe! http://t.co/nfvt3asgjH'",SenDuckworth,2,3
585923771699191810,2015-04-08 21:54:47,b'Have you read my e-newsletter on importance of early childhood ed? Read &amp; sign up here: http://t.co/Hs4lw7ltT6',SenDuckworth,3,3
585491381457674240,2015-04-07 17:16:37,b'Recently I led on a letter asking for more funding for job training. Read why it\xe2\x80\x99s so important here: http://t.co/iAJfiUvyUn #WIOA',SenDuckworth,4,7
585091628873945090,2015-04-06 14:48:09,b'My office hosted a panel on Immigration Services best practices. Get more info on our events by calling 847-413-1959. http://t.co/AAl5lmHmwH',SenDuckworth,4,7
584032806919090176,2015-04-03 16:40:46,b'8th District org Symbol Training Institute is hosting a job fair on 4/22! Details below. #IL08 #manufacturing http://t.co/0xom9KP1ra',SenDuckworth,2,6
583691567329910784,2015-04-02 18:04:48,"b'In addition, the GOP budget makes it harder for students to follow their dreams and earn a higher education. #UMatter'",SenDuckworth,4,15
583690523434713088,2015-04-02 18:00:39,"b'The GOP budget the House passed last week makes college less affordable. Students, #UMatter and deserve better.'",SenDuckworth,19,31
583675672268242944,2015-04-02 17:01:39,b'Yesterday I led the #OGR committee in sending a letter to @USGAO re: FVAP program. More here: http://t.co/yO3uzEtIQp',SenDuckworth,3,1
583351239649456128,2015-04-01 19:32:28,b'The Promise Scholarship @HarperCollege will mean more of our young residents attending college. Learn more here: http://t.co/FJX8GpUlHb',SenDuckworth,6,8
582980555479883776,2015-03-31 18:59:30,b'Pleased to see @Live4Lali\xe2\x80\x99s Clinic open in Arlington Heights: http://t.co/7g678nsEIg',SenDuckworth,1,5
582637633274286083,2015-03-30 20:16:51,b'I enjoyed speaking with students from Jefferson Middle School @VillaPark_IL! We talked about #WomensHistoryMonth. https://t.co/yLExhB606k',SenDuckworth,8,10
581504225080922112,2015-03-27 17:13:05,"b'As someone who was on food stamps as a child, I know how important programs like #SNAP are to our communities. http://t.co/psLp9wZXqk'",SenDuckworth,75,118
581149896532762624,2015-03-26 17:45:07,b'Today I brought the Lucier family from Streamwood on the House floor for a vote! http://t.co/0TYwmKx0Jm',SenDuckworth,3,5
580827853396303872,2015-03-25 20:25:26,"b""One of my main priorities is making sure my neighbors\xe2\x80\x99 tax dollars aren't wasted. Learn more from a #HASC hearing: http://t.co/OJOd7C2zAE""",SenDuckworth,3,3
580466727877767168,2015-03-24 20:30:27,"b'I\xe2\x80\x99m pleased to report @ElginSymphony received a $10,000 grant from @NEAarts! Details here: http://t.co/A6TxFSABcg http://t.co/ttH5lWrxEB'",SenDuckworth,8,7
580415296856580096,2015-03-24 17:06:05,"b'RT @SchaumburgIL: Be a hero and donate blood from 3:30pm to 8:30pm Thurs. March 26 at The Barn, 231 S. Civic Dr. http://t.co/HOhq2gKHkX htt\xe2\x80\xa6'",SenDuckworth,0,3
580395794781638656,2015-03-24 15:48:35,b'RT @USRepKCastor: .@HouseDemocrats have a budget that puts working families first. Bigger paychecks &amp; better infrastructure for all! http:/\xe2\x80\xa6',SenDuckworth,0,138
580123810407571456,2015-03-23 21:47:49,b'Senseless gun violence needs to stop.That\xe2\x80\x99s why I\xe2\x80\x99m cosponsoring the Large Capacity Feeding Device Act. More here: http://t.co/PJx1h9HoK8',SenDuckworth,10,24
580070171638919168,2015-03-23 18:14:40,b'Congrats to @HarperCollege Speech &amp; Debate team on their win at the IIFA Tournament at NIU! http://t.co/zlfeRRLVVg',SenDuckworth,3,1
579659515664195584,2015-03-22 15:02:52,b'I hope you\xe2\x80\x99ll watch my discussion with @PatrickMurphyPA today on @msnbc at 12 cst.We are discussing standing up for our Vets #TakingTheHill',SenDuckworth,17,11
578999875720908800,2015-03-20 19:21:42,b'Glad to have such great community colleges like @HarperCollege @@CollegeDuPage &amp; @ElginCommColl in #IL08! http://t.co/V8YEjtOSI4',SenDuckworth,2,5
578631524431601664,2015-03-19 18:58:00,b'Great to be w/ @SenBillNelson @RepJeffMiller &amp; @RepLoisFrankel last night for #DebtOfHonor screening. http://t.co/xywoEA6lPY',SenDuckworth,6,4
578230118440701953,2015-03-18 16:22:57,b'Happy #AGday2015! Did you know each American farmer feeds more than 144 people? @agday http://t.co/ZsubyBiZxF',SenDuckworth,6,2
577884936688037888,2015-03-17 17:31:20,b'My office is hosting Satellite Office Hours in Addison this Saturday! Details here: http://t.co/RXL7nOasaz',SenDuckworth,1,2
577857853026902017,2015-03-17 15:43:42,b'Tough but rewarding part of my job-In a hearing now on DoD budget.We need to watch waste but also give our troops the resources they need-TD',SenDuckworth,4,4
577560096898752513,2015-03-16 20:00:32,"b'Welcome to the 8th District, @sternpinballinc! @EGVBusinessPark is lucky to have you.  http://t.co/jQvv8iKfrg'",SenDuckworth,2,3
577524774173282304,2015-03-16 17:40:10,"b'I met with constituents recently in @ElginIL for a #CAYC. If you need help w/ a federal agency, please call my office at 847-413-1959.'",SenDuckworth,1,2
576423357257801728,2015-03-13 16:43:32,b'The #DuckworthDiary is out! Head on over to my website to see what I\xe2\x80\x99ve been up to in the District and DC: http://t.co/R8AWYpZTDd',SenDuckworth,1,6
576061108450127872,2015-03-12 16:44:05,b'This week I visited @heartofmercy \xe2\x80\x93 met with residents and toured their facility. Great work being done there! http://t.co/ZaICmu11bs',SenDuckworth,5,3
576029708468535296,2015-03-12 14:39:19,"b""RT @RepHuffman: Bigger paychecks &amp; better infrastructure. We must put the #MiddleClassFirst. Working families are the engine of America's e\xe2\x80\xa6""",SenDuckworth,0,111
575656292808855552,2015-03-11 13:55:30,b'I\xe2\x80\x99m hosting a #CAYC today in @ElginIL! Hope to see you there. http://t.co/MKM9RNjd8S',SenDuckworth,2,7
575313197093224449,2015-03-10 15:12:09,b'Let\xe2\x80\x99s get every kid in a park! Love this initiative from @USedgov: http://t.co/kHYr1ciJTn http://t.co/msywGKWFMm',SenDuckworth,5,12
575030365473103874,2015-03-09 20:28:17,b'I\xe2\x80\x99m hosting a #CAYC this Wednesday in @ElginIL! Hope to see you there. http://t.co/hJmeBfBYCw',SenDuckworth,1,4
575010753750679552,2015-03-09 19:10:21,b'RT @OversightDems: This week we are spotlighting the @RepDuckworth for #WHM2015! Be sure to check out her bio! http://t.co/egDtjcAx4P',SenDuckworth,0,4
574952506024935425,2015-03-09 15:18:54,b'RT @RepTerriSewell: Selma is now! The fight for voting equality must continue so long as there are barriers that limit access to the ballot\xe2\x80\xa6',SenDuckworth,0,155
574215955166990337,2015-03-07 14:32:06,b'#Selma50 is both an opportunity to honor the heroism of those who marched and to recommit ourselves to ending all injustice in our nation.',SenDuckworth,14,24
573974254246625280,2015-03-06 22:31:40,"b'I was proud to sign onto an amicus brief supporting #marriageequality. Everyone deserves the same level of access, support and love.'",SenDuckworth,9,5
573889612009107458,2015-03-06 16:55:20,b'I loved meeting with neighbors at last week\xe2\x80\x99s Asian American Coalition of Chicago Lunar New Year Celebration. http://t.co/1GzbfokxpH',SenDuckworth,1,2
573855509310271488,2015-03-06 14:39:49,"b""RT @RepDanKildee: Bigger paychecks &amp; better infrastructure. Let's put Americans back to work building roads &amp; bridges our country needs! #M\xe2\x80\xa6""",SenDuckworth,0,128
573604509559230465,2015-03-05 22:02:26,"b'Despite the snow, my office remained open and I had a great meeting with Elin Suleymanov, Ambassador from Azerbaijan. http://t.co/EgakYWEEFQ'",SenDuckworth,4,6
573525202023411713,2015-03-05 16:47:18,b'Congrats to 8th grader Zachary Evans from #ArlingtonHeights \xe2\x80\x93 he\xe2\x80\x99s a semifinalist in the @natgeo spelling bee! http://t.co/QyzBy4cvFl',SenDuckworth,0,4
573499400657502209,2015-03-05 15:04:46,"b""RT @RepCheri: Let's create American jobs rebuilding roads &amp; bridges. Bigger paychecks &amp; better infrastructure! #MiddleClassFirst http://t.c\xe2\x80\xa6""",SenDuckworth,0,141
573256653807734785,2015-03-04 23:00:11,"b""Great to meet with Helmut Mueller, President of Elk Grove Village's Helm Tool Company in my Washington, DC office. http://t.co/ukPaIc7J8c""",SenDuckworth,2,4
572883396524834817,2015-03-03 22:17:00,b'Last night I met with @Krmaehr and Chicago @FoodDepository re: #FillUpYourPlate and why #No1shouldgohungry. http://t.co/4Tde428TgD',SenDuckworth,8,7
572856336658001923,2015-03-03 20:29:28,b'Just voted on #DHSfunding bill. My neighbors &amp; I are tired of partisanship - glad to move forward &amp; keep DHS funded.',SenDuckworth,6,1
572455091522969601,2015-03-02 17:55:04,b'Great to see members of our community coming together to help those in need at @boomersbaseball stadium! http://t.co/xav7QuOMNG',SenDuckworth,0,2
571386577815011328,2015-02-27 19:09:10,b'Curious what I\xe2\x80\x99ve been up to in the 114th Congress? Check out this week\xe2\x80\x99s Duckworth Diary: http://t.co/XYxw1gaGsx',SenDuckworth,0,5
571325465396432896,2015-02-27 15:06:20,b'My neighbors are tired of brinkmanship in Washington. Let\xe2\x80\x99s pass a clean DHS funding bill that keeps the US safe. #DontShutDownOurSecurity',SenDuckworth,8,7
570653038119153665,2015-02-25 18:34:21,b'Hunger makes school harder for the 23% of Illinois children who are food insecure. You can help #SchoolBreakfastWeek: http://t.co/ErYcamHCIG',SenDuckworth,9,14
570334645079769089,2015-02-24 21:29:10,b'My office is hosting a Tax Prep event @gailbrdnlibrary this Thursday! Details here: http://t.co/UF8DvyZPsA',SenDuckworth,0,3
