id,created_at,text,user,favorite_count,retweet_count
869932935402618880,2017-05-31 15:05:49,b'We need to invest in programs that reduce homelessness&amp;help struggling moms\xe2\x80\x94not eliminate them or slash budgets like the #TrumpBudget wld do',SenDuckworth,122,31
869932818109009920,2017-05-31 15:05:21,"b""Great visiting @newmomsinc&amp;seeing the impt work they're doing to help young moms secure economic independence &amp; sta\xe2\x80\xa6 https://t.co/3xhgemAAXV""",SenDuckworth,138,23
869718360048709632,2017-05-31 00:53:10,"b""#ClimateChange is one of the gravest threats of our time. It's time for America to lead the way in creating a more sustainable future""",SenDuckworth,196,62
869717675798351873,2017-05-31 00:50:27,"b'Today, I joined members of the @ELPCenter to talk about the critical need to combat climate change and support clea\xe2\x80\xa6 https://t.co/KpSwZ0fycF'",SenDuckworth,207,48
869334509514358785,2017-05-29 23:27:53,"b'We can never repay the debt owed to those who lost their lives for our country, but we must do everything we can to support those who served'",SenDuckworth,335,87
869334237857673216,2017-05-29 23:26:48,"b""Today is a time to remember that wars aren't fought by nameless troops\xe2\x80\x94they are fought by neighbors, friends, sisters, brothers, moms &amp; dads""",SenDuckworth,433,138
869333572091510784,2017-05-29 23:24:09,"b'This Memorial Day, I joined Vets, servicemembers &amp; their families at Camp Butler to honor those who lost their live\xe2\x80\xa6 https://t.co/0uLsMMKV4O'",SenDuckworth,419,72
868972086202597377,2017-05-28 23:27:44,"b'The American people deserve to know who POTUS hires, especially if they could have conflicts of interest'",SenDuckworth,308,74
868971854656131072,2017-05-28 23:26:49,b'White House reversed course after my colleagues &amp; I urged them to stop concealing ethics waivers from\xe2\x80\xa6 https://t.co/29kjxHdSfI',SenDuckworth,554,207
868286878377795584,2017-05-27 02:04:58,"b'We should be inspiring young Americans, like those I met today, to serve their country&amp; neighbors\xe2\x80\x94not slashing budgets&amp; eliminating programs'",SenDuckworth,141,40
868286672512966656,2017-05-27 02:04:09,"b'Today, Pres Trump seems more interested in asking what his country can do for him\xe2\x80\x94the #TrumpBudget eliminates programs like @AmeriCorpsVISTA'",SenDuckworth,169,78
868286531089387525,2017-05-27 02:03:35,"b""56yrs ago, JFK inspired a nation to ask what they cld do for their country&amp; created the idea of VISTA\xe2\x80\x94an anti-poverty, nat'l service program""",SenDuckworth,84,35
868286281180205056,2017-05-27 02:02:36,b'Enjoyed meeting w/ @AmeriCorps members frm @CollPossible today to talk abt national service &amp; making #HigherEd acce\xe2\x80\xa6 https://t.co/3Nw6wdvtRk',SenDuckworth,156,42
868273473256292352,2017-05-27 01:11:42,"b""I spoke w/AIPAC yesterday abt US-Israel relationship. I'll keep working to ensure Israel has support it needs to ma\xe2\x80\xa6 https://t.co/nvt9A7dQfV""",SenDuckworth,125,37
868211233522167808,2017-05-26 21:04:23,"b'RT @SenKamalaHarris: Proud the measure @maziehirono, @SenDuckworth &amp; I sponsored to recognize May as Asian Pacific American Heritage Month,\xe2\x80\xa6'",SenDuckworth,0,62
868208448583987200,2017-05-26 20:53:19,b'We must ensure communities coping w/this devastating crisis have the resources they need to turn the tide on the opioid epidemic',SenDuckworth,75,23
868208378467815428,2017-05-26 20:53:02,"b'Yesterday, I spoke on the Senate floor about the opioid epidemic, a critical public health crisis affecting people\xe2\x80\xa6 https://t.co/n9fB7asLaK'",SenDuckworth,198,46
868197177843208197,2017-05-26 20:08:32,b'Congratulations to @Park_Ridge_PD Deputy Chief Jogmen for receiving the @NSCSafety 2017 Green Cross for Safety Award for Advocacy',SenDuckworth,36,12
868178652474880000,2017-05-26 18:54:55,"b""Let's be clear: Russia is an adversary that must be held accountable for interfering in the presidential election \xe2\x86\x92 https://t.co/9Setd8DbZx""",SenDuckworth,206,70
868178460665159681,2017-05-26 18:54:09,"b""Pres Trump's reckless decision to allow Russian state media into his WH meeting w/Russian FM&amp;Amb gave them the chan\xe2\x80\xa6 https://t.co/9b6h1CwoQK""",SenDuckworth,421,181
867866928680845313,2017-05-25 22:16:14,"b""Over 1 million Illinoisans rely on SNAP so they can put food on the table for their families, but the #TrumpBudget cuts SNAP's budget by 25%""",SenDuckworth,121,59
867866357387448321,2017-05-25 22:13:58,"b'Simply put, the #TrumpBudget puts our economy, Veterans, families, seniors, and environment on the chopping block https://t.co/TOjIkQsnSB'",SenDuckworth,340,182
867829252561018880,2017-05-25 19:46:31,b'Another important victory in the fight against discrimination #NoBanNoWall https://t.co/dqomAVY6wM',SenDuckworth,234,67
867749882249060352,2017-05-25 14:31:08,b'RT @gwhatchet: Watch highlights from @SenDuckworth\xe2\x80\x99s speech at #GWCommencement https://t.co/ghddB3YmeR https://t.co/DeKx5mZanx',SenDuckworth,0,8
867542010718277632,2017-05-25 00:45:08,"b'Great joining @JusticeDotOrg&amp; @NancyPelosi this evening. Now, more than ever, we need to champion rights of Vets, w\xe2\x80\xa6 https://t.co/jdLKWW9D31'",SenDuckworth,114,32
867510632878419971,2017-05-24 22:40:27,"b""Illinoisans' premiums will increase by nearly $700 under #TrumpCare. This is completely unacceptable. The ppl of IL\xe2\x80\x94&amp; America\xe2\x80\x94deserve better""",SenDuckworth,159,69
867509969201111040,2017-05-24 22:37:48,"b'Bottom line: #TrumpCare harms Veterans, forces older Americans to pay more &amp; raises costs &amp; out-of-pocket premiums\xe2\x80\xa6 https://t.co/eGw1p06Wp1'",SenDuckworth,266,166
867470489467461637,2017-05-24 20:00:56,"b""@willcountyboard Pres Trump's budget undermines the freight-related grant programs, which funds infrastructure proj\xe2\x80\xa6 https://t.co/2Uuwfc91VG""",SenDuckworth,34,19
867470365924220932,2017-05-24 20:00:26,b'.@willcountyboard&amp; I talked abt ending the opioid epidemic &amp; the devastating toll Pres Trump\xe2\x80\x99s budget will have on\xe2\x80\xa6 https://t.co/duwBzF9NLK',SenDuckworth,70,23
867396461725704196,2017-05-24 15:06:46,"b'""They gave up a lot for us\xe2\x80\x94the least we can do is try to return the favor."" @QNDRaiders Eagle Scouts make serving V\xe2\x80\xa6 https://t.co/5Ul0CkOqCD'",SenDuckworth,116,22
867101744572100610,2017-05-23 19:35:40,b'Pleased to see at least one Trump cabinet official pledging to follow the law today\xe2\x80\xa6 https://t.co/8Fscxxn3Nb',SenDuckworth,123,27
867101396805537797,2017-05-23 19:34:17,"b""Glad to see they've come to their senses\xe2\x80\x94for now. I've long pushed for the fiduciary rule to protect consumers \xe2\x86\x92\xe2\x80\xa6 https://t.co/st9oYZ4d98""",SenDuckworth,73,15
867088074190311425,2017-05-23 18:41:21,b'In Bloomington &amp; looking for a way to show your gratitude for our fallen heroes? Volunteer this Memorial Day \xe2\x86\x92 https://t.co/QUvdPYVLTs',SenDuckworth,51,17
867082267713298432,2017-05-23 18:18:16,b'This irresponsible budget proposal merely continues President Trump\xe2\x80\x99s long list of broken campaign promises \xe2\x86\x92\xe2\x80\xa6 https://t.co/nByQ2myMkO',SenDuckworth,199,75
867047619067092992,2017-05-23 16:00:36,b'.@NSAGov should inform the American people immediately if any listening devices were found in the Oval Office\xe2\x80\xa6 https://t.co/UNP2k3Yyq9',SenDuckworth,111,41
867047063862865922,2017-05-23 15:58:23,"b""It's alarming POTUS not only shared classified intel w/Russian officials\xe2\x80\x94he also let Russian media into mtng, giving them a chance to bug WH""",SenDuckworth,317,118
867027800380907522,2017-05-23 14:41:50,b'Targeting innocent civilians with terror is a cowardly act that must be opposed by all civilization. I grieve for #Manchester',SenDuckworth,302,68
866794308606754816,2017-05-22 23:14:02,"b'Read my Q&amp;A with @CollegeMag about public service, my work for Vets, &amp; the importance of diversity in Congress \xe2\x86\x92 https://t.co/5vIwphMLUz'",SenDuckworth,75,22
866750641644986368,2017-05-22 20:20:31,b'Glad to see so many Illinois businesses &amp; workers recognized by @Forbes in this year\xe2\x80\x99s Forbes #SmallGiants list https://t.co/hLAovEgqnt',SenDuckworth,48,9
866708032100630528,2017-05-22 17:31:12,"b'Thank you, @resolveorg members\xe2\x80\x94incl Kiersten, who biked frm Chicago to DC\xe2\x80\x94for raising awareness for IVF for Veteran\xe2\x80\xa6 https://t.co/dq19U0XQ3G'",SenDuckworth,70,13
866688909924868101,2017-05-22 16:15:13,"b'Last week, I called for President Trump to end the gimmicks and make a serious investment in our nation\xe2\x80\x99s infrastru\xe2\x80\xa6 https://t.co/TVW4s7pEAC'",SenDuckworth,190,46
866337864623296512,2017-05-21 17:00:17,b'So honored to deliver the commencement address at @GWtweets #Congratulations https://t.co/zlN8H7Eh6R',SenDuckworth,657,168
866316966826561536,2017-05-21 15:37:14,b'RT @GWtweets: Sen. Tammy Duckworth on persevering: https://t.co/pAOfYLh9kQ',SenDuckworth,0,116
866314365460500482,2017-05-21 15:26:54,"b'Put yourself out there. Don\xe2\x80\x99t be a \xe2\x80\x9ctimid soul who knows neither victory nor defeat.\xe2\x80\x9d Congrats, class of 2017\xe2\x80\x93it\xe2\x80\x99s time to get in the arena'",SenDuckworth,111,36
866314105396895744,2017-05-21 15:25:52,"b'I am calling on every @GWtweets student to serve. Get loud, get active. Make a difference in your city, in your state, in your country'",SenDuckworth,169,69
866314015701696513,2017-05-21 15:25:31,b'@GWtweets President Roosevelt understood that well. It\xe2\x80\x99s about trying. It\xe2\x80\x99s about doing. Don\xe2\x80\x99t be afraid of failure\xe2\x80\xa6 https://t.co/0RhYnFNCHI',SenDuckworth,32,13
866313870167724038,2017-05-21 15:24:56,"b""@GWtweets But we aren't successful in spite of our challenges, we're successful because of our will to overcome them""",SenDuckworth,36,17
866313684406210561,2017-05-21 15:24:12,"b'@GWtweets There will be hard times &amp; moments you feel discouraged. Remember Pres Roosevelt\xe2\x80\x99s words: ""there is no ef\xe2\x80\xa6 https://t.co/9aSjFVB6N1'",SenDuckworth,41,19
866313544794615809,2017-05-21 15:23:39,"b'@GWtweets I want the @GWtweets class of 2017 to remember this moment, the tenacity, diligence, work ethic &amp; dedicat\xe2\x80\xa6 https://t.co/ZwJ9kkkjfw'",SenDuckworth,35,13
866312725126934529,2017-05-21 15:20:23,"b'Over &amp; over, the students of @GWtweets have proven to be civically-engaged students, showing leadership in &amp; out of the political arena'",SenDuckworth,42,14
866312576132579329,2017-05-21 15:19:48,"b'My story has a few more years than GWU students, but I\xe2\x80\x99m not really that different. I know each &amp; every student can get into the arena, too'",SenDuckworth,37,8
866312353037656065,2017-05-21 15:18:54,"b'After I got out of Walter Reed, I went to the VA, I ran for Congress and then I won my seat in the Senate'",SenDuckworth,46,11
866312293390405633,2017-05-21 15:18:40,"b'I realized that maybe I was done serving in combat, but I could see the next step in my life\xe2\x80\x99s path still meant serving my fellow Veterans'",SenDuckworth,37,11
866311941043757056,2017-05-21 15:17:16,"b'After every time I couldn\xe2\x80\x99t do something, after every day when I didn\xe2\x80\x99t know how I\xe2\x80\x99d make it to the next, I made the choice not to give up'",SenDuckworth,35,9
866311771031822337,2017-05-21 15:16:36,"b'With the help of my family, friends and fellow servicemembers at Walter Reed, I began my recovery. It was anything but easy'",SenDuckworth,45,10
866311573509472256,2017-05-21 15:15:49,"b'I was quite literally in pieces, but my buddies wouldn\xe2\x80\x99t give up on me. They refused to leave me behind&amp; I survived to serve my nation again'",SenDuckworth,68,12
866311210953826304,2017-05-21 15:14:22,"b'Nov 12, \'04 is my \xe2\x80\x9cAlive Day""\xe2\x80\x93the day that I almost died but didn\'t\xe2\x80\x93when an RPG tore thru the cockpit of the helicopter I was flying in Iraq'",SenDuckworth,63,20
866311078581501953,2017-05-21 15:13:51,b'I\xe2\x80\x99ve had plenty of moments when I thought of giving up \xe2\x80\x93 moments when I thought I had been defeated',SenDuckworth,36,11
866310139120431106,2017-05-21 15:10:07,"b'Successful people didn\xe2\x80\x99t make it because they never failed, they made it because they never gave up'",SenDuckworth,77,27
866310030311796737,2017-05-21 15:09:41,"b'Teddy Roosevelt once said, ""the credit belongs to the man who is in the arena... because there is no effort without error &amp; shortcoming""'",SenDuckworth,44,18
866309863437152257,2017-05-21 15:09:01,"b'My message to all students\xe2\x80\x94wherever you fall on the political spectrum\xe2\x80\x94is to get involved, not discouraged'",SenDuckworth,70,25
866309045484998657,2017-05-21 15:05:46,b'I\xe2\x80\x99m speaking at the @GWtweets commencement \xe2\x80\x93 watch live here: https://t.co/9klJQPBln4',SenDuckworth,162,32
865665817891012608,2017-05-19 20:29:48,b'RT @starsandstripes: .@SenDuckworth to #SecDef Mattis: \xe2\x80\x98Deeply concerned\xe2\x80\x99 over Trump sharing top secret info with Russians https://t.co/ld7\xe2\x80\xa6',SenDuckworth,0,43
865623608671977475,2017-05-19 17:42:05,b'RT @SenatorDurbin: Thanks @SenDuckworth @CongressmanRaja @RepBillFoster @janschakowsky &amp; MP from Czech Republic Parliament for joining IL d\xe2\x80\xa6',SenDuckworth,0,21
865606525456273408,2017-05-19 16:34:12,"b""RT @chicagotribune: Tammy Duckworth joined several senators in asking the DOJ to investigate AG Jeff Sessions.\n\nToday's Morning Spin: https\xe2\x80\xa6""",SenDuckworth,0,172
865569856879505408,2017-05-19 14:08:30,"b""RT @girlscouts: For #APAHM we're saluting G.I.R.L.s (Go-getter, Innovator, Risk-taker, Leader)\xe2\x84\xa2 we admire, including @SenDuckworth! https:/\xe2\x80\xa6""",SenDuckworth,0,22
865244474296938496,2017-05-18 16:35:32,"b""Led by your own administration's Department of Justice? https://t.co/TZ6aJ0Tb9y""",SenDuckworth,1177,349
865018559612821505,2017-05-18 01:37:50,"b'The chaos coming out of the WH undermines that goal, putting US Troops at greater risk &amp; jeopardizing America\xe2\x80\x99s sta\xe2\x80\xa6 https://t.co/fTsERJK8tw'",SenDuckworth,247,117
865018000986038276,2017-05-18 01:35:37,"b'During his confirmation process, Secretary Mattis called for comprehensive plans and strategies to confront Russian aggression'",SenDuckworth,147,32
864987197119881216,2017-05-17 23:33:13,b'Special Counsel Mueller\xe2\x80\x99s investigation must be fully-resourced and remain free of WH influence so the American people can get the truth',SenDuckworth,256,77
864986825106051076,2017-05-17 23:31:44,b'Appointing a special counsel is a positive step to help protect our democracy and ensure Trump-Russia ties are full\xe2\x80\xa6 https://t.co/tOOP1ZCiRE',SenDuckworth,683,150
864942068917035008,2017-05-17 20:33:53,"b""RT @CQnow: .@SenDuckworth finishes the ACLI Capital Challenge Wednesday. Roll Call's @pennstatetom has more here: https://t.co/BzcuPB7wrM h\xe2\x80\xa6""",SenDuckworth,0,38
864922408146350080,2017-05-17 19:15:46,b'Honored to join colleagues &amp; leaders yesterday evening at @APAICS to celebrate the contributions &amp; accomplishments\xe2\x80\xa6 https://t.co/1ZvNjVCqAB',SenDuckworth,50,18
864919345482403840,2017-05-17 19:03:36,b'Proud to support #IDAHOT 2017\xe2\x80\x94no person should ever be discriminated against or face bigotry due to their gender or sexual orientation',SenDuckworth,222,54
864899363797184512,2017-05-17 17:44:12,"b'.@MartinHeinrich, @SenWarren &amp; I are demanding @JusticeOIG start an investigation into this critical matter ASAP https://t.co/C9kEqUACEy'",SenDuckworth,169,59
864899100210278400,2017-05-17 17:43:09,"b'As new reports on Trump-Russia ties surface by the hour, it\xe2\x80\x99s vital we get to the bottom of AG Sessions\xe2\x80\x99 role in the firing of FBI Dir Comey'",SenDuckworth,881,332
864885609931972609,2017-05-17 16:49:32,b'Wishing you a speedy recovery and can\xe2\x80\x99t wait to see you back at work https://t.co/VcFwi0SJRP',SenDuckworth,69,10
864844911123804160,2017-05-17 14:07:49,"b'Yesterday, I talked about expanding homeownership &amp; housing opportunities for Veterans with Illinois members of\xe2\x80\xa6 https://t.co/LxXBuMEYVb'",SenDuckworth,71,18
864640993886433281,2017-05-17 00:37:31,b'Message for President Trump: Russia is not our friend https://t.co/XlkLUkh4Ki',SenDuckworth,367,125
864635769293594625,2017-05-17 00:16:46,b'Glad to discuss my bill to award WWII Chinese American Vets the Congressional Medal of Honor w/ Chinese American Ci\xe2\x80\xa6 https://t.co/HUaaDB4ILn',SenDuckworth,170,32
864618641194614785,2017-05-16 23:08:42,"b'I eagerly await the White House\xe2\x80\x99s 2nd, 5th and 9th explanations for this one https://t.co/XW8s84sVT1'",SenDuckworth,2672,1066
864583275364462593,2017-05-16 20:48:10,"b""Best wishes to you, @maziehirono, and your loved ones\xe2\x80\x94I know you'll keep fighting for the people of Hawaii, and I w\xe2\x80\xa6 https://t.co/24ydgVqmHd""",SenDuckworth,158,42
864564713677615104,2017-05-16 19:34:25,"b""We deserve to know what\xe2\x80\x99s really going on here\xe2\x80\x94and it's clear as day that only an independent special prosecutor can get the answers we need""",SenDuckworth,323,98
864564478314242048,2017-05-16 19:33:29,b'President Trump\xe2\x80\x99s reckless treatment of classified information from a U.S. ally poses a serious threat to our natio\xe2\x80\xa6 https://t.co/rtsrKPjWaq',SenDuckworth,748,318
864541708771635200,2017-05-16 18:03:00,"b'Every Second Lieutenant is held to this standard. Does your advice apply to the Commander-in-Chief, too? https://t.co/MsoTv9jzeM'",SenDuckworth,928,393
864518351061749760,2017-05-16 16:30:11,b'A reminder for POTUS before his meeting with President Erdogan: classified intel is not something you use to impress your friends',SenDuckworth,8257,3150
864294395809599488,2017-05-16 01:40:16,"b""If President Trump truly cares about helping victims of Assad's brutal regime, he should start by opening America\xe2\x80\x99s doors to #SyrianRefugees""",SenDuckworth,395,134
864294113696509953,2017-05-16 01:39:09,"b'The world needs to recognize Assad for the murderous butcher he is, and the Russian-backed Assad regime cannot be allowed to stay in power'",SenDuckworth,331,115
864293982771326976,2017-05-16 01:38:37,"b'A horrifying reminder of why we cannot let human rights take a backseat in U.S. foreign policy, as some have sugges\xe2\x80\xa6 https://t.co/Ev6NAoCjhy'",SenDuckworth,767,337
864238845612748800,2017-05-15 21:59:32,"b'For a President who complains so much about leaks, this is stunning https://t.co/H6lJvBY2Fm'",SenDuckworth,2392,936
864209066062741507,2017-05-15 20:01:12,b'This is a move in the right direction\xe2\x80\x94discriminatory laws that block Americans frm exercising the fundamental right\xe2\x80\xa6 https://t.co/nJTcZ3EctB',SenDuckworth,319,59
864147877861437440,2017-05-15 15:58:03,b'RT @TheEconomist: Why are the Baltic states so concerned? https://t.co/8mIxyTnZ8H',SenDuckworth,0,132
863917386243637248,2017-05-15 00:42:10,"b""Just in time for #MothersDay I intro'd the FAM Act this wk to ensure moms have a safe place to breastfeed their chi\xe2\x80\xa6 https://t.co/YQMBuhNo8P""",SenDuckworth,293,77
863825365646675969,2017-05-14 18:36:30,"b'Wishing a happy Mother\xe2\x80\x99s Day to mothers across America whose hard work, love and dedication ensures our children an\xe2\x80\xa6 https://t.co/QXs0A6oUoH'",SenDuckworth,250,38
863394657237159936,2017-05-13 14:05:02,"b""I'm proud to help intro the MISSION ZERO Act - a bipartisan bill to improve trauma care at hospitals by hiring experienced military surgeons""",SenDuckworth,329,69
863394403427155969,2017-05-13 14:04:01,b'I learned a lot about trauma care while recovering at Walter Reed. But not every American has access to the same expertise I had.',SenDuckworth,387,77
863187033493127168,2017-05-13 00:20:00,"b""Great to be back at my alma mater, @NIUlive. I can't believe it's been 25 years since my own #ROTC commissioning ce\xe2\x80\xa6 https://t.co/wc8IVUy4Yj""",SenDuckworth,300,49
863181999640461313,2017-05-13 00:00:00,b'Honored to speak to hardworking young cadets who are dedicated to serving their country at the @NIUlive ROTC spring\xe2\x80\xa6 https://t.co/wRRrDGoPDF',SenDuckworth,140,32
863169823718735872,2017-05-12 23:11:37,"b'Proud to announce my first Senate bill, which cuts red tape for IL #jobs, became law today in record time https://t.co/yI3FCB5ZUS'",SenDuckworth,512,83
863058833069019137,2017-05-12 15:50:35,"b'As we learned from the Flint water crisis, we need to empower regional EPA offices like Chicago\xe2\x80\x99s. Closing them would put families at risk.'",SenDuckworth,181,60
863058376330276865,2017-05-12 15:48:46,b'I wrote to EPA Administrator Scott Pruitt making it clear that closing the Chicago EPA office would jeopardize Amer\xe2\x80\xa6 https://t.co/ycd3oLNOkX',SenDuckworth,553,197
862763492205580289,2017-05-11 20:17:00,b'I met with IL State Council of Machinists &amp; Aerospace Workers yesterday to discuss work being done in IL aviation/a\xe2\x80\xa6 https://t.co/7GKDsNSyzD',SenDuckworth,72,25
862710956815785986,2017-05-11 16:48:15,"b""Could not agree more. The timing of Comey's firing is suspicious &amp; there are too many unanswered questions. We need\xe2\x80\xa6 https://t.co/Xf1rIqbUbO""",SenDuckworth,995,344
862472333268627457,2017-05-11 01:00:02,"b'At an Environment&amp; Public Works Cmte hearing yesterday, I spoke abt the importance of investing in our locks&amp;dams &amp;\xe2\x80\xa6 https://t.co/nyNcNtLkdT'",SenDuckworth,152,31
862457371154690053,2017-05-11 00:00:35,b'There are a lot of unanswered questions surrounding the firing of FBI Dir Comey. President Trump owes the American\xe2\x80\xa6 https://t.co/eOchVBPAsX',SenDuckworth,742,238
862419934504255488,2017-05-10 21:31:50,b'RT @21stShow: .@SenDuckworth says many IL constituents want an independent Russia investigation. #ComeyFiring Listen:\nhttps://t.co/pb3axJl0\xe2\x80\xa6',SenDuckworth,0,49
862408909667151872,2017-05-10 20:48:01,b'Last week: FBI Director Comey asked for more resources for Trump-Russia investigation\n \nYesterday: Comey is fired https://t.co/nKpwxQBVF7',SenDuckworth,333,175
862369436245917699,2017-05-10 18:11:10,"b'Troubling\xe2\x80\x941 day after the man investigating Russia-Trump ties is fired, Pres hosts Russian Amb his NatSec Adviser w\xe2\x80\xa6 https://t.co/j8uKvCflSP'",SenDuckworth,425,242
862339384204570624,2017-05-10 16:11:45,b'I\xe2\x80\x99m sure the President wants the American people to believe there\xe2\x80\x99s nothing to see here https://t.co/6o1o0Ps4Ll',SenDuckworth,501,185
862130402202464257,2017-05-10 02:21:20,b'There are simply too many questions raised by tonight\xe2\x80\x99s actions. The American people deserve answers\xe2\x80\x94now\xe2\x80\x94from an in\xe2\x80\xa6 https://t.co/vTPpgzvB9C',SenDuckworth,824,384
862130057036300288,2017-05-10 02:19:57,b'The firing of FBI Director Comey should eliminate any remaining doubts about the need for an independent investigation into the Trump Admin',SenDuckworth,1120,496
862129697521577985,2017-05-10 02:18:32,"b""The Pres\xe2\x80\x99 actions raise serious concerns\xe2\x80\x94esp if they're intended to dissuade investigators frm digging too deep int\xe2\x80\xa6 https://t.co/cfq3VUxY9m""",SenDuckworth,630,198
862049858840133632,2017-05-09 21:01:17,"b""Thank you to the millions of teachers in IL &amp; across America who help educate, motivate &amp; inspire our nation's stud\xe2\x80\xa6 https://t.co/I3fefM1gxH""",SenDuckworth,201,67
862038430032830465,2017-05-09 20:15:52,b'.@IHAhospitals and I met today to discuss the harmful effect #Trumpcare will have on Veterans &amp; hospitals across Il\xe2\x80\xa6 https://t.co/97eyyMeUru',SenDuckworth,127,51
862013808990146565,2017-05-09 18:38:02,"b""RT @SenateDems: .@SenDuckworth @SenatorTester @SenBillNelson @SenBlumenthal are fighting for vets but the GOP's  #Trumpcare bill would incr\xe2\x80\xa6""",SenDuckworth,0,119
862012816152084480,2017-05-09 18:34:05,b'RT @timkaine: Trumpcare could make it harder for millions of veterans to afford health care. Proud to join @SenDuckworth to fight this disg\xe2\x80\xa6',SenDuckworth,0,611
862012579794878464,2017-05-09 18:33:09,"b'RT @SenBlumenthal: Joined @SenDuckworth, @SenBillNelson, &amp; @SenatorTester earlier today to discuss #Trumpcare tax hike for millions of vets\xe2\x80\xa6'",SenDuckworth,0,41
861963586700267522,2017-05-09 15:18:28,"b'A month ago, I called on Republicans to take any #Trumpcare provisions that hurt Vets off the table. Read here \xe2\x86\x92 https://t.co/b4vSErrVkM'",SenDuckworth,86,37
861961932366110720,2017-05-09 15:11:53,"b""I'll fight this proposal tooth &amp; nail to make sure every Veteran\xe2\x80\x94and every American\xe2\x80\x94is able to receive the care they deserve #CareForVets""",SenDuckworth,174,61
861960954585780224,2017-05-09 15:08:00,b'.@SenatorTester @SenBillNelson @SenBlumenthal We need to hold the GOP accountable &amp; let them know any attempt to re\xe2\x80\xa6 https://t.co/nlpRRkOwHJ',SenDuckworth,133,56
861960185778229248,2017-05-09 15:04:57,b'.@SenatorTester @SenBillNelson @SenBlumenthal It\xe2\x80\x99s disgraceful the GOP incl. a provision in #Trumpcare to raise tax\xe2\x80\xa6 https://t.co/7vGBmpa6JA',SenDuckworth,258,182
861957615978516480,2017-05-09 14:54:44,"b""I\xe2\x80\x99m with @SenatorTester @SenBillNelson &amp; @SenBlumenthal to call out #Trumpcare's devastating tax hike on Veterans\xe2\x80\xa6 https://t.co/521kr8WHkv""",SenDuckworth,574,260
861696551344885762,2017-05-08 21:37:22,"b'RT @AAAJ_AAJC: Love thy neighbor, no exceptions. #NoMuslimBanEver https://t.co/7YG1nk0Xhn'",SenDuckworth,0,54
