id,created_at,text,user,favorite_count,retweet_count
796836199247790080,2016-11-10 22:05:29,b'RT @attn: More women will be in the Senate than ever before https://t.co/2VyJKpPWsm',SenGillibrand,0,122
796537005358379008,2016-11-10 02:16:35,b'I hope more women will continue to run for office so we can continue to grow our numbers and expand the diversity of voices at the table.',SenGillibrand,431,129
796535537221902337,2016-11-10 02:10:45,"b'We will now have 21 women in the U.S. Senate, a new high, including 3 more women of color elected last night, increasing our diversity.'",SenGillibrand,855,348
796533123156680704,2016-11-10 02:01:10,"b""Despite a very sad loss last night, I'm thrilled @CatherineForNV, @TammyForIL, @KamalaHarris &amp; @Maggie_Hassan will be joining the US Senate.""",SenGillibrand,309,85
796531553811787776,2016-11-10 01:54:55,"b'Thank you to all of the women who ran for office this year. Win or lose, by raising your voice and running, you made a difference.'",SenGillibrand,1444,450
796521391499657217,2016-11-10 01:14:33,"b'Thank you, @HillaryClinton, such an important reminder. https://t.co/r4RbDddurz'",SenGillibrand,479,129
796440684601475081,2016-11-09 19:53:51,"b""I am deeply committed to serving others, making a difference in Americans' lives and helping to heal our great country.""",SenGillibrand,241,34
796439831542956041,2016-11-09 19:50:27,b'I stand ready to work w/President-Elect Trump on shared goals &amp; values and will be equally vigilant in opposing him where our values diverge',SenGillibrand,404,80
796439378016907264,2016-11-09 19:48:39,"b'I was deeply heartbroken by the results last night. @HillaryClinton has been a friend, mentor and inspiration to me my entire adult life.'",SenGillibrand,1390,236
796158492109373440,2016-11-09 01:12:31,"b'Congratulations to @TammyforIL, an extraordinary public servant who will make an extraordinary Senator for #IL! https://t.co/M18bcdXdl4'",SenGillibrand,711,199
796118707391045632,2016-11-08 22:34:25,b'RT @LtGovHochulNY: Still 3.5 hours left to vote on #ElectionDay https://t.co/v2r6Q9k1yE',SenGillibrand,0,13
796118533830823936,2016-11-08 22:33:44,"b'Up at @NowThis, I joined an extraordinary group of women to explain why voting in this election is so important. https://t.co/9hhwbrKjZh'",SenGillibrand,36,11
796090911188979716,2016-11-08 20:43:58,b'We need more diverse voices serving in office &amp; it needs to reflect our population. That starts with women making up 51% of Congress!',SenGillibrand,58,19
796090124941533184,2016-11-08 20:40:51,"b'When it comes to running for office, women can be their own worst self-doubters. We need more women to get #offthesidelines and run!'",SenGillibrand,91,33
796089675962318848,2016-11-08 20:39:04,b'.@MMViverito &amp; I on why women are often reluctant to run for office but why we need more women to run and serve. https://t.co/ezZneNEA8X',SenGillibrand,87,48
796075439294971905,2016-11-08 19:42:29,"b""RT @NancyPelosi: It's been a long time coming. Time to #vote. https://t.co/nKLAsx1f7b""",SenGillibrand,0,1725
796074891640500224,2016-11-08 19:40:19,b'RT @dscc: Choose progress \xf0\x9f\x87\xba\xf0\x9f\x87\xb8\nChoose hope \xf0\x9f\x99\x8c\nChoose love \xf0\x9f\x92\x99\nChoose equality \xe2\x9c\x8c\xef\xb8\x8f\nVote! \xe2\x86\x92 https://t.co/cLKJH3wcZe #ElectionDay',SenGillibrand,0,19
796073594430308353,2016-11-08 19:35:09,"b'From the @BrennanCenter, everything voters need to know in order to #vote today.\n\nhttps://t.co/f0X7HzCivm'",SenGillibrand,23,14
796070649651490819,2016-11-08 19:23:27,"b""Let's send a powerful message today by delivering @HillaryClinton a Democratic Senate filled with a record number of women! #offthesidelines""",SenGillibrand,299,99
796060052775903233,2016-11-08 18:41:21,"b'On this historic day, powerful to see so many lined up at @MountHopeRoc Cemetery in @CityRochesterNY to visit Susan\xe2\x80\xa6 https://t.co/ns9qFmFDav'",SenGillibrand,293,128
796056629976453120,2016-11-08 18:27:45,"b'RT @CatherineForNV: Today, we\xe2\x80\x99re giving it all we\xe2\x80\x99ve got. Let\xe2\x80\x99s turn Nevada blue! #NVTogether\n\nFind your polling place here: https://t.co/o\xe2\x80\xa6'",SenGillibrand,0,46
796052290754977792,2016-11-08 18:10:30,b'Support our amazing women running in #NY\n@ColleenDeacon in #NY24\n@KimforCongress in #NY22\n@ZephyrTeachout in #NY19\n@AnnaThroneHolst in #NY01',SenGillibrand,134,93
796051265394536448,2016-11-08 18:06:26,"b""Today, as we vote to elect @HillaryClinton our next President, let's also make sure to elect strong Democratic candidates for House &amp; Senate""",SenGillibrand,303,94
796043779069317120,2016-11-08 17:36:41,"b""RT @HillaryClinton: Everything we\xe2\x80\x99ve worked toward comes down to today. RT this if you're voting for Hillary: https://t.co/jfd3CXLD1s https\xe2\x80\xa6""",SenGillibrand,0,61743
796018126571835393,2016-11-08 15:54:45,"b'If you experience any issues or problems at the polls today, report them by calling the #NY Election Day hotline at 1-800-771-7755.'",SenGillibrand,38,63
796017073604460545,2016-11-08 15:50:34,"b""#NY'ers, polls are open until 9PM. Get out and make your voices heard!\n\nDo you know where your voting location is? \n\nhttps://t.co/x95mS2uRN6""",SenGillibrand,49,33
796009227860983808,2016-11-08 15:19:23,"b""Let's make history today. #ImWithHer https://t.co/5saHuOHvOL""",SenGillibrand,483,126
795761368771264512,2016-11-07 22:54:29,"b""#NY'ers, polls open at 6AM tomorrow and close at 9PM. Do you know where your voting location is? #MakeaPlan to vote\n\nhttps://t.co/1GKG0d9Hbw""",SenGillibrand,537,261
795728768019087360,2016-11-07 20:44:56,b'How to govern like a feminist means working to empower women in the workplace with policies like #paidleave. https://t.co/egKjk1n7yK',SenGillibrand,91,34
795726007152021504,2016-11-07 20:33:58,b'RT @GabbyGiffords: Hillary is tough. Hillary is courageous. She will fight to make our families safer. That\xe2\x80\x99s why #ImWithHer!',SenGillibrand,0,316
795717892092391424,2016-11-07 20:01:43,"b'RT @repjohnlewis: I\xe2\x80\x99ve marched, protested, been beaten and arrested--all for the right to vote. Friends of mine gave their lives. Honor the\xe2\x80\xa6'",SenGillibrand,0,52425
795711003325566981,2016-11-07 19:34:21,"b""RT @HillaryClinton: This one's for you, Hillary. https://t.co/KtzpIpSziO""",SenGillibrand,0,24148
795704002742722560,2016-11-07 19:06:32,"b'With just 1 day until election day, what are you doing to help elect @HillaryClinton and Democrats up and down the ballot?'",SenGillibrand,57,18
795703302797295617,2016-11-07 19:03:45,b'Do you know when and where to vote &amp; make your voice heard tomorrow? Find out at the link below.\n\nhttps://t.co/9zHX2AWP2O',SenGillibrand,26,12
795692107440787456,2016-11-07 18:19:16,"b'Very saddened to learn of the passing of Janet Reno, who blazed a trail for women in government as our first female U.S. Attorney General.'",SenGillibrand,181,49
795678646736404480,2016-11-07 17:25:47,"b'Thx to everyone who has gotten #offthesidelines &amp; volunteered for campaigns this election season, such an impt way to make your voice heard!'",SenGillibrand,29,10
795677828176105472,2016-11-07 17:22:31,"b""Also stopped by @ZephyrTeachout campaign HQ in #Troy to thank volunteers who've been working to get out the vote for Zephyr in #NY19! #gotv""",SenGillibrand,36,10
795676348002037764,2016-11-07 17:16:38,"b'.@ZephyrTeachout will be a champion for our Upstate #NY families, farmers &amp; veterans. We need her fighting for us in Congress! #NY19'",SenGillibrand,35,19
795675959919779840,2016-11-07 17:15:06,"b'This AM, joined @ZephyrTeachout at the Country View Diner in #Troy to greet voters &amp; let them know why Zephyr is th\xe2\x80\xa6 https://t.co/9P54ZkFl8B'",SenGillibrand,111,34
795667489652871168,2016-11-07 16:41:26,"b"".@conniebritton &amp; I sat down w/@Time to discuss @HillaryClinton, importance of women's voices &amp; owning our ambition. https://t.co/HYtGjFiUCR""",SenGillibrand,35,14
795361878662856704,2016-11-06 20:27:03,"b'With just 2 days until election day, do you know when &amp; where to vote? \n\n#MakeAPlan to #vote:\n\nhttps://t.co/1GKG0d9Hbw'",SenGillibrand,40,23
795347283474841600,2016-11-06 19:29:03,"b""Let's go @NYCFC &amp; @NewYorkRedBulls! Both playing in their second leg #MLSCupPlayoffs matches at home today! #WeAreOne""",SenGillibrand,52,5
795297296229498880,2016-11-06 16:10:25,"b'Wishing NYPD Sgt Emmanuel Kwo a swift recovery. So grateful for the service of Sgts. Tuozzolo &amp; Kwo, who risked their lives to keep NYC safe'",SenGillibrand,39,10
795296789075283972,2016-11-06 16:08:25,"b'My thoughts &amp; prayers are with the loved ones of NYPD Sgt. Paul Tuozzolo, who was killed in the line of duty Friday in The Bronx.'",SenGillibrand,109,34
795264010509840385,2016-11-06 13:58:10,b'Race day! Wishing everyone running in the #nycmarathon today the best! @nycmarathon',SenGillibrand,70,13
795015054085292033,2016-11-05 21:28:54,"b'As my former #CNY director, @ColleenDeacon fought to help families in the #Syracuse region &amp; will continue to fight for you in Congress!'",SenGillibrand,15,5
795013581469315072,2016-11-05 21:23:03,"b'Joined @ColleenDeacon &amp; @KimForCongress yesterday for #GOTV events in #CNY. Voters in #NY22 &amp; #NY24, pls support these amazing women on Tues'",SenGillibrand,31,18
795000830688628737,2016-11-05 20:32:23,"b'RT @KatieMcGintyPA: .@JoeBiden: ""Katie\'s from the same neighborhoods you\'re from...everything she\'s done has been about serving this state\xe2\x80\xa6'",SenGillibrand,0,102
794992390893404160,2016-11-05 19:58:50,"b'Yes, @ZephyrTeachout is amazing! Such a champion for our Upstate families, farmers &amp; vets, I need her fighting by m\xe2\x80\xa6 https://t.co/vKSCPLS5Si'",SenGillibrand,186,97
794991976319946753,2016-11-05 19:57:12,b'This wknd is the final push to help get out the vote for @HillaryClinton &amp; all our Dems up &amp; down the ballot! What are you doing to #GOTV?',SenGillibrand,94,35
794977800566362112,2016-11-05 19:00:52,b'3 days until election day!\n\nBe sure to #makeaplan to vote for @HillaryClinton as well as our down ballot Democrats!\n\nhttps://t.co/1GKG0dri34',SenGillibrand,49,23
794971022206402561,2016-11-05 18:33:56,b'RT @KathyHochul: Continuing the push to #GetOutTheVote for the great #Democratic candidates we have across #UpstateNY. #GOTV @louiseslaught\xe2\x80\xa6',SenGillibrand,0,14
794659125040975873,2016-11-04 21:54:34,"b'In final days before election day, pls help @KimforCongress win on Tuesday by volunteering for her campaign: https://t.co/Q0p1vZuCFy. #NY22'",SenGillibrand,15,9
794658824103874564,2016-11-04 21:53:22,"b'With 4 days to election day, joined @KimForCongress at a senior center in #Oneida to talk to voters about her campa\xe2\x80\xa6 https://t.co/XgjPcNeCGK'",SenGillibrand,61,22
794654881474822144,2016-11-04 21:37:42,b'RT @MayorMinerSYR: Hey @emilyslist - Check out the #GirlClub from CNY! @SenGillibrand @KathyHochul &amp; more working to elect @colleendeacon &amp;\xe2\x80\xa6',SenGillibrand,0,20
794634621917003776,2016-11-04 20:17:12,"b'I agree with Pres. @BarackObama: ""@ColleenDeacon will find real solutions for #CNY families."" #NY24\n\nWatch the ad: https://t.co/Xia4zXXw89'",SenGillibrand,21,15
794634327627862017,2016-11-04 20:16:01,"b"".@ColleenDeacon knows what it's like to struggle and fight to put food on the table--we need that kind of experience in Congress! #NY24""",SenGillibrand,16,8
794633936563535872,2016-11-04 20:14:28,"b'Great to join @KathyHochul, @MayorMinerSYR &amp; amazing women leaders in Syracuse to rally #NY24 voters to get out the\xe2\x80\xa6 https://t.co/RpYYCceAFC'",SenGillibrand,31,9
794633526020886528,2016-11-04 20:12:50,b'RT @KathyHochul: Stressing the importance of getting out the vote for so many incredible female candidates on Tuesday. #GOTV #ImWithHer #CN\xe2\x80\xa6',SenGillibrand,0,19
794612278880571392,2016-11-04 18:48:25,b'RT @Fusion: Women with ambition are often treated WAY differently than men\xe2\x80\x94so what gives?\n\n@SenGillibrand helps us break it down. https://t\xe2\x80\xa6',SenGillibrand,0,51
794611389935525888,2016-11-04 18:44:53,"b""Sat down w/@Fusion's @AliciaMenendez for #WomanCard doc on the importance of having more women run &amp; serve in office https://t.co/ooAwL2BEPW""",SenGillibrand,28,25
794605575497797632,2016-11-04 18:21:46,b'Be sure to #makeaplan to vote for @HillaryClinton as well as our down ballot Dems incl our Democratic women Senate candidates! #winwithwomen',SenGillibrand,97,65
794605041831280640,2016-11-04 18:19:39,"b'RT @emilyslist: In Nevada, @CatherineForNV is running for a Senate seat we MUST hold. And this race is neck-and-neck! #NVSen #WinWithWomen\xe2\x80\xa6'",SenGillibrand,0,30
794604452472909824,2016-11-04 18:17:19,"b'With just 1 wkd left before election day, commit to volunteer, walk door to door, make phone calls--help Democrats #winwithwomen on Tuesday!'",SenGillibrand,62,25
794602110763536384,2016-11-04 18:08:00,b'RT @emilyslist: .@DeborahRossNC is a champion for NC women and families and will fight for them in the Senate. #NCSen #WinWithWomen https:/\xe2\x80\xa6',SenGillibrand,0,41
794601505206706179,2016-11-04 18:05:36,"b'On #Nov8, #NV voters have the chance to send @CatherineForNV to the Senate. Help her get out the vote! https://t.co/pIGMlq8Snn #winwithwomen'",SenGillibrand,51,41
794600486074806272,2016-11-04 18:01:33,b'.@TammyforIL sacrificed so much for our country and will never stop fighting for #IL in the Senate. https://t.co/7nV1XV2hdg #winwithwomen',SenGillibrand,117,71
794599821516668933,2016-11-04 17:58:55,"b'#NC voters, pls help send @DeborahRossNC to the U.S. Senate--vote early or on #Nov8 &amp; pls volunteer!\xe2\x80\xa6 https://t.co/m8tP2AMZ2G'",SenGillibrand,33,17
794597980426895362,2016-11-04 17:51:36,"b'In #CA, my friend @BarbaraBoxer has huge shoes to fill, but @KamalaHarris is the woman for the job! https://t.co/uQ9velRs4G #winwithwomen'",SenGillibrand,49,31
794597391752105986,2016-11-04 17:49:15,"b""Pennsylvania, I need @KatieMcGintyPA fighting by my side in the Senate to cont the progress we've made\xe2\x80\xa6 https://t.co/AnZV3nRvIA""",SenGillibrand,69,39
794596701730435073,2016-11-04 17:46:31,b'.@Maggie_Hassan fights for NH families every day as governor &amp; will fight just as hard as your Senator https://t.co/iFb0pP79nN #winwithwomen',SenGillibrand,39,44
794596492694749185,2016-11-04 17:45:41,"b'RT @emilyslist: On November 8th, we can take back the Senate with pro-choice Democratic women. #WinWithWomen https://t.co/dpe503mXVe'",SenGillibrand,0,47
794596096786001920,2016-11-04 17:44:07,"b""My colleagues &amp; I need more Dem women fighting by our side in the Senate! With just 4 days to election day, let's make sure we #winwithwomen""",SenGillibrand,151,71
794594658630402051,2016-11-04 17:38:24,b'RT @emilyslist: The EMILY\xe2\x80\x99s List community has always upended the status quo. This is the difference we make: https://t.co/i38WNiwHGj #WinW\xe2\x80\xa6',SenGillibrand,0,19
794593745568141313,2016-11-04 17:34:46,"b'When women run, women win, and we are lucky to have so many amazing qualified Democratic women running for Senate this year! #winwithwomen'",SenGillibrand,140,58
794593327924514816,2016-11-04 17:33:06,"b""As we work to elect @HillaryClinton on #Nov8, let's fight to elect a Democratic Senate! Women will be the key to that majority #winwithwomen""",SenGillibrand,132,56
794587730151870464,2016-11-04 17:10:52,"b""At 1:30pm ET, join @emilyslist &amp; me for a tweetstorm supporting Democratic women running for Senate this year. We'll be using #winwithwomen.""",SenGillibrand,63,25
794541725184380929,2016-11-04 14:08:03,b'The young women and men I meet every day give me so much optimism for the future.',SenGillibrand,28,3
794541421512577026,2016-11-04 14:06:51,"b""Amazing piece by @Harvard women athletes: https://t.co/YF3TI9z9sy I'm with them.""",SenGillibrand,53,32
794318502018633729,2016-11-03 23:21:03,"b'""Having women at the table is incredibly important, not just for the numbers, but also that they\xe2\x80\x99re able to get things done in a unique way""'",SenGillibrand,40,21
794317300337954816,2016-11-03 23:16:16,b'My friend &amp; colleague Senator @AmyKlobuchar on why we need more women to run for office &amp; serve as elected leaders. https://t.co/VBvhP6T5L2',SenGillibrand,80,37
794298230704111616,2016-11-03 22:00:30,"b""If you need to #GetCovered, sign up now during the Affordable Care Act's open enrollment period.\n\nhttps://t.co/rJyLTZEisH""",SenGillibrand,18,10
794296494853648385,2016-11-03 21:53:36,"b'Thanks to the Affordable Care Act, the uninsured rate has dropped to all time low of 8.9%.\n\nhttps://t.co/ZGooDkrYrA'",SenGillibrand,187,118
794282788967084034,2016-11-03 20:59:08,"b""The more women in Congress, the more diverse the voices at the table &amp; the sooner we'll make issues like #paidleave &amp; #equalpay a reality.""",SenGillibrand,103,48
794282437450858497,2016-11-03 20:57:44,"b""As we work to elect @HillaryClinton on #Nov8, let's also elect more Dem women candidates so we have more women serving in the House &amp; Senate""",SenGillibrand,119,50
794281574430834688,2016-11-03 20:54:19,"b'Teamed up w/@EMILYsList, my fellow Democratic women Senators &amp; @HillaryClinton to urge more women to join #GirlClub! https://t.co/5uQ7Z1wSKt'",SenGillibrand,132,48
794268663343939593,2016-11-03 20:03:00,"b'RT @HillaryClinton: ""I\'m casting my vote early for Hillary Clinton, and I urge you to vote early for Hillary, too."" \xe2\x80\x94@FLOTUS https://t.co/C\xe2\x80\xa6'",SenGillibrand,0,8942
794261601096466432,2016-11-03 19:34:57,"b""Ways you can get #offthesidelines in the next 5 days:\n\n\xe2\x98\x91\xef\xb8\x8f  Donate\n\xe2\x98\x91\xef\xb8\x8f  Volunteer\n\xe2\x98\x91\xef\xb8\x8f  Vote\n\nHere's how: https://t.co/rg1NJXmI47""",SenGillibrand,10,14
794260841319297024,2016-11-03 19:31:55,"b'With just 5 days until election day, do you know when &amp; where to vote? \n\n#MakeAPlan to #vote:\n\nhttps://t.co/TN8WzHsOJY'",SenGillibrand,39,21
794246684096233472,2016-11-03 18:35:40,"b'Women with a background in sports make terrific candidates for office! For me, sports took the fear out of losing. https://t.co/rvFZ5Q5mzU'",SenGillibrand,53,12
794234966796341248,2016-11-03 17:49:06,b'No worker in America should have to choose between earning a paycheck and caring for their family in a time of need. We need the #FAMILYAct.',SenGillibrand,38,17
794233619409682433,2016-11-03 17:43:45,"b'#FAMILYAct will create gender-neutral #paidleave program to allow workers to take time to care for themselves, a sick loved one or new child'",SenGillibrand,42,19
794233121453572096,2016-11-03 17:41:46,"b""In the U.S., just 13% of private sector employees have access to some form of #paidleave, but it shouldn't depend on where you work or live.""",SenGillibrand,13,6
794232138140909568,2016-11-03 17:37:52,b'Keira Knightly raising her voice about the need for gender-neutral #paidleave for new parents: https://t.co/1ODEAFxqxN #offthesidelines',SenGillibrand,73,24
793950192307421184,2016-11-02 22:57:31,"b'Outrageous that 4 years after #Sandy hit #NY, so many of our families impacted by the storm continue to struggle to recover.'",SenGillibrand,28,13
793948319089311746,2016-11-02 22:50:04,"b""Working w/@SenSchumer to speed @DHSgov probe into Natl Flood Insurance Prgrm's handling of Superstorm #Sandy claims. https://t.co/6ZhdVewq4u""",SenGillibrand,42,20
793915601580359680,2016-11-02 20:40:04,"b'Ever since then, @HillaryClinton has been inspiring me and so many others around the world. \n\nHow has Hillary inspired you?\n\n#ImWithHer'",SenGillibrand,51,17
793914503486324736,2016-11-02 20:35:42,"b'I heard @HillaryClinton declare ""women\'s rights are human rights &amp; human rights are women\'s rights"" &amp; was inspired\xe2\x80\xa6 https://t.co/Ymj8RBlrX3'",SenGillibrand,357,145
793895550613684224,2016-11-02 19:20:23,"b'Most guns used by criminals in #NY were trafficked from states w/weaker gun laws along the ""iron pipeline"" including FL, GA, SC, NC, VA &amp; PA'",SenGillibrand,24,14
793895207230111744,2016-11-02 19:19:01,"b"".@AGSchneiderman's #guntrafficking report found 74% of crime guns recovered in #NY since 2010 came from out of state https://t.co/eQFeZuidqV""",SenGillibrand,29,13
793892297444327424,2016-11-02 19:07:28,b'.@AGSchneiderman urges Congress to pass universal background checks and to make #guntrafficking a federal crime. https://t.co/XjbKMncryd',SenGillibrand,80,46
793880474246668288,2016-11-02 18:20:29,b'RT @HillaryClinton: More people will early vote in 2016 than ever before. Join them: https://t.co/3TKJ4H68Kz https://t.co/ZeMmuKhqev',SenGillibrand,0,1633
793879850960420864,2016-11-02 18:18:00,"b""6 days until we make history. But @HillaryClinton can't do it without us. We need to get #offthesidelines, raise our voices, and vote!""",SenGillibrand,122,50
793878123037229056,2016-11-02 18:11:08,b'RT @CatherineForNV: A lot is at stake this election. Let\xe2\x80\x99s make sure our voices are heard by voting. Your future depends on it! https://t.c\xe2\x80\xa6',SenGillibrand,0,63
793581340553781248,2016-11-01 22:31:50,"b""As winter approaches, plsd @HHSGov will release $325m in heating &amp; home energy assistance for low income #NY'ers. https://t.co/DkKetR2X8v""",SenGillibrand,23,9
793556050674933761,2016-11-01 20:51:20,"b'Help send a progressive voice to Congress in #NY19, volunteer for @ZephyrTeachout! https://t.co/XvmrdgKNft'",SenGillibrand,63,27
793552897095139328,2016-11-01 20:38:48,b'RT @TheDemocrats: THIS. \xf0\x9f\x99\x8b\xf0\x9f\x8f\xbb\xf0\x9f\x99\x8b\xf0\x9f\x8f\xbe\xf0\x9f\x99\x8b\xf0\x9f\x8f\xbc\xf0\x9f\x99\x8b\xf0\x9f\x8f\xbf\xf0\x9f\x99\x8b\xf0\x9f\x8f\xbd https://t.co/BCrxZhZCNK',SenGillibrand,0,402
793552255362404352,2016-11-01 20:36:15,"b""The more women are at the table in Congress, the sooner we'll make #paidleave for all workers &amp; #equalpay for equal work a reality.""",SenGillibrand,41,21
793548937387016192,2016-11-01 20:23:04,"b'As we work to elect @HillaryClinton, pls turn out for our Democratic women candidates so we have more women serving in the House &amp; Senate!'",SenGillibrand,78,41
793547985951002625,2016-11-01 20:19:17,"b""While I'm hopeful we'll make gains next week, we still need more women to get #offthesidelines and run for Congress! https://t.co/FdjJAJHNa4""",SenGillibrand,108,38
793534102368575488,2016-11-01 19:24:07,"b""Ways you can get #offthesidelines in the next 7 days:\n\n\xe2\x98\x91\xef\xb8\x8f  Donate\n\xe2\x98\x91\xef\xb8\x8f  Volunteer\n\xe2\x98\x91\xef\xb8\x8f  Vote\n\nHere's how: https://t.co/Sbt9ZCp5VH""",SenGillibrand,23,10
793533392872759296,2016-11-01 19:21:18,"b'With 7 days until election day, how are you getting #offthesidelines to help elect @HillaryClinton as well as Democrats down the ballot?'",SenGillibrand,59,29
793523676645818368,2016-11-01 18:42:42,"b""In #NY alone, the wage gap causes Latina workers to lose $27,475 each year, that's more than $1 million over their lifetime. #LatinaEqualPay""",SenGillibrand,247,209
793520722589126656,2016-11-01 18:30:57,b'Unacceptable that Latina women make just over half what typical white non-Hispanic men make: https://t.co/593T5SNXMt We need #LatinaEqualPay',SenGillibrand,60,47
793499390879080448,2016-11-01 17:06:11,b'RT @HillaryClinton: One week to Election Day. RT this if it describes you. https://t.co/3TKJ4H68Kz https://t.co/xrdugzH7cG',SenGillibrand,0,5683
793476420844548096,2016-11-01 15:34:55,"b""#ACA open enrollment begins today, be sure to sign up &amp; #GetCovered!\n\n#NY'ers, find a plan at\xe2\x80\xa6 https://t.co/0VN3xDyWSx""",SenGillibrand,11,7
793261129313218560,2016-11-01 01:19:25,"b'From my family to yours, wishing you a happy and safe #Halloween! https://t.co/CuYAoDDfQt'",SenGillibrand,244,20
793205454247714818,2016-10-31 21:38:11,"b""Proud of #NY's soccer teams--@NYCFC &amp; @NewYorkRedBulls--both competing in #MLSCupPlayoffs. Look fwd to 2nd leg matches at home next Sunday!""",SenGillibrand,29,3
793184020351909888,2016-10-31 20:13:01,b'RT @KatieMcGintyPA: Vote Women.\nVote Education.\nVote Families.\nVote Fairness.\nVote Katie on November 8th.\nhttps://t.co/uCOaYabCmI',SenGillibrand,0,103
793183690075598849,2016-10-31 20:11:43,"b""RT @HillaryClinton: We've made extraordinary progress under @POTUS. On November 8, that progress is on the ballot. https://t.co/OaH52l1Nyn""",SenGillibrand,0,2668
793169701211955200,2016-10-31 19:16:07,"b""I'm working with @SenSchumer to get to the bottom of allegations of flood insurance fraud &amp; will continue to pressure @DHSgov to do its job.""",SenGillibrand,17,8
793168540895502336,2016-10-31 19:11:31,"b'Outrageous that 4 years after #Sandy hit #NY, so many of our families impacted by the storm continue to struggle to recover.'",SenGillibrand,28,12
793165664504733696,2016-10-31 19:00:05,"b"".@SenSchumer &amp; I urge @DHSgov to speed probe into Natl Flood Insurance Prgrm's handling of Superstorm #Sandy claims. https://t.co/8UhFiOjS67""",SenGillibrand,31,10
793152054944534529,2016-10-31 18:06:00,b'This election is too impt to sit out. Be sure to get #offthesidelines and make your voice heard in the next 8 days!\n\nhttps://t.co/9zHX2AWP2O',SenGillibrand,47,22
793149880864796672,2016-10-31 17:57:22,b'Just 8 days to election day. How are you helping to #GOTV for @HillaryClinton &amp; Democrats up and down the ballot in the final days?',SenGillibrand,44,19
792808833173291010,2016-10-30 19:22:10,b'RT @TheDemocrats: Can you vote early today? Find out \xf0\x9f\x91\x89\xf0\x9f\x8f\xbe https://t.co/bHlowUIPJu https://t.co/JqfrsobVbn',SenGillibrand,0,316
792461806212177920,2016-10-29 20:23:12,"b""I'm continuing to work with @SenSchumer &amp; our #NY delegation to fight for #Sandy recovery funds for our impacted communities.""",SenGillibrand,21,8
