id,created_at,text,user,favorite_count,retweet_count
859452323940241409,2017-05-02 16:59:36,"b""The DoD's report shows: \n\xe2\x80\x94a flat overall reporting rate \n\xe2\x80\x94an unacceptable retaliation rate against survivors\n\xe2\x80\x94less accountability""",SenGillibrand,70,31
859452098836090880,2017-05-02 16:58:42,"b'While the DoD touts progress, the truth is that the scourge of sexual assault in the military remains status quo. https://t.co/u5tYhVRAkh'",SenGillibrand,287,129
859399585386688517,2017-05-02 13:30:02,"b'Parents across the world share their parental leave stories, and demonstrate why we need #paidleave in this country: https://t.co/Nexf2tzqkL'",SenGillibrand,344,120
859135419237228549,2017-05-01 20:00:20,"b'Local, small businesses are indispensable to our economy in New York and across the country. Happy\xe2\x80\xa6 https://t.co/fvyEWDC6ht'",SenGillibrand,212,59
859115270958456832,2017-05-01 18:40:16,b'Publicly shaming a child over a school lunch is a cruel practice that has to stop. https://t.co/tZjyIe9la4',SenGillibrand,549,185
859077489527861248,2017-05-01 16:10:09,"b'Working families, immigrants, and refugees strengthen our communities. Today, we #RiseUp to celebrate their contributions.'",SenGillibrand,569,179
859030878890209280,2017-05-01 13:04:56,b'I am working on a bipartisan bill to reform flood insurance and make it more affordable for New Yorkers. https://t.co/UiTmO9kdto',SenGillibrand,341,70
858765227449606145,2017-04-30 19:29:19,b'Learn a bit more about our #FAMILYAct and how you can raise your voice to support it. https://t.co/zQGJ8QjJaB',SenGillibrand,298,101
858320030458630145,2017-04-29 14:00:16,b'Proud to be in solidarity with those raising their voices and marching for our planet today. #ClimateMarch',SenGillibrand,3652,892
858070869192699905,2017-04-28 21:30:12,b'#Trump100Days: \xe2\x80\x9ca stretch marked by disdain for women\xe2\x80\x99s fair treatment at home and around the globe.\xe2\x80\x9d https://t.co/F5ygBXR8AB',SenGillibrand,376,171
858012943979614209,2017-04-28 17:40:01,b'@popsugarnews Thanks so much! This was great! #PSNewsChat',SenGillibrand,12,4
858011701580619776,2017-04-28 17:35:05,"b'@POPSUGAR A6. Representing your fellow citizens in elected office is worth it. Run. Do it. Once you do, keep at it\xe2\x80\xa6 https://t.co/ZcUW8IaDGV'",SenGillibrand,23,11
858010389401018371,2017-04-28 17:29:52,b'@popsugarnews @Yale @eleanorslegacy @WCFonline A5. @emilyslist &amp;@EmergeAmerica have great programs too! The experie\xe2\x80\xa6 https://t.co/hINEPBNjfv',SenGillibrand,18,16
858009869496012803,2017-04-28 17:27:48,"b'@popsugarnews A5. Do a training program! I did programs with Women\xe2\x80\x99s Campaign School @Yale, @EleanorsLegacy, and @WCFonline #PSNewsChat'",SenGillibrand,23,12
858008527679488000,2017-04-28 17:22:28,"b'@popsugarnews A4. Grow that thick skin, and know that, in spite of everything, you can do it. #PSNewsChat'",SenGillibrand,27,13
858008415133728769,2017-04-28 17:22:01,"b'@popsugarnews A4. People can be mean, your opponents might say horrible things about you. Campaigning can be really tiring. #PSNewsChat'",SenGillibrand,19,12
858007142732877824,2017-04-28 17:16:58,"b'@popsugarnews A3. Then think through the issues you care most about. Practice expressing your ideas, sharpen your arguments. #PSNewsChat'",SenGillibrand,16,9
858007054476300292,2017-04-28 17:16:37,"b'@popsugarnews A3. Reach out to your networks for advice. Maybe you already know a woman in office, or someone who w\xe2\x80\xa6 https://t.co/UXY6rZD352'",SenGillibrand,17,7
858006970611236864,2017-04-28 17:16:17,"b'@popsugarnews A3. No one can do it alone, so ask for help. Talk to your family &amp; close friends, those who\xe2\x80\x99ll suppor\xe2\x80\xa6 https://t.co/vGZkupikKo'",SenGillibrand,23,15
858005926237831172,2017-04-28 17:12:08,b'@popsugarnews A2. Your reason for running will come into focus from your specific background and passion. #PSNewsChat',SenGillibrand,18,10
858005813218160640,2017-04-28 17:11:41,"b'@popsugarnews A2. It boils down to that one thing you want to fix, that injustice that makes you so angry you just want to spit. #PSNewsChat'",SenGillibrand,25,14
858005715482554369,2017-04-28 17:11:18,b'@popsugarnews A2. I don\xe2\x80\x99t think there\xe2\x80\x99s a set path to public office. We need a diversity of experiences and backgro\xe2\x80\xa6 https://t.co/lDO8leSMdN',SenGillibrand,21,15
858004796154028034,2017-04-28 17:07:39,"b'@popsugarnews A1. Run. Believe in yourself. Your experience, your background, your passion makes you qualified. #PSNewsChat'",SenGillibrand,41,22
858003907112513536,2017-04-28 17:04:07,b'@popsugarnews @emilyslist @PramilaJayapal Hi everyone! Thanks for having me. Very excited to talk shop and help mor\xe2\x80\xa6 https://t.co/Mkwct92P1K',SenGillibrand,22,9
858000097753399299,2017-04-28 16:48:58,"b'RT @emilyslist: The #PSNewsChat with @popsugarnews, @SenGillibrand, &amp; @PramilaJayapal about running for office starts at 1pm ET! https://t.\xe2\x80\xa6'",SenGillibrand,0,27
857986568472195072,2017-04-28 15:55:13,b'I think this says everything you need to know about the Trump tax plan. https://t.co/Zlz9kzXBYG',SenGillibrand,473,301
857944784849207296,2017-04-28 13:09:11,"b""RT @popsugarnews: We're joining forces with @EmilysList, @SenGillibrand, and @PramilaJayapal for a #PSNewsChat \xf0\x9f\x99\x8c https://t.co/kkg9h4BF18""",SenGillibrand,0,42
857940002449350656,2017-04-28 12:50:10,b'Congress can no longer turn a blind eye to the epidemic of campus sexual assault. Tell them to take action: https://t.co/XEkgFOkuyV',SenGillibrand,397,169
857714751664779264,2017-04-27 21:55:07,"b'Bad move. Rolling back net neutrality rules will stifle business, affect consumers, hamper innovation. https://t.co/JoxpKVQF2s'",SenGillibrand,759,379
857670948006359040,2017-04-27 19:01:03,b'Continue to speak out. Do not grow tired or weary. Know that this battle is worth fighting. https://t.co/z64KE3F5Iw',SenGillibrand,1503,424
857629236672311297,2017-04-27 16:15:18,"b'When a tax system allows big corporations and the wealthy to pay little in taxes at the expense of investments in our future, it\xe2\x80\x99s rigged.'",SenGillibrand,1325,404
857577613866541056,2017-04-27 12:50:10,"b'Quick shoutout: great to work with @higherheights, who help #BlackWomenLead from the voting booth to elected office. https://t.co/Mo04Apiclj'",SenGillibrand,106,41
857366227706052608,2017-04-26 22:50:12,"b'If a tax plan doesn\xe2\x80\x99t address growing inequality, strengthen the middle class, and reward work, then it\xe2\x80\x99s a failure. https://t.co/6Bws4NX0PH'",SenGillibrand,1395,560
857270920741892097,2017-04-26 16:31:29,b'RT @lightworkorg: CNY arts leaders and @SenGillibrand call on Senate to reject cuts to @NEAarts \xe2\x80\x94  Story via @WRVO: https://t.co/gRHXdsbxii\xe2\x80\xa6',SenGillibrand,0,19
857208718131433472,2017-04-26 12:24:19,b'RT @girlscouts: @SenGillibrand Deal. We all win when girls are prepared to  lead and represent our great nation as women! #LikeAGirlScout',SenGillibrand,0,40
856988709564055553,2017-04-25 21:50:05,"b'With so many issues that demand immediate action, your advocacy and your talents are desperately needed. Speak out.'",SenGillibrand,1556,432
856942184653828100,2017-04-25 18:45:12,"b'When students and families are burdened with unmanageable student loan debt, they lose out\xe2\x80\x94and our economy loses out.'",SenGillibrand,1115,308
856892462895431680,2017-04-25 15:27:38,b'Thanks @Lin_Manuel for speaking out on just how important @NEArts is to our communities. https://t.co/4NrSjPUuvS',SenGillibrand,883,224
856857863796531200,2017-04-25 13:10:09,b'Agree. Let\xe2\x80\x99s make sure those girls run for office someday! \nhttps://t.co/aQZWEErBr2',SenGillibrand,430,102
856625088392818691,2017-04-24 21:45:11,b'This is gratifying. Fills me with so much hope. https://t.co/XnAJqgcn83',SenGillibrand,1247,310
856611239656648704,2017-04-24 20:50:09,"b'\xe2\x80\x9cPush yourself, challenge yourself to do more than you think you can.\xe2\x80\x9d \nCongratulations to @AstroPeggy! \nhttps://t.co/e4v2cK6Aot'",SenGillibrand,380,74
856594882114310146,2017-04-24 19:45:09,b'Cutting off access to healthcare for women around the world doesn\xe2\x80\x99t look like respect for life to me. https://t.co/vv9yJ39h8i',SenGillibrand,644,265
856577499542769665,2017-04-24 18:36:04,"b'On this Yom HaShoah, we must continue to stand strong against all forms of hate and intolerance.'",SenGillibrand,720,175
856273149327028225,2017-04-23 22:26:42,"b'To mark the centennial of women\xe2\x80\x99s suffrage in NY, I spoke @FDRLibrary about what our founding mothers can teach us.\xe2\x80\xa6 https://t.co/GV7krR8Ve6'",SenGillibrand,614,167
856221302562095108,2017-04-23 19:00:41,b'RT if you believe that it\xe2\x80\x99s long past time to ensure equal pay for equal work.',SenGillibrand,3568,3836
856168357091004417,2017-04-23 15:30:17,"b""Important to invest in New York's infrastructure\xe2\x80\x94including these much-needed repairs to the Holland Tunnel. https://t.co/Phep7L9XqM""",SenGillibrand,381,93
855854989822111745,2017-04-22 18:45:05,"b""We only have one earth, so let's keep fighting for it\xe2\x80\x94from protecting our air and water to combatting climate change. Happy #EarthDay!""",SenGillibrand,2079,525
855832163824136193,2017-04-22 17:14:23,"b""RT @FDRLibrary: WOMEN IN POLITICS w/@newpaltz Benjamin Ctr, @SenGillibrand &amp; @ATT's Marissa Shorenstein. https://t.co/Cn9vBIN7gV""",SenGillibrand,0,22
855828699165462528,2017-04-22 17:00:37,"b'Now is the time to keep fighting, in whatever way you can, for the issues you\xe2\x80\x99ve always cared about.'",SenGillibrand,1111,280
855790907525914624,2017-04-22 14:30:26,b'Looks like transparency is something we can all agree on. https://t.co/G1fR3WySQe',SenGillibrand,1185,270
855542939270905856,2017-04-21 22:05:06,b'Too many in New York have suffered from the opioid epidemic. We\xe2\x80\x99ll keep fighting for programs that can help. https://t.co/lkFYnNvids',SenGillibrand,307,58
855511635594797058,2017-04-21 20:00:43,"b'Earlier this week, I asked you where you think more fearless girls are needed. Here\xe2\x80\x99s what you said. Where else do\xe2\x80\xa6 https://t.co/bpEHtOsort'",SenGillibrand,2134,959
855497647989436416,2017-04-21 19:05:08,b'Welcoming and helping those who seek freedom and refuge is an important part of our New York values. https://t.co/5C24j5fISh',SenGillibrand,408,101
855460407477252097,2017-04-21 16:37:09,b'High-quality child care can lead to better outcomes for children\xe2\x80\x94all families should be able to afford it. https://t.co/aJ5lAjxeAj',SenGillibrand,428,116
855413367032487936,2017-04-21 13:30:14,b'It is said that budgets reflect priorities. What does it say about the Trump admin when their budget takes aim at vulnerable communities?',SenGillibrand,1443,479
855149720389505024,2017-04-20 20:02:35,"b'""It\'s the right thing to do, but it\'s not a bad business proposition either."" Great to remember as we work toward\xe2\x80\xa6 https://t.co/5K5QhEt2vF'",SenGillibrand,394,105
855082593259327494,2017-04-20 15:35:51,"b'RT @lsarsour: Grateful. Honored. Blessed. For every little girl in every corner of this world, this is for you. https://t.co/ui4qAYmqhu #Ti\xe2\x80\xa6'",SenGillibrand,0,443
855080864266543104,2017-04-20 15:28:59,b'RT @msladyjustice1: A PRIVILEGE. #TIME100 https://t.co/vpL67dtK3c',SenGillibrand,0,157
855072975334363137,2017-04-20 14:57:38,b'The four exceptional organizers of the @womensmarch are on the 2017 #TIME100. It was an honor to write about them.\xe2\x80\xa6 https://t.co/3S3zRYax8R',SenGillibrand,4473,1529
854812151520911360,2017-04-19 21:41:13,b'Remember: grassroots advocacy\xe2\x80\x94many people coming together\xe2\x80\x94is far more valuable than any one politician at the podium.',SenGillibrand,2170,611
854811610782863360,2017-04-19 21:39:04,b'@PiperPerabo Thanks @PiperPerabo. And kudos to you for being vocal about the issues you care about!',SenGillibrand,32,3
854779753072656389,2017-04-19 19:32:28,b'@NoamBramson Thank you @NoamBramson. It\xe2\x80\x99s critical to speak out when these cuts could impact our communities\xe2\x80\x94especi\xe2\x80\xa6 https://t.co/h0ZQZ3FJo9',SenGillibrand,2,1
854732748543623168,2017-04-19 16:25:42,"b'When women take the plunge and run for office, they change outcomes. Great piece featuring our friends\xe2\x80\xa6 https://t.co/BYwUMPrlZ6'",SenGillibrand,920,338
854703721489604608,2017-04-19 14:30:21,b'Wouldn\xe2\x80\x99t you pay the price of a cup of coffee a week to have the time and flexibility to care for a loved one? https://t.co/J8EN2brVYB',SenGillibrand,862,257
854394395960979456,2017-04-18 18:01:12,"b""Too many in Congress seem to have an obsession with destroying Planned Parenthood and taking away access to women's reproductive healthcare.""",SenGillibrand,3330,991
854360219446542336,2017-04-18 15:45:24,b'Inspiring story about female Marines trying to change the service\xe2\x80\x99s culture from the inside out. https://t.co/2O50VC50hF',SenGillibrand,477,174
854341773166030848,2017-04-18 14:32:06,"b""It's #TaxDay. I posted my tax returns online for the 6th year in a row, and I want to tell you a bit about why. https://t.co/1o2OzmrIkK""",SenGillibrand,1579,475
854077016861155328,2017-04-17 21:00:03,b'Dangerous carcinogens may be hiding in some of your personal care products. @SenSchumer &amp; I want to get rid of them https://t.co/svdvxGnKvF',SenGillibrand,658,223
854046819654840321,2017-04-17 19:00:03,"b""Love this. Where do you think we need more fearless girls? I'd say in the House and Senate. And the Pentagon. https://t.co/qDOaFgpzra""",SenGillibrand,1847,463
853994101649416195,2017-04-17 15:30:34,"b'Our work\xe2\x80\x94our activism\xe2\x80\x94has always been about helping people. If you\xe2\x80\x99re not helping, go home.'",SenGillibrand,1569,377
853959484141711360,2017-04-17 13:13:01,"b'We must work to ensure that every child is given the tools to thrive, regardless of family income or status. RT if\xe2\x80\xa6 https://t.co/kkdSupNbxW'",SenGillibrand,403,321
853958559922606080,2017-04-17 13:09:21,b'These cuts shortchange our children &amp; families. After school programs help children to learn and succeed. It\xe2\x80\x99s wrong to gut them.',SenGillibrand,352,138
853958215553482754,2017-04-17 13:07:59,"b'Trump\xe2\x80\x99s budget proposes completely eliminating the 21st CLCC grant, which gives $1.2 billion to after school and summer programs.'",SenGillibrand,637,572
853657155093889024,2017-04-16 17:11:40,"b'From my family to yours, happy #Easter to all who are celebrating! https://t.co/u00IcKCLN8'",SenGillibrand,1150,64
853616543766392832,2017-04-16 14:30:18,"b""This shouldn't be complicated. Americans deserve to know who is entering the White House. Period. https://t.co/aLXP3nTRsk""",SenGillibrand,3135,1023
853368606314438656,2017-04-15 22:05:05,b'Change won\xe2\x80\x99t happen unless you speak out. Here\xe2\x80\x99s how you can: https://t.co/rGyQvuVxD9',SenGillibrand,492,180
853320787964682241,2017-04-15 18:55:04,"b'Transparency has always been a top priority for me, so I plan to post my tax returns online again next week. @POTUS should too. #TaxMarch'",SenGillibrand,6636,1708
853278026305593349,2017-04-15 16:05:09,"b'When women talk with their doctors, making personal decisions about their health, bodies, and families, Congress should stay out of the way.'",SenGillibrand,3785,1071
853228947114479616,2017-04-15 12:50:07,b'ICYMI: I co-wrote a piece with @FaithKWinter to talk about how #paidleave is needed from coast to coast. https://t.co/6MRERaW3Fd',SenGillibrand,314,99
852997815504703489,2017-04-14 21:31:41,b'Here are some good words to live by.\nhttps://t.co/vHMzsKdlsf',SenGillibrand,1019,307
852976476190384132,2017-04-14 20:06:54,b'Judge Sheila Abdus-Salaam was a true voice for the voiceless. Heartbroken at her passing. Thinking of her family and loved ones.',SenGillibrand,1040,187
852924657674203137,2017-04-14 16:40:59,b'Congratulations to Officer Brittney Roy for your hard work and service. https://t.co/2bCtmfL1eR',SenGillibrand,438,77
852884249069879296,2017-04-14 14:00:25,b'We\xe2\x80\x99re coming together to help prevent opioid addiction. https://t.co/TqBJtSjeew',SenGillibrand,231,45
852615248683163649,2017-04-13 20:11:30,"b'With all of the problems we could try to solve in this country, the President decides to limit women\xe2\x80\x99s access to he\xe2\x80\xa6 https://t.co/HFqwWp8Nie'",SenGillibrand,2659,1647
852556495170523136,2017-04-13 16:18:02,"b'If you don\xe2\x80\x99t become an advocate, things won\xe2\x80\x99t change. \nIf you don\xe2\x80\x99t vote, things won\xe2\x80\x99t change. \nIf you don\xe2\x80\x99t run, things won\xe2\x80\x99t change.'",SenGillibrand,6389,3106
852517991962951680,2017-04-13 13:45:02,b'We\xe2\x80\x99re long overdue for national #paidleave. https://t.co/O6xCWmkXlw',SenGillibrand,745,199
852280336163770369,2017-04-12 22:00:41,b'For those who\xe2\x80\x99ve asked: Here are my thoughts on the best ways to get #offthesidelines: https://t.co/rGyQvuVxD9',SenGillibrand,416,205
852236180125089796,2017-04-12 19:05:13,b'It\xe2\x80\x99s important to know more about how such a destabilizing event affects these children. \nhttps://t.co/rJah2aNsDW',SenGillibrand,424,121
852188349771153410,2017-04-12 15:55:10,b'We\xe2\x80\x99re not giving up. We\xe2\x80\x99ll keep fighting to try to bring justice to survivors of campus sexual assault. More: https://t.co/nuGzLamCpS',SenGillibrand,504,81
852146477346545664,2017-04-12 13:08:46,b'Student loans are both a drag and a drag on the economy. https://t.co/yFCaTbslL9',SenGillibrand,474,148
851933249463083009,2017-04-11 23:01:29,b'Congrats to @NYDailyNews! Well-deserved. https://t.co/6T3pE1xYTG',SenGillibrand,312,49
851857814221926400,2017-04-11 18:01:44,"b'RT @nytopinion: If Trump cuts Amtrak and other funding, N.Y. could be facing a transportation apocalypse https://t.co/cnPoGNL8Ib https://t.\xe2\x80\xa6'",SenGillibrand,0,135
851843618738495489,2017-04-11 17:05:19,"b'RT @messengerpost: Gillibrand, in Canandaigua, promises fight for arts funding https://t.co/oT601nZ1mC'",SenGillibrand,0,38
851827545649577984,2017-04-11 16:01:27,"b'It is not going to be easy. It is not going to be quick. But if you don\xe2\x80\x99t speak up, things will not change. We need you out there.'",SenGillibrand,3736,1216
851789573256511489,2017-04-11 13:30:34,"b'If Planned Parenthood can keep fighting for as long as they have, so can we. \nhttps://t.co/njgzJ3GMel'",SenGillibrand,2366,826
851552062815031297,2017-04-10 21:46:47,"b'RT @hvsentinel: @SenGillibrand is visiting @BethelWoods today, calling on Sullivan County residents to #DefendTheArts against President Tru\xe2\x80\xa6'",SenGillibrand,0,54
851434701969600512,2017-04-10 14:00:26,b'Continue to speak out. Do not grow tired or weary. Know that this battle is worth fighting for.',SenGillibrand,5214,1810
851191881321115654,2017-04-09 21:55:33,b'+1. No worker should have to choose between a paycheck or caring for a loved one. https://t.co/EDYqrSep8O',SenGillibrand,2079,918
850763564398895105,2017-04-08 17:33:34,"b'When you raise your voice, you can change the world. https://t.co/i9PdHCx4uu'",SenGillibrand,1407,267
850471494257967109,2017-04-07 22:12:59,b'I teamed up with @clairecmc and others to forge a path forward for survivors of sexual assault on campuses:\xe2\x80\xa6 https://t.co/wbbwtphVoH',SenGillibrand,664,135
850399852467040257,2017-04-07 17:28:19,"b""Americans need answers frm the Admin abt their plan &amp; how they'll bring coalition partners to the table for a long-term diplomatic solution.""",SenGillibrand,493,118
850399283568312321,2017-04-07 17:26:03,b'And there is no \xe2\x80\x98military only\xe2\x80\x99 solution to the suffering in Syria.',SenGillibrand,622,164
850399005796388864,2017-04-07 17:24:57,"b'But the President\xe2\x80\x99s unilateral military action causes grave concern, given no authorization from Congress and no long-term plan.'",SenGillibrand,607,192
850398705966608385,2017-04-07 17:23:45,"b'The chemical attacks by the Assad regime in Syria are atrocities, a violation of international law that demands a firm response.'",SenGillibrand,858,207
850336920643276800,2017-04-07 13:18:15,b'RT @emilyslist: .@SenGillibrand is a political powerhouse who is uplifting issues that affect women and their families. https://t.co/EnIcHm\xe2\x80\xa6',SenGillibrand,0,143
850083256770977792,2017-04-06 20:30:16,"b""It's always been about helping people. https://t.co/SxxVjbS9b5""",SenGillibrand,406,59
850053011388993538,2017-04-06 18:30:05,b'No working parent should have to crowdfund to care for their loved ones. I shared my thoughts on the best solution.\xe2\x80\xa6 https://t.co/tx2NLp4yd9',SenGillibrand,446,137
850024252900347904,2017-04-06 16:35:49,b'Irresponsible for our democracy. https://t.co/EqCHb1NtgO',SenGillibrand,2621,1076
850004509933875200,2017-04-06 15:17:22,"b""Gorsuch is the wrong choice for the Supreme Court. I'm voting no on cloture. #StopGorsuch""",SenGillibrand,4220,680
849770683181801474,2017-04-05 23:48:13,"b""Republicans' rollback of broadband privacy is dangerous and unwanted. https://t.co/z6oxuOVWEV""",SenGillibrand,965,440
849737664966381568,2017-04-05 21:37:01,b'Changing the rules for President Trump to get his Supreme Court nominee through is an historic mistake. #StopGorsuch',SenGillibrand,4630,1862
849725740920840195,2017-04-05 20:49:38,"b""Women's voices are needed more than ever. Be bold, never give up! Thanks to @toreyvanoot for making the case https://t.co/0dJBxZQXGM""",SenGillibrand,1205,308
849394986340806659,2017-04-04 22:55:20,"b""Today serves as a call to action for all women: know your worth, ask for it, fight for it. I'll be right there with you. #EqualPayDay""",SenGillibrand,537,151
849394503970639872,2017-04-04 22:53:25,"b""Put simply, women and men deserve equal pay for equal work. A shame that, in 2017, we're still not there. #EqualPayDay""",SenGillibrand,1679,497
849394106715574272,2017-04-04 22:51:50,"b""In the Senate, I'll keep fighting to close that gap, fighting for legislation like the Paycheck Fairness Act.""",SenGillibrand,355,57
849393346023968768,2017-04-04 22:48:49,"b""The data suggests that it would take until 2152 for us to close the gender wage gap. That's not right. We shouldn't have to wait that long.""",SenGillibrand,329,132
849393007606603777,2017-04-04 22:47:28,"b'As a whole, American women must work 44 days into 2017 in order to make as much as men made in 2016.'",SenGillibrand,177,100
849392642379173891,2017-04-04 22:46:01,b'The gap for working moms on average is $0.70 to the dollar. They have to work an extra 6 months to make what fathers earn in a year.',SenGillibrand,165,101
849392344180895746,2017-04-04 22:44:50,"b'The pay gap for women of color is severe. Black women make just $0.63 for every dollar a white man earns, Hispanic/Latina women earn $0.54.'",SenGillibrand,231,195
849391816071929857,2017-04-04 22:42:44,"b""Today is #EqualPayDay. I'd like to share some numbers with you, the plain truth about equal pay in this country.""",SenGillibrand,724,239
849361049891610624,2017-04-04 20:40:29,"b""The resistance is based on all of us speaking out in different forms. Here's my advice on how you can do that: https://t.co/ra62VnESNA""",SenGillibrand,654,317
849337162227232768,2017-04-04 19:05:34,"b""Here's how I'm voting this week: No on cloture, no on Gorsuch.""",SenGillibrand,6099,836
849283650441138177,2017-04-04 15:32:55,"b""Spoke to @rtraister about the last few months, about where we're going, about this moment in time.\xe2\x80\xa6 https://t.co/i8CH9XiPr0""",SenGillibrand,454,146
849272851026722816,2017-04-04 14:50:01,"b'Amazing work bringing paid leave to Columbus, OH! Elizabeth Brown (@LizforUs) is #offthesidelines, making a HUGE di\xe2\x80\xa6 https://t.co/2FvsfgF0yM'",SenGillibrand,338,88
848970889362362368,2017-04-03 18:50:07,"b""Insightful look into the political history of the women's movement. https://t.co/R32TUMdJ92""",SenGillibrand,320,142
848926872922619904,2017-04-03 15:55:13,b'It\xe2\x80\x99s time for us to confront and fix the toxic environment that many women in the military face. https://t.co/MUaGUBZqEl',SenGillibrand,478,142
848880304332976128,2017-04-03 12:50:10,b'Members of Congress need to play by the exact same set of rules as every other American. https://t.co/klMDcBC23P',SenGillibrand,1027,407
848617311544242176,2017-04-02 19:25:08,"b'RT @annie_parisse: With @SenGillibrand at her press conference supporting continued funding tor the NEA, NEH &amp; CBP. Raise your voice and #o\xe2\x80\xa6'",SenGillibrand,0,102
848579379999453184,2017-04-02 16:54:24,"b""If we're going to resist and protect women's access to healthcare, we must use our talents and raise our voices. To\xe2\x80\xa6 https://t.co/6aK4BNLbIM""",SenGillibrand,1426,448
848238707970895873,2017-04-01 18:20:42,b'RT @TheKnightsNYC: We performed for 20 reps from different senatorial offices who all believe in the power of the arts. Thank you for hosti\xe2\x80\xa6',SenGillibrand,0,47
847954232401698817,2017-03-31 23:30:17,b'A majority of small businesses support it. Families support it. So let\xe2\x80\x99s work hard to pass it. #paidleave\nhttps://t.co/kfmfKx2tCR',SenGillibrand,469,147
847935302786265088,2017-03-31 22:15:04,"b'With so much at stake, I struggle to understand why Republican leaders are fixated on controlling women\xe2\x80\x99s access to basic health care.'",SenGillibrand,8942,3298
847920319411236864,2017-03-31 21:15:32,b'We need to hold up our end of the bargain for graduates who choose to enter public service.\nhttps://t.co/4obZ884zlE',SenGillibrand,723,190
