id,created_at,text,user,favorite_count,retweet_count
844291069995028482,2017-03-21 20:54:11,"b'.@OSUPrezDrake, I think the #OhioState student leaders might have learned a thing or two from you! Impressive group\xe2\x80\xa6 https://t.co/Kdgu6HdD7t'",senrobportman,69,14
844284963507912710,2017-03-21 20:29:56,b'Got to meet with High School students from Clark Montessori today from my hometown of Cincinnati! #OHinDC https://t.co/pBqRIKXZyq',senrobportman,26,2
844257804328214528,2017-03-21 18:42:00,"b'Fentanyl &amp; synthetic heroins are increasingly a problem, especially in #Ohio. Here is how the #STOPAct will help: https://t.co/fmTzQra0hs'",senrobportman,14,7
844257630466064384,2017-03-21 18:41:19,"b'Today, the Major County Sheriffs of America joined a growing list of groups to endorse the #STOPAct: https://t.co/qLUrLm6DP6'",senrobportman,7,4
844253023169753088,2017-03-21 18:23:00,"b'As drug overdoses &amp; overdose deaths continue to plague communities across the US, law enforcement is asking for help:https://t.co/aqXklJbfWD'",senrobportman,6,6
844242835218096128,2017-03-21 17:42:31,"b""I'm working to preserve &amp; protect the GLRI. Critical for the health of Lake Erie &amp; Ohioans who depend on it: https://t.co/WP37XB0FBh""",senrobportman,31,10
844236874491334657,2017-03-21 17:18:50,b'Great Lakes Restoration Initiative is a results driven program that addresses the most serious threats to our lakes:https://t.co/WP37XB0FBh',senrobportman,33,17
844188170417848321,2017-03-21 14:05:18,"b'Important that we promote policies that create #jobs, unleash the private sector, &amp; allow Ohioans to innovate &amp; inv\xe2\x80\xa6 https://t.co/9ANzKnhswF'",senrobportman,19,8
844184987821883394,2017-03-21 13:52:39,"b'Honored to receive the @USChamber ""Spirit of Enterprise"" award for my work to help local businesses &amp; support pro-g\xe2\x80\xa6 https://t.co/U89TpM6bGA'",senrobportman,20,5
843926879656730627,2017-03-20 20:47:02,b'Higher taxes &amp; burdensome regulations have held our economy back. We need pro-growth policies to bring back good #jobs w/ better wages.#Ohio',senrobportman,26,12
843919325203513344,2017-03-20 20:17:01,"b'The #STOPAct will help address the fentanyl crisis in #Ohio. To find out how, go here: https://t.co/fmTzQrrBG2'",senrobportman,14,6
843890334748893184,2017-03-20 18:21:49,"b'#Ohio is proud of you, Sharita! Good Luck! https://t.co/fr9l6R3lvI @specialolyUSA'",senrobportman,29,6
843887028710379521,2017-03-20 18:08:40,"b""RT @GLFOP: The FOP supports @senrobportman's legislation to help tackle this critical issue. This loophole must be closed! #STOPAct https:/\xe2\x80\xa6""",senrobportman,0,19
843881832777236480,2017-03-20 17:48:02,"b""That's why I'm urging Congress to act on my #STOPAct legislation to keep these deadly drugs out of our communities: https://t.co/ydaQL5Erfj""",senrobportman,16,9
843881324477730816,2017-03-20 17:46:00,"b'These drugs come in from labs overseas, usually China &amp; are sent through the US Mail System:https://t.co/ydaQL5W26R #STOPAct'",senrobportman,10,5
843876166830297090,2017-03-20 17:25:31,b'Carfentanil is used as an elephant tranquilizer. Drug traffickers are lacing heroin w/ it to make it more addictive:https://t.co/ydaQL5Erfj',senrobportman,9,6
843866382634749954,2017-03-20 16:46:38,"b'Carfentanil is an opiate 10,000 times more powerful than morphine. And it is being sold by drug traffickers in #Ohio:https://t.co/ydaQL5Erfj'",senrobportman,3,8
843849920587161600,2017-03-20 15:41:13,"b'Judge #Gorsuch has an outstanding record as a fair-minded, independent, and universally-respected judge.\xe2\x80\xa6 https://t.co/3ZgSQWXXxe'",senrobportman,99,48
843636462314754049,2017-03-20 01:33:01,b'Good luck to our senior-led Bearcats as they take on UCLA and their billion dollar Freshman! #GoBearCats @GoBearcatsMBB #marchmadness',senrobportman,39,7
843541081614561280,2017-03-19 19:14:00,"b'Please, if you or your org is fighting this drug epidemic, go to my website to find out how #CARA grants can help: https://t.co/e4HGbUJK0H'",senrobportman,21,11
843538817197862912,2017-03-19 19:05:00,"b'""Drugs are killing so many people in #Ohio that cold-storage trailers are being used as morgues""-via @washingtonpost:https://t.co/hXzIjTER6i'",senrobportman,32,64
843492010032091136,2017-03-19 15:59:01,"b""We have to put in policies now that will address our rising debts and deficits. I'll keep working to do just that: https://t.co/XbiE266FkH""",senrobportman,13,7
843489998800338944,2017-03-19 15:51:01,"b""Our debt is greater than the size of our country's entire economy &amp; nearly the value of the entire U.S. stock market. This is unsustainable""",senrobportman,218,132
843488989646471168,2017-03-19 15:47:01,"b""Here's a look at our debt by the numbers:\n\n\xe2\x80\xa2 $61,000 per person\n\xe2\x80\xa2 $166,600 per household\n\xe2\x80\xa2 32 times as large as the GDP of #Ohio""",senrobportman,33,31
843485213632028673,2017-03-19 15:32:00,"b'Our country is saddled by an enormous $19.9 Trillion debt &amp; we\xe2\x80\x99re adding another $8 trillion to the debt over the next 10 years, up to $28T'",senrobportman,40,19
843256794566836225,2017-03-19 00:24:21,b'RT @XavierMBB: Eight is great. #LetsMarch #Sweet16 https://t.co/x4ZNLYQyDp',senrobportman,0,243
843222483197222913,2017-03-18 22:08:00,"b'After the big win on Thursday, @xaviermensbb takes on FSU tonight. Let keep it going X! #marchmadness #LetsGoX'",senrobportman,14,2
843192283210047488,2017-03-18 20:08:00,b'We need a health care system that is affordable &amp; is patient centered so ppl can get the care they deserve: https://t.co/WHiVkvMQGn',senrobportman,43,8
843189010969255937,2017-03-18 19:55:00,"b'ACA NOT WORKING:Health care costs are going up dramatically, #smallbiz are suffering, hurting jobs &amp; economic growth:https://t.co/WHiVkvMQGn'",senrobportman,25,19
843180960585781248,2017-03-18 19:23:01,"b'ACA NOT WORKING: In 20 #Ohio counties, only 1 health care insurer. Means less choice &amp; competition, &amp; higher costs:https://t.co/WHiVkvvfOP'",senrobportman,36,14
843158563258286082,2017-03-18 17:54:01,"b'After several years of progress in improving Lake Erie, we cannot afford to go backward. My op-ed via @toledonews: https://t.co/7ywJk9Acby'",senrobportman,55,16
843150259085856768,2017-03-18 17:21:01,"b""#GreatLakes Restoration Initiative is public/private prtnshp to help #Ohio preserve Lake Erie. That's why I'm for it:https://t.co/7ywJk9Acby""",senrobportman,35,12
843126601831321601,2017-03-18 15:47:01,b'As #Russia continues to escalate violence in #Ukraine. America must restore its leadership in the world &amp; meet this aggression w/ resolve.',senrobportman,78,20
843125089662976000,2017-03-18 15:41:00,b'#Russia continues to put out disinformation&amp;propaganda abt #Crimea. They annexed Crimea. They invaded eastern #Ukraine. Those are the facts.',senrobportman,112,39
843123582213345280,2017-03-18 15:35:01,"b""Today marks 3 yrs since #Russia's illegal annexation of #Crimea. US &amp; EU must not waver on full restoration of #Ukraine's sovereignty.""",senrobportman,88,47
842914040364089344,2017-03-18 01:42:22,"b'RT @GoBearcatsMBB: BEARCATS WIN! #Bearcats WIN! Final Score: UC 75, Kansas State 61. https://t.co/59IvtQHnKJ'",senrobportman,0,273
842894743524835328,2017-03-18 00:25:41,b'Nice win for @OhioState_WBB! https://t.co/tNuLta6jMR',senrobportman,19,5
842874910800297984,2017-03-17 23:06:53,"b""Good start for our #Ohio teams w/ Xavier's win last night. Good luck @GoBearcatsMBB, @DaytonMBB &amp; @KentStMBB in their first round games tn!""",senrobportman,19,2
842824109998268416,2017-03-17 19:45:01,"b'I will keep fighting to protect our #GreatLakes, just as I have in the past. Read my op-ed in the @ToledoNews:https://t.co/7ywJk9iAMY'",senrobportman,57,13
842821089747222528,2017-03-17 19:33:01,b'The #GreatLakes Restoration Initiative is necessary to keep progress going on our efforts to improve Lake Erie: https://t.co/7ywJk9Acby',senrobportman,49,10
842797431016177664,2017-03-17 17:59:00,"b'Too often, government gets in the way. We should unleash the private sector &amp; encourage Ohioans to innovate &amp; invest in new tech &amp; workers'",senrobportman,34,10
842793908505657344,2017-03-17 17:45:00,b'We need to bring good paying #jobs back into #Ohio &amp; the U.S thru tax reform that focuses on job creation &amp; economic growth.',senrobportman,18,5
842775285971865600,2017-03-17 16:31:00,b'No better way to celebrate #StPatricksDay than at the 175th #Cleveland #StPaddysDay Parade. Hope all you Clevelanders have fun!',senrobportman,23,3
842770138516656128,2017-03-17 16:10:33,"b""We have made a lot of progress in our efforts to #endtrafficking. See my subcommittee's final report on #Backpage: https://t.co/cbLrDt6y8H""",senrobportman,12,5
842769858626490368,2017-03-17 16:09:26,"b'A year ago today, the Senate voted to hold #Backpage in contempt of Congress - an exceptionally rare step: https://t.co/ButK4PrpFO'",senrobportman,5,4
842744807726485504,2017-03-17 14:29:54,b'Happy 105th bday to the @girlscouts &amp; thx for all you do to help girls like Ellie lead &amp; make #Ohio a better place. https://t.co/vsQo8NROWv',senrobportman,30,8
842543180851679233,2017-03-17 01:08:42,"b""RT @marchmadness: X Gon' Give It to Ya!\n\nTrevon Bluiett and Sean O'Mara combine for 39 as No. 11 Xavier knocks off No. 6 Maryland, 76-65. #\xe2\x80\xa6""",senrobportman,0,505
842543133875490820,2017-03-17 01:08:31,b'RT @XavierMBB: Winning Locker Room!!!! https://t.co/XAkndjyRBR',senrobportman,0,303
842508277640384512,2017-03-16 22:50:01,b'#LetsGoX! Good luck to @xaviermensbb as they start their tournament run. #marchmadness https://t.co/FxVNLHPOQj',senrobportman,35,10
842487640092000258,2017-03-16 21:28:00,b'A tragic story and another reminder about why we need the pass the #STOPAct to keep these dangerous drugs out: https://t.co/SuiToARSDM',senrobportman,12,3
842485123048120320,2017-03-16 21:18:00,b'We all have role to play in fighting addiction. We need an all-of-the-above strategy focusing on long-term recovery:https://t.co/TrTg1qqrO8',senrobportman,20,5
842483362166202369,2017-03-16 21:11:00,"b""In a new podcast (@cover2resources), I discussed my efforts to combat the #opioidepidemic &amp; why it's such a passion:https://t.co/TrTg1q8QWA""",senrobportman,11,6
842479947444830217,2017-03-16 20:57:26,"b'We need a simpler tax code that expands opportunity, increases wages &amp; creates more #Ohio #jobs https://t.co/rblWHz7ZfU'",senrobportman,51,13
842400586742018049,2017-03-16 15:42:05,"b'I have long championed this program, &amp; I\xe2\x80\x99m committed to continuing to do everything I can to protect our\xe2\x80\xa6 https://t.co/61TbaKleA7'",senrobportman,120,23
842399110917419009,2017-03-16 15:36:13,"b'GLRI is critical for #Ohio &amp; generates a total of &gt;$80B in benefits in health, tourism, fishing, &amp; recreation:https://t.co/BC17fHRR40'",senrobportman,49,14
842397554272800768,2017-03-16 15:30:02,b'I strongly oppose the president\xe2\x80\x99s budget request to eliminate funding for the #GreatLakes Restoration Initiative:https://t.co/BC17fHRR40',senrobportman,433,127
842123217032622080,2017-03-15 21:19:55,"b'Yesterday, I met w/ a great group of students from Pickerington HS in #CareerTechEd. My op-ed on CTE via\xe2\x80\xa6 https://t.co/dUlQl64z8l'",senrobportman,7,4
842112061484195844,2017-03-15 20:35:35,b'Glad to have the opportunity to chat with &amp; answer some questions from some very knowledgeable #Ohio students parti\xe2\x80\xa6 https://t.co/OMdNQes6dy',senrobportman,14,3
842097374860324866,2017-03-15 19:37:14,b'The rising costs of #Obamacare are hurting middle-class families in #Ohio. We need a solution that works:https://t.co/WHiVkvvfOP',senrobportman,26,6
842090187656171520,2017-03-15 19:08:40,b'Earlier this year I shared stories of Ohioans who have been hit hard by the rising costs of #Obamacare:https://t.co/WHiVkvvfOP #Ohio #AHCA',senrobportman,4,4
842073423136342017,2017-03-15 18:02:03,b'This legislation will help ensure our tax code encourages good-paying manufacturing #jobs right here in the U.S: https://t.co/ZuX4NpMaGU',senrobportman,10,2
842072094183694336,2017-03-15 17:56:46,b'Introduced bipartisan bill w/ @SenStabenow &amp; @SenSherrodBrown to support #Ohio manufacturers &amp; promote more #jobs: https://t.co/ZuX4NpMaGU',senrobportman,47,9
842057720203223040,2017-03-15 16:59:39,"b""As co-chair of the Senate Great Lakes Task Force, I'm committed to protecting the health of these natural treasures: https://t.co/ajDZlIResM""",senrobportman,36,7
842056092683251712,2017-03-15 16:53:11,"b'By authorizing @USGS #GreatLakes Science Center, this bill will support health &amp; growth of our $7B fishing industry:https://t.co/LGyiDkdQNw'",senrobportman,9,7
842052243482390528,2017-03-15 16:37:54,"b'The #GreatLakes are an invaluable resource to #Ohio, critically important to both our environment and our economy: https://t.co/LGyiDkdQNw'",senrobportman,44,11
842047952814280705,2017-03-15 16:20:51,b'Introduced bipartisan legislation today with @SenGaryPeters &amp; @SenStabenow to boost #GreatLakes funding: https://t.co/LGyiDkdQNw #Ohio',senrobportman,32,9
842047812401565697,2017-03-15 16:20:17,b'RT @ButlerTech: Great seeing @senrobportman at the @actecareertech National Policy Seminar  #NPS17 #TransformingLives @OhioACTE https://t.c\xe2\x80\xa6',senrobportman,0,5
842034020334637058,2017-03-15 15:25:29,"b""More than 150 Ohioans at this morning's constituent coffee. Met w/ ppl from all over our state, including students\xe2\x80\xa6 https://t.co/D3ItOUSLF3""",senrobportman,9,3
842028118676258816,2017-03-15 15:02:02,"b""Good discussion this morning with the @OhioFarmBureau about issues critical to #Ohio's top industry. https://t.co/EJ4u0JL7oC""",senrobportman,21,11
841832007797727232,2017-03-15 02:02:45,b'Glad to see nom of Jim Donovan. Highly respected by those who know him: brings biz expertise &amp; experience 2 Treasury:https://t.co/eOgxQhKMSh',senrobportman,11,4
841791427440963584,2017-03-14 23:21:30,b'This will help thousands of kids in #Ohio &amp; across the US by helping them live out their God-given potential:https://t.co/fnDbedTnzN #CTE',senrobportman,13,3
841790586478821376,2017-03-14 23:18:10,b'Our bipartisan legislation would improve the quality of #CareerTechEd programs so these kids get a better education\xe2\x80\xa6 https://t.co/HkdCxPS3Xk',senrobportman,19,4
841790015231393794,2017-03-14 23:15:53,b'Introduced a bill w/@timkaine today to help make sure our kids are job-ready on graduation day by supporting #CTE:https://t.co/SFhwWX18EK',senrobportman,334,72
841773180654092293,2017-03-14 22:09:00,b'Proud to support #Ohio native Robert Lighthizer to be USTR. I look forward to working w him to level the playing fi\xe2\x80\xa6 https://t.co/7bYWcC4Uhz',senrobportman,11,7
841759154079449089,2017-03-14 21:13:16,b'Feeling good about my bracket. Counting on you @GoBearcatsMBB @XavierMBB @DaytonMBB &amp; @KentStMBB! #marchmadness\xe2\x80\xa6 https://t.co/F6jd2H8pw2',senrobportman,26,7
841743739995471872,2017-03-14 20:12:01,b'I introduced this bill at the @nn4youth 2017 National Summit on Youth Homelessness:https://t.co/Vdr4vxceyR #endhomelessness #NN4Y17',senrobportman,18,5
841743235034697728,2017-03-14 20:10:00,b'Common-sense reforms will open up access to federal assistance programs for thousands of homeless children and youth:https://t.co/hADJzBLSw3',senrobportman,15,5
841741221785550848,2017-03-14 20:02:00,b'Introduced a bipartisan bill today to help homeless children &amp; give them the security &amp; stability they deserve:https://t.co/hADJzBLSw3',senrobportman,47,14
841735939307253760,2017-03-14 19:41:01,"b""I'm working hard in the Senate to get my Regulatory Accountability Act signed into law to help our #Ohio workers:https://t.co/6JugBQzcbF""",senrobportman,9,3
841734930619031554,2017-03-14 19:37:00,"b'To allow employers to create #jobs &amp; invest in making better products, we need smarter reg process that promotes econ growth &amp; job creation'",senrobportman,15,2
841734515802398720,2017-03-14 19:35:21,"b'When I visit a factory or #smallbiz in #Ohio, I hear often from employers that there are too many costly &amp; unnecessary regulations.'",senrobportman,24,3
841712534113648644,2017-03-14 18:08:01,b'My op-ed via @AdvertiserTrib on how #CTE can help close the skills gap &amp; get Ohioans good paying #jobs: https://t.co/yDPaqqXuMD #Ohio',senrobportman,7,4
841710772455587840,2017-03-14 18:01:01,"b'There are more than 100,000 #jobs available in #Ohio right now. And yet there are 280,000 Ohioans out of work: https://t.co/yDPaqrf5Eb'",senrobportman,15,9
841708507225178112,2017-03-14 17:52:00,"b""#Obamacare isn't working for #Ohio families &amp; it needs to be repealed &amp; replaced. But we have to do it right. https://t.co/LeTYvlNByG #AHCA""",senrobportman,22,3
841702465279995904,2017-03-14 17:28:00,"b""All Ohioans deserve access to clean drinking water. That's why I authored legislation to ensure safe drinking water:https://t.co/ajDZlIzD4c""",senrobportman,52,12
841669249387098112,2017-03-14 15:16:01,b'I visited the Islamic Center of Greater Cincinnati on Sunday to stand in solidarity w/ them. Story via @Enquirer: https://t.co/u75FXbJYS4',senrobportman,85,15
841653216395853825,2017-03-14 14:12:18,"b""I'm also working to get the #STOPAct passed to help keep these deadly drugs off of our streets. Read more here: https://t.co/wHsqNhB0jv""",senrobportman,8,7
841652207376297985,2017-03-14 14:08:18,"b""I'm working hard to get the bipartisan #CARA legislation implemented. Learn about how you can apply for grants:https://t.co/zwcIJYM1CC #Ohio""",senrobportman,8,5
841650711649751040,2017-03-14 14:02:21,"b'The ""cascade of cheap heroin and synthetic opiates like fentanyl and carfentanil"" is ruining lives in #Ohio: https://t.co/CA7nYIT38W #CARA'",senrobportman,9,10
841650034320003084,2017-03-14 13:59:39,"b'An all-too-familiar story in #Ohio. In our rural areas, suburbs, cities - the drug epidemic is in every ZIP Code:https://t.co/CA7nYIT38W'",senrobportman,13,6
841383538201120770,2017-03-13 20:20:42,"b'Last week, I led a bipartisan letter urging the Trump admin to prioritize the protection of Jewish Community Centers:https://t.co/Qn5Yk0DFbv'",senrobportman,79,12
841382563872665600,2017-03-13 20:16:50,b'Another wave of bomb threats to JCCs yesterday including the 2nd of the year to @MandelJCC. This must stop:https://t.co/mPhSXwGZNx',senrobportman,27,13
841372175961591808,2017-03-13 19:35:33,"b""I've worked hard to keep GLRI up and running and to secure full funding for the health of our Great Lakes: https://t.co/ajDZlIResM""",senrobportman,27,5
841369874983186433,2017-03-13 19:26:24,"b'Friday, I led a bipartisan letter to Trump Admin urging them to support the GLRI. We need full funding:https://t.co/RAN0CDrvVi'",senrobportman,58,8
841349349875548161,2017-03-13 18:04:51,"b""The Great Lakes are an invaluable economic &amp; environmental resource. I'll continue to make them a top priority:https://t.co/ajDZlIResM #Ohio""",senrobportman,54,12
841311965729423360,2017-03-13 15:36:18,"b""Over the last 6 years, I've been working hard to protect our Great Lakes. Here's some of what I've worked on: https://t.co/ajDZlIResM""",senrobportman,44,12
841016347802906625,2017-03-12 20:01:37,b'Bigotry of any kind can have no place in our society. https://t.co/QmUdT1tawn',senrobportman,194,48
841015304146817026,2017-03-12 19:57:28,b'I stand in solidarity with the Islamic community and all religions in condemning hateful threats and attacks. https://t.co/aFnQQR9EmT',senrobportman,233,35
841012866404745217,2017-03-12 19:47:47,b'Visited the Islamic Center of Greater Cincinnati today to meet with local Muslim leaders to discuss the recent thre\xe2\x80\xa6 https://t.co/JAJbQA62Wi',senrobportman,223,51
841005135711109120,2017-03-12 19:17:04,"b""One more game! Let's get the W and head into the Tournament with some momentum. Go #Bearcats! @GoBearcatsMBB #marchmadness""",senrobportman,10,1
840982403854278658,2017-03-12 17:46:44,b'Pleased I was able to share my concerns w/ @VP Pence about our #Ohio Medicaid expansion population: https://t.co/n7UJiO4qJG',senrobportman,59,12
840767810561310720,2017-03-12 03:34:01,b'.@CincyChildrens one of top 3 pediatric hospitals in USA! https://t.co/7MJnRUlaV6 https://t.co/qgpQvR4MEA',senrobportman,29,7
840766133494042624,2017-03-12 03:27:21,b'Proud to support @CincyChildrens &amp; the amazing work they do to support kids both here locally and around the world. https://t.co/qVEobmz50K',senrobportman,59,9
840761057425686529,2017-03-12 03:07:11,b'Jane did a great job\ntonight speaking to 1300 supporters of @CincyChildrens. https://t.co/aq6QVLN7eo',senrobportman,21,4
840683251874332673,2017-03-11 21:58:01,b'Semifinal game for the #Bearcats today. Fun to watch the seniors lead this team. #marchmadness @GoBearcatsMBB',senrobportman,3,1
840666390965149697,2017-03-11 20:51:01,"b""Great Lakes important source of drinking water/recreation/#jobs. I'll continue to make Lake Erie top priority:https://t.co/RAN0CDrvVi #Ohio""",senrobportman,110,19
840658842241314816,2017-03-11 20:21:01,b'Why I led a bipartisan letter urging it be in the budget: https://t.co/RAN0CDJ6MQ',senrobportman,24,5
840658592990711809,2017-03-11 20:20:01,b'Critical that we continue the Congressionally-authorized  initiative to protect the Great Lakes. https://t.co/RAN0CDrvVi',senrobportman,136,34
840630300195606528,2017-03-11 18:27:36,b'By now everyone has seen it. To make it even better - he has #Ohio roots! https://t.co/Umhjyr0wm4',senrobportman,71,14
840305766997274624,2017-03-10 20:58:01,b'Am urging the EPA to fully fund our #GreatLakes Restoration Initiative. It is critical for the heath of our lakes:https://t.co/RAN0CDJ6MQ',senrobportman,253,72
840303249890652163,2017-03-10 20:48:01,"b'As Co-Chair of the Senate #GreatLakes Task Force, I am committed to protecting these natural resources: https://t.co/RAN0CDrvVi #Ohio'",senrobportman,82,7
840300687338668032,2017-03-10 20:37:50,"b""Led bipartisan letter w/ @SenStabenow expressing our concerns abt the admin's reported cuts to #GreatLakes funding:https://t.co/RAN0CDrvVi""",senrobportman,191,42
840223575709745152,2017-03-10 15:31:25,"b'Also have much work to do to help the most vulnerable among us, including those suffering from addiction. #CARA #STOPAct'",senrobportman,42,8
840222494556581889,2017-03-10 15:27:07,"b'Solid #jobs report today, but we have much work ahead of us to increase wages &amp; create lasting economic growth. #Ohio'",senrobportman,31,6
840023899798659072,2017-03-10 02:17:59,b'RT @XavierGameday: MOVING. ON. #LetsMarch https://t.co/IdNKy33E76',senrobportman,0,250
839970144021544960,2017-03-09 22:44:22,b'Enjoyed meeting w/ senior living facility leaders from #Ohio &amp; around the US. Agree that we must ensure care for ou\xe2\x80\xa6 https://t.co/GZvZ9ZjmjG',senrobportman,33,10
839965198119215104,2017-03-09 22:24:43,b'Enjoyed talking to Agriculture Secretary Nominee Sonny Perdue. Look forward to working w/ him to grow our #1 indust\xe2\x80\xa6 https://t.co/NBH3Q1rHAy',senrobportman,25,12
839932222790582277,2017-03-09 20:13:41,b'#LetsGoX! https://t.co/XvVlCKVl6f',senrobportman,34,5
839924141809618944,2017-03-09 19:41:35,"b""Congrats Centerville HS! Proud to have you represent #Ohio in the National Science Bowl's National Finals. Good luc\xe2\x80\xa6 https://t.co/7f2IvsFue2""",senrobportman,28,6
839872363638341632,2017-03-09 16:15:50,b'Appreciated the opportunity to address my concerns w/ @VP about our #Ohio Medicaid expansion population: https://t.co/n7UJiNMPl6',senrobportman,37,6
839870713498501120,2017-03-09 16:09:16,b'Pleased to meet with @VP Pence &amp; HHS Secretary Price about improving our health care system: https://t.co/n7UJiNMPl6',senrobportman,20,6
839603164160606210,2017-03-08 22:26:08,b'Always enjoy talking with my fellow #SmallBiz owners in #Ohio about ways I can help. Thanks for having me. https://t.co/sXNCNG1wTi',senrobportman,16,5
839559343485878272,2017-03-08 19:32:00,b'Good meeting with #Ohio students taking part in @CloseUp_DC. These kids know their stuff! #FutureLeaders #CloseUpDC https://t.co/wpd0HRBfCs',senrobportman,25,11
839494917944717312,2017-03-08 15:16:00,b'Had conversations on a wide-range of issues w/ Ohioans from all over the state during this morning\xe2\x80\x99s constituent co\xe2\x80\xa6 https://t.co/ydq5TdZlAn',senrobportman,16,2
839462148019453952,2017-03-08 13:05:47,b'Live from Statuary Hall on @FoxBusiness to discuss health care. Tune in! https://t.co/OBtU5Kr22I',senrobportman,19,5
839240494882435072,2017-03-07 22:25:00,b'Over the weekend I visited Clean Acre Farms &amp; the @WilmingtonAirPk. You can read about my visits via @WilmingtonNews:https://t.co/FX2tthM4Gz',senrobportman,5,2
839235394956836869,2017-03-07 22:04:45,"b""We need to come together so what happened in Lorain last week doesn't happen again. #CARA #STOPAct https://t.co/9kh78aWfmm""",senrobportman,16,8
839232670139891712,2017-03-07 21:53:55,b'More stories of hope. I talked about Todd who founded @Racing4Recovery and the people they are helping like Jessica: https://t.co/CBz5kPdqX0',senrobportman,11,4
839231016602595332,2017-03-07 21:47:21,"b'But there are stories of hope. I talked about Dan, who I met over the weekend at Clean Acre Farms, and how he turne\xe2\x80\xa6 https://t.co/4Oa3J61qWl'",senrobportman,11,3
839228669025533953,2017-03-07 21:38:01,"b'Every single day we are now losing 144 Americans to drug overdoses. Think about that. Every single day, 144 people: https://t.co/V7qD9BBxaD'",senrobportman,41,20
839224709057294336,2017-03-07 21:22:17,"b'Help is badly needed to tackle the heroin &amp; prescription drug epidemic. By passing the #STOPAct, Congress can provi\xe2\x80\xa6 https://t.co/pHzKOEA9X9'",senrobportman,11,5
