id,created_at,text,user,favorite_count,retweet_count
904366878776328193,2017-09-03 15:34:00,"b'Wishing hardworking Ohioans a relaxing #LaborDay weekend w/ friends &amp; fam. Hard work fuels US &amp; workers deserve pro-#jobs, pro-work policies'",senrobportman,26,8
904085019878031360,2017-09-02 20:54:00,"b""We cannot allow those who traffic women &amp; children to get away w/ this. It's outrageous that it's happening in America. It must stop. #SESTA""",senrobportman,74,32
904082755885178880,2017-09-02 20:45:00,b'The goal of #SESTA is to ensure justice for victims of sex trafficking &amp; to prevent this crime from happening again. #EndHumanTrafficking',senrobportman,22,11
904074716708614144,2017-09-02 20:13:04,b'Stopping trafficking is one of the great humanitarian and human-rights causes of the 21st century.\xe2\x80\xa6 https://t.co/SAP8HoyqPZ',senrobportman,35,22
904042429820674048,2017-09-02 18:04:46,b'@WrightPattAFB @910AW @179AW @180thFW To the hundreds of men &amp; women in uniform I got to meet this week across\xe2\x80\xa6 https://t.co/TwcWwbtdtS',senrobportman,8,3
904041605220487169,2017-09-02 18:01:29,b'@WrightPattAFB @910AW @179AW @180thFW I saw that on full display this week. The folks I met w/ are doing incredible\xe2\x80\xa6 https://t.co/DYOWQugwUh',senrobportman,4,2
904040882093121536,2017-09-02 17:58:37,b'@WrightPattAFB @910AW @179AW @180thFW Ohioans are second to none in our dedication to duty and country and our comm\xe2\x80\xa6 https://t.co/d8gpYGV54q',senrobportman,5,3
904039987582263296,2017-09-02 17:55:03,b'@WrightPattAFB @910AW @179AW @180thFW America has never had to look further than the Buckeye State for patriots rea\xe2\x80\xa6 https://t.co/qKhM4NYnzN',senrobportman,6,3
904039210793013254,2017-09-02 17:51:58,"b'@WrightPattAFB @910AW @179AW @180thFW The defense industry is a critical piece of our state\xe2\x80\x99s economy, &amp; #Ohio play\xe2\x80\xa6 https://t.co/shcg1b0hdf'",senrobportman,5,2
904038680297439233,2017-09-02 17:49:52,"b'@WrightPattAFB @910AW @179AW @180thFW Defense spending in #Ohio accounts for more than 66,000 direct #jobs, more th\xe2\x80\xa6 https://t.co/XAvf2lkfwM'",senrobportman,6,2
904038296820600832,2017-09-02 17:48:20,"b'From @WrightPattAFB, to @910AW, to @179AW, to @180thFW, to JSMC &amp; more, #Ohio has some of the best military installations in the world /2'",senrobportman,6,4
904037976220557312,2017-09-02 17:47:04,"b'This week, I went on a defense tour across #Ohio, travelling more than 1,400 miles and visiting 13 counties. /1'",senrobportman,25,5
903725976886149120,2017-09-01 21:07:17,"b'I have learned a lot during my #Ohio defense tour, and I look forward to taking that knowledge with me back to Wash\xe2\x80\xa6 https://t.co/t4Dfbp4jlw'",senrobportman,11,4
903725146187456512,2017-09-01 21:03:59,b'Thankful for the men &amp; women in uniform here in Blue Ash and across our state who are working tirelessly to protect\xe2\x80\xa6 https://t.co/4TYhGYOoQ0',senrobportman,14,2
903724634704674817,2017-09-01 21:01:57,b'What they do here at the 123rd and at military bases throughout #Ohio has global impact. It has been inspiring to s\xe2\x80\xa6 https://t.co/rq7VB2Xig6',senrobportman,7,4
903724110756417537,2017-09-01 20:59:53,"b'Final visit on my 1,400 mile, 13 county #Ohio defense tour: the Blue Ash Air Guard Station 123rd Air Control Squadr\xe2\x80\xa6 https://t.co/NDvv6z5KnK'",senrobportman,6,3
903686142393851904,2017-09-01 18:29:00,b'Check out @IAmJaneDoeFilm to learn more about the bipartisan investigation that led to the creation of #SESTA. #EndHumanTrafficking',senrobportman,19,13
903670302298607616,2017-09-01 17:26:04,"b""#SESTA is a no-brainer. It's common-sense, bipartisan legislation that will make a real difference in our communiti\xe2\x80\xa6 https://t.co/C6PUN2bwaY""",senrobportman,11,5
903654696488845312,2017-09-01 16:24:03,"b'#HumanTrafficking, tragically, is flourishing on the internet. By passing #SESTA, Congress can help protect women &amp;\xe2\x80\xa6 https://t.co/uQKoDQ7Xsi'",senrobportman,55,32
903644506356142080,2017-09-01 15:43:33,b'So impressed by the men &amp; women in uniform at @WrightPattAFB. Proud to support them &amp; their mission. https://t.co/H8Tcco8R0S',senrobportman,8,3
903643798592466946,2017-09-01 15:40:45,"b""I visited @WrightPattAFB on Monday and saw firsthand why they're a national leader in delivering world-class nat'l\xe2\x80\xa6 https://t.co/QjVQ5mnAoA""",senrobportman,13,5
903643210257399808,2017-09-01 15:38:24,"b'I commend @WrightPattAFB air crews for delivering troops, food and equipment to Hurricane-ravaged Texas:https://t.co/I4Q3aCQW8Y'",senrobportman,20,7
903407052898361344,2017-09-01 00:00:00,b'College Football is back! Good luck to the #Buckeyes as they take on Indiana in prime time tonight. #GoBucks',senrobportman,56,11
903387928747003904,2017-08-31 22:44:01,"b'.@vindicator: #SESTA would ensure that websites that knowingly facilitate sex trafficking can be held liable"" https://t.co/p7Ko8NRB30'",senrobportman,12,4
903380086648438785,2017-08-31 22:12:51,b'Very impressed by the workers here at @Battelle who put so much pride &amp; expertise into every vehicle. Will continue\xe2\x80\xa6 https://t.co/eYGm0eAfDn',senrobportman,14,4
903379114257764358,2017-08-31 22:08:59,b'Vehicles built at @Battelle are used around the world so that members of the US military can perform their duties s\xe2\x80\xa6 https://t.co/9UM9mkYK5N',senrobportman,8,4
903378673247678464,2017-08-31 22:07:14,"b""Last visit of the day was to @Battelle's Advanced Manufacturing Facility in Cbus. From today's tour, I know they're\xe2\x80\xa6 https://t.co/Mk6Lj5z6XM""",senrobportman,9,2
903375597526810624,2017-08-31 21:55:01,"b'.@DispatchAlerts: The CDA ""shouldn\xe2\x80\x99t be used to shield those who knowingly help sex traffickers peddle victims.\xe2\x80\x9d https://t.co/ElznNpAQpt'",senrobportman,5,2
903358733933133824,2017-08-31 20:48:00,"b'.@toledonews editorial: #SESTA ""is a no-brainer"" https://t.co/V9dP85O5tZ'",senrobportman,14,16
903354135751397381,2017-08-31 20:29:44,b'I\xe2\x80\x99ll continue fighting to properly fund and support installations like this one that benefit #Ohio\xe2\x80\x99s economy and he\xe2\x80\xa6 https://t.co/ufWeJDPxQV',senrobportman,11,5
903352680915107841,2017-08-31 20:23:57,"b"".@121ARW maintains a high level of readiness to perform an array of missions that support our homeland &amp; nat'l secu\xe2\x80\xa6 https://t.co/rIJfSX0TNB""",senrobportman,5,3
903351831300014088,2017-08-31 20:20:34,"b""I'm proud to have supported their efforts to secure a KC-135 air refueling tanker flight simulator. I'll keep worki\xe2\x80\xa6 https://t.co/0YaNb7akRf""",senrobportman,8,3
903351309755146240,2017-08-31 20:18:30,b'Visit 10 on my #Ohio defense tour: @121ARW in Cbus. I got to meet w the men &amp; women in uniform &amp; discuss how I can\xe2\x80\xa6 https://t.co/ZH95xUcTxE',senrobportman,3,6
903339089470119940,2017-08-31 19:29:56,b'The internet has made it easier for traffickers to sell women &amp; children online for sex. #SESTA is designed to help\xe2\x80\xa6 https://t.co/mO4RAjZsop',senrobportman,31,18
903295847454126082,2017-08-31 16:38:07,"b""I\xe2\x80\x99m proud to work on behalf of bases like #Ohio's @910AW, &amp; I'll continue to ensure they get resources they need to\xe2\x80\xa6 https://t.co/bdy5dL2S3k""",senrobportman,4,4
903295016411570177,2017-08-31 16:34:48,b'I was honored to speak at the Eastern #Ohio Military Affairs Commission as they work to promote Eastern Ohio\xe2\x80\x99s vita\xe2\x80\xa6 https://t.co/93Jeev5XCF',senrobportman,3,4
903294344492404736,2017-08-31 16:32:08,"b'For yrs, the men &amp; women at @910AW have deployed resources to those in need across the globe, &amp; defended values we\xe2\x80\xa6 https://t.co/wEgL7TB5HD'",senrobportman,4,4
903291199926231040,2017-08-31 16:19:39,"b'Next visit was @910AW in Youngstown. Their mission is to deliver, deploy, and defend. I can say w/ confidence they\xe2\x80\xa6 https://t.co/Awuc0reHAr'",senrobportman,3,2
903264469815631872,2017-08-31 14:33:26,"b'Enjoyed meeting USCG leadership &amp; RADM Joanna Nunan, Commander, 9th District. Look forward to working with her for\xe2\x80\xa6 https://t.co/IpMG0ks6kM'",senrobportman,9,4
903261297776754689,2017-08-31 14:20:49,"b'Thank you for the work you do to keep us safe, including participating in the rescue efforts currently underway in\xe2\x80\xa6 https://t.co/c24cD9dRvO'",senrobportman,28,6
903260714034495488,2017-08-31 14:18:30,"b'Impressed by the men &amp; women I met today serving our country in the Coast Guard right here in downtown Cleveland,\xe2\x80\xa6 https://t.co/HQ9hWEqEYp'",senrobportman,16,4
903259982182977537,2017-08-31 14:15:36,b'Out at the @USCG Station Cleveland Harbor this morning on the fourth day of my #Ohio military tour.  Got a tour of\xe2\x80\xa6 https://t.co/dMcOgU89xb',senrobportman,13,7
902987495880699906,2017-08-30 20:12:50,"b""Had the opportunity to discuss #healthcare, foreign policy, future of the tank plant, &amp; other issues. I'll keep wor\xe2\x80\xa6 https://t.co/eXa2KKPXH2""",senrobportman,7,7
902986796274941952,2017-08-30 20:10:03,b'Enjoyed a town hall with about 150 employees yesterday in Lima at the Joint Systems Manufacturing Center. #Ohio https://t.co/pfrt7F9jD0',senrobportman,12,5
902983680997675012,2017-08-30 19:57:40,"b'Here at Heath, they ensure that Air Force equipment is properly calibrated &amp; tested for safe, successful missions b\xe2\x80\xa6 https://t.co/oLIDEmmmjI'",senrobportman,6,3
902982973787602944,2017-08-30 19:54:52,b'7th visit of my #Ohio military tour: Air Force Metrology &amp; Calibration Center in Heath - a shining example of publi\xe2\x80\xa6 https://t.co/fvhjRSkVWj',senrobportman,8,6
902980505129414656,2017-08-30 19:45:03,"b'I\xe2\x80\x99m committed to getting #taxreform done for #Ohio &amp; the American ppl in order to help grow our economy, create more #jobs, &amp; increase wages'",senrobportman,30,13
902980135028232192,2017-08-30 19:43:35,"b'Our current tax code encourages U.S. companies to take #jobs and investments overseas, and that is unacceptable: https://t.co/EJVqGH0MyW'",senrobportman,16,9
902979619116249089,2017-08-30 19:41:32,"b'I commend @realDonaldTrump for making the case abt how simplifying our complicated, burdensome, &amp; outdated tax code would benefit country.'",senrobportman,154,42
902978823825874944,2017-08-30 19:38:22,b'#TaxReform is about more #jobs and better wages for American families. https://t.co/EJVqGH0MyW',senrobportman,12,7
902967154374533122,2017-08-30 18:52:00,b'.@vindicator agrees: Congress must pass #SESTA: https://t.co/p7Ko8NRB30',senrobportman,3,2
902963380281061377,2017-08-30 18:37:00,b'Check out my recent op-ed on how the bipartisan #SESTA will help #EndHumanTrafficking: https://t.co/Eu4aNPmcyB',senrobportman,8,7
902962877644058628,2017-08-30 18:35:00,"b'Support continues to grow for #SESTA b/c anti-trafficking advocates, law enforcement &amp; others know it will help #EndHumanTrafficking.'",senrobportman,20,19
902961588021407751,2017-08-30 18:29:53,b'#HumanTrafficking is happening right here in #Ohio &amp; across the country. The bipartisan Stop Enabling Sex Trafficke\xe2\x80\xa6 https://t.co/lB9klmhoTA',senrobportman,27,13
902953476866666497,2017-08-30 17:57:39,b'I will continue to fight to ensure @179AW has resources it needs to carry out mission w/ a more modern fleet that w\xe2\x80\xa6 https://t.co/twmJVsxBgE',senrobportman,16,4
902952600227766272,2017-08-30 17:54:10,b'Seeing the fleet &amp; operations firsthand helps give me an understanding of how I can support them when I go back to\xe2\x80\xa6 https://t.co/Lexc6lyuEe',senrobportman,9,2
902951717481975810,2017-08-30 17:50:40,b'I saw firsthand the need for upgrades and I will continue to advocate for these advancements. #Ohio https://t.co/4P8WefQsMO',senrobportman,11,3
902948428866605056,2017-08-30 17:37:36,b'The @179AW in Mansfield is one our best-performing National Guard units in the Air National Guard. I got to see tha\xe2\x80\xa6 https://t.co/NJQ9iArbk7',senrobportman,43,18
902897576311001088,2017-08-30 14:15:31,b'Jane &amp; I are praying for the Taylor family. Nicholas epitomized the selfless compassion displayed by so many during\xe2\x80\xa6 https://t.co/tXYNHqI10F',senrobportman,249,106
902868733064040448,2017-08-30 12:20:55,"b""The men &amp; women I met yesterday at the @180thFW deserve the best equipment available. I'll keep working for them &amp;\xe2\x80\xa6 https://t.co/zq8UKMaz2k""",senrobportman,36,7
902867183256174592,2017-08-30 12:14:45,b'Pleased to have helped secure an authorization of $15M in funding to support upgrades for the @180thFW fighter airc\xe2\x80\xa6 https://t.co/RwcwEu8qKr',senrobportman,14,5
902866353480138752,2017-08-30 12:11:27,"b""Defending the homeland remains the number one nat'l security mission for our military - that is what the Airmen are\xe2\x80\xa6 https://t.co/Ok4wizAMQw""",senrobportman,23,4
902865916135972864,2017-08-30 12:09:43,"b'Yesterday, I visited the @180thFW on the fourth visit of my #Ohio military tour. I got to see firsthand how they ar\xe2\x80\xa6 https://t.co/cYSluG6UYv'",senrobportman,17,5
902705130960809985,2017-08-30 01:30:49,"b'Another successful day in my Ohio military tour. Visited Lima, Toledo, &amp; Sandusky. Recap here: https://t.co/V3VDBnXixq'",senrobportman,27,3
902657763410677763,2017-08-29 22:22:36,"b'Another successful day in my #Ohio military tour. Visited Lima, Toledo, &amp; Sandusky. Recap here: https://t.co/1YP89e9yt2'",senrobportman,22,8
902653209218514945,2017-08-29 22:04:30,"b""I will continue to fight to ensure @NASA Plum Brook's vital programs receive the full funding they need to carry ou\xe2\x80\xa6 https://t.co/ltowxv5c21""",senrobportman,17,6
902650068611866628,2017-08-29 21:52:01,b'.@NASAglenn &amp; the Plum Brook Station have an economic impact of more than $1.1 billion in Northeast #Ohio. Proud to\xe2\x80\xa6 https://t.co/PZruu25Xjz',senrobportman,4,6
902649555996610564,2017-08-29 21:49:59,b'The Plum Brook Station provides the most advanced testing in the world for future space exploration. https://t.co/eHfyu9C7xu',senrobportman,10,6
902648977937629184,2017-08-29 21:47:41,"b'Last visit of the day was to the @NASA Plum Brook Station in Sandusky, home to world-class test facilities. Critica\xe2\x80\xa6 https://t.co/N5NlUcCe3t'",senrobportman,9,7
902588432215556097,2017-08-29 17:47:06,"b'Held a town hall w/ JSMC employees - we discussed a range of issues including #jobs, workforce development, defense\xe2\x80\xa6 https://t.co/SXNPHjZgxm'",senrobportman,18,6
902587157943959552,2017-08-29 17:42:02,b'Proud of work to keep the Abrams tank production line at JSMC open. They build the best tanks in the world right he\xe2\x80\xa6 https://t.co/swyewhlVLv',senrobportman,13,9
902580992011116544,2017-08-29 17:17:32,b'#SESTA continues to gain bipartisan momentum &amp; support. I urge all of my colleagues to support this bill: https://t.co/xa572Bc1de',senrobportman,16,12
902579770440998914,2017-08-29 17:12:41,"b'""There should be no hesitation on the part of all members of Congress to pass the Stop Enabling Sex Traffickers Act"" https://t.co/p7Ko8NRB30'",senrobportman,37,8
902577001474732032,2017-08-29 17:01:40,b'\xe2\x80\x9cSen. Portman Takes Aim at Sex-Trafficking Portal\xe2\x80\x9d -- editorial via the Youngstown @vindicator: https://t.co/p7Ko8NRB30',senrobportman,14,7
902537058375401473,2017-08-29 14:22:57,"b""Day 2 of my #Ohio military facility tour. 1,400+ miles &amp; 13 counties. Lima's Joint Systems Manufacturing Center was\xe2\x80\xa6 https://t.co/xgPm88eaXm""",senrobportman,35,15
902286419015589888,2017-08-28 21:47:00,b'Why our bipartisan #SESTA to help stop online exploitation is necessary.  My op-ed in @TIME: https://t.co/Eu4aNPDNq9 #EndHumanTrafficking',senrobportman,27,24
902282895754006534,2017-08-28 21:33:00,b'I also got to hear from human trafficking victims in Dayton. Their traffickers must be brought to justice. https://t.co/L2UG9isAaB',senrobportman,28,16
902282393125392384,2017-08-28 21:31:00,b'Held a great roundtable discussion in Boardman where I got a lot of valuable feedback from experts. https://t.co/VQZfHj6ZnK #SESTA',senrobportman,5,4
902279876039786499,2017-08-28 21:21:00,b'Held visits across #Ohio last week promoting the bipartisan Stop Enabling Sex Traffickers Act. Highlights here: https://t.co/t8ph4Vg4fR',senrobportman,18,11
902265791860563968,2017-08-28 20:25:02,b'It was great to meet the service-members at @WrightPattAFB &amp; the @178thWing today. Thank you for serving our countr\xe2\x80\xa6 https://t.co/OieCdjfN6j',senrobportman,22,7
902264747025993728,2017-08-28 20:20:53,b'Thanks for having me and for giving me an update on the critical work you are doing. #Ohio https://t.co/Thwk927X4n',senrobportman,15,3
902264021599920128,2017-08-28 20:18:00,"b'The @178thWing provides critical real-time intelligence, surveillance, reconnaissance, and air-to-ground munitions\xe2\x80\xa6 https://t.co/ML6AZscYls'",senrobportman,11,7
902263221561774080,2017-08-28 20:14:49,b'Second visit on my #Ohio military facility tour was to the @178thWing in Springfield. https://t.co/LDLgOBASWs',senrobportman,8,4
902241317618556928,2017-08-28 18:47:47,"b""Got to see my good friend Ben Young and his team at Young's Jersey Dairy (@youngsdairy) in Yellow Springs. https://t.co/qSpXDhKa18""",senrobportman,16,6
902224776856346628,2017-08-28 17:42:03,b'.@WrightPattAFB is doing cutting-edge work that is helping to keep us safer. I got to see that firsthand today. https://t.co/T3FhxmnHdr',senrobportman,24,6
902222020456333312,2017-08-28 17:31:06,b'.@WrightPattAFB is a national leader in delivering world-class national security capabilities. Proud to support the\xe2\x80\xa6 https://t.co/bti1FO64JF',senrobportman,17,7
902220076379754496,2017-08-28 17:23:23,b'First stop was to @WrightPattAFB - the largest single-site employer in the state of #Ohio. Key to OH &amp; to our natio\xe2\x80\xa6 https://t.co/mMiYWMsTL3',senrobportman,28,9
902219520349220865,2017-08-28 17:21:10,"b'Launched my five-day #Ohio military facility tour that will cover more than 1,400 miles &amp; 13 counties: https://t.co/uHpc2E5G5E'",senrobportman,21,7
902183494507524098,2017-08-28 14:58:01,b'RT @FirehouseNews: TX #firefighters able to use pumper after #OHTF1 helps clean debris from collapsed fire station https://t.co/8zGxG6iIay\xe2\x80\xa6',senrobportman,0,17
902183194182770691,2017-08-28 14:56:49,"b'RT @GEnrightWHIO: #OHTF1 launched boats in #Katy, #Texas to rescue a man in a tree trapped by floodwater. @whiotv #Harvey @whiotv https://t\xe2\x80\xa6'",senrobportman,0,14
901947114267213826,2017-08-27 23:18:44,b'Our thoughts and prayers are with all those weathering the storm and the first responders risking their lives to help others. #OHTF1',senrobportman,71,15
901946874005004290,2017-08-27 23:17:46,b'Thankful the volunteers in #Ohio Task Force 1 are in TX helping with @fema Hurricane Harvey support: https://t.co/hOVFUyvQb9 #OHTF1',senrobportman,71,21
901895090611814400,2017-08-27 19:52:00,b'#TaxReform &amp; reg reform will create good #jobs &amp; raise wages. Important that congress #PassRAA &amp; #CutRedTape: https://t.co/herczJVSXB',senrobportman,16,7
901875973859139584,2017-08-27 18:36:02,b'Check out this short video to learn more abt what my bill does to help #EndHumanTrafficking: https://t.co/202ZAAXg5A',senrobportman,28,12
901867430451978240,2017-08-27 18:02:05,b'You can help by encouraging others to watch @IAmJaneDoeFilm &amp; highlighting the bipartisan Stop Enabling Sex Traffic\xe2\x80\xa6 https://t.co/GAjPzpJbIS',senrobportman,37,29
901865658199154688,2017-08-27 17:55:03,"b""I urge you to raise awareness on human trafficking in your communities. It's happening in #Ohio &amp; it needs to stop. https://t.co/RjR7ooifNz""",senrobportman,40,23
901862384440107010,2017-08-27 17:42:02,"b'In #Cleveland, #Dayton, #Columbus &amp; #Youngstown this week, I held events to highlight bill to #endhumantrafficking: https://t.co/mQKQj8th5m'",senrobportman,20,14
901623261955543042,2017-08-27 01:51:51,b'Proud to speak at annual @Habitat_org dinner to support a good cause. https://t.co/QRgdkoFSLP',senrobportman,19,4
901622387346731009,2017-08-27 01:48:23,"b'In the last 25 years alone, @Habitat_org has built more than 180 new homes in Cleveland, an investment worth a tota\xe2\x80\xa6 https://t.co/8Povi7tgIa'",senrobportman,49,14
901621572582211584,2017-08-27 01:45:08,b'Celebrating 30 years of @Habitat_org in Cleveland tonight. Habitat has helped hundreds of local families - and many\xe2\x80\xa6 https://t.co/LU4Ns8R48O',senrobportman,27,8
901535643133763584,2017-08-26 20:03:41,b'Hoping to come back to join the family for a house warming party! We made good progress today. Thanks to the family\xe2\x80\xa6 https://t.co/ICfh8wmYlg',senrobportman,39,6
901534041794641920,2017-08-26 19:57:19,"b""I've been volunteering w/ @Habitat_org for more than 20 yrs. I always enjoy working with caring and talented Habita\xe2\x80\xa6 https://t.co/iwBpVn3TPo""",senrobportman,53,11
901532532369494016,2017-08-26 19:51:20,b'Back at it! Another exciting Habitat for Humanity build today. Helping build homes and dreams for a family in Cleve\xe2\x80\xa6 https://t.co/00o9kxW3lb',senrobportman,63,12
901515084702388224,2017-08-26 18:42:00,"b'Thx Matt Misicka w OH Conservation, @NWF, @pheasants4ever, @DucksUnlimited, @NWTF_official, &amp; Lake Erie Charter Boat Captains for hosting me'",senrobportman,8,3
901492921668599812,2017-08-26 17:13:56,"b'Already looking forward to my next trip to the Lake! For more on my work to protect Lake Erie, check out my op-ed:\xe2\x80\xa6 https://t.co/idW7IAhtTP'",senrobportman,14,2
901491600488058880,2017-08-26 17:08:41,"b""I'll continue to fight any effort to cut funding to the #GreatLakes Restoration Initiative to help preserve this tr\xe2\x80\xa6 https://t.co/5k0iiZvkMn""",senrobportman,74,14
901489946393010177,2017-08-26 17:02:06,"b'Good roundtable discussion today on how we can work together to protect Lake Erie - for recreation, fishing, drinki\xe2\x80\xa6 https://t.co/pwV9yKPGTD'",senrobportman,26,5
901488284345536512,2017-08-26 16:55:30,"b'I take this input back to D.C. where I have led on addressing toxic algal blooms, Asian carp, and pollutants. https://t.co/AbZb1vSxbO'",senrobportman,31,9
901487872095784961,2017-08-26 16:53:52,"b'Every summer I go fishing on Lake Erie and hear from experts on status of harmful algal blooms, invasive species, p\xe2\x80\xa6 https://t.co/yEmP1P2xi9'",senrobportman,60,9
901481886471475203,2017-08-26 16:30:05,"b""Headed to another @Habitat_org build in Cleveland! Can't wait to get started. Check out the highlights from the\xe2\x80\xa6 https://t.co/FM3tmvN1u9""",senrobportman,53,10
901250877314523141,2017-08-26 01:12:08,b'Jane and I are praying for all those in the path of #HurricaneHarvey. Stay safe.',senrobportman,77,7
901217057517260800,2017-08-25 22:57:44,b'Hearing these stories today made me more encouraged than ever about the need to address this issue and get #SESTA s\xe2\x80\xa6 https://t.co/ceNPOKL6zx',senrobportman,10,5
901215464684232704,2017-08-25 22:51:25,b'The bipartisan Stop Enabling Sex Traffickers Act will help these groups help get victims of trafficking the justice\xe2\x80\xa6 https://t.co/6x63tadqZf',senrobportman,18,9
901214247371386881,2017-08-25 22:46:34,"b'Sex trafficking has moved from street corner to the smartphone, but thankfully we have ppl like those I met today w\xe2\x80\xa6 https://t.co/uqCoMeeVYN'",senrobportman,48,25
901213745728430080,2017-08-25 22:44:35,"b""I also met with local law enforcement &amp; Mercy Health officials who told me their #humantrafficking stories. It's ha\xe2\x80\xa6 https://t.co/xw3sdjgvmG""",senrobportman,12,9
901212968045735937,2017-08-25 22:41:29,b'Visited Mercy Health St. Elizabeth Hospital in Boardman today to meet w/ the Northeast #Ohio Coalition Against\xe2\x80\xa6 https://t.co/RojgeYp5ZO',senrobportman,18,8
901148590525079552,2017-08-25 18:25:41,b'Great story. Good luck to Captain Herbert &amp; the @Reds on Sunday! https://t.co/6E9YuEztfY',senrobportman,18,8
901115607428603905,2017-08-25 16:14:37,b'#Ohio is in a crisis &amp; we need more help. Task force will help us focus on best practices &amp; provide resources:https://t.co/JPhUZcE2Me #CARA',senrobportman,6,3
901114347799404548,2017-08-25 16:09:37,"b'Task force, authorized by #CARA, will bring together addiction experts to help stop over-prescribing &amp; drug abuse:https://t.co/JPhUZcE2Me'",senrobportman,6,3
901113867144704000,2017-08-25 16:07:42,"b""Imp't step to combat #opioidcrisis today w/ creation of Pain Management Best Practices Inter-Agency Task Force:https://t.co/JPhUZcE2Me #CARA""",senrobportman,4,4
901078752549101568,2017-08-25 13:48:10,b'Proud to advocate for our #NationalParks in Senate &amp; to have authored the @NatlParkService Centennial Act: https://t.co/LJNckDryh1 #Parks101',senrobportman,49,9
901078026288541697,2017-08-25 13:45:17,b'Happy 101st to the @NatlParkService. I have a feeling it will be a busy day at @CVNPNPS! #Parks101 #FindYourPark',senrobportman,44,10
900783239316549634,2017-08-24 18:13:54,"b""It's past time to hold traffickers accountable. Court ruling last night shows why Congress must act: https://t.co/LztE1b1YaC #SESTA""",senrobportman,23,9
900780629184458752,2017-08-24 18:03:32,b'Agreed. Congress must pass our Stop Enabling Sex Traffickers Act. https://t.co/fKZCOPZIb8',senrobportman,20,10
900748456888807424,2017-08-24 15:55:41,b'Please continue to hold up the family of Electronics Technician 2nd Class Jacob Drake &amp; all our missing sailors in prayer. #USSJohnSMcCain',senrobportman,96,23
900733076766158848,2017-08-24 14:54:34,b'@MissingKids Bipartisan bill w/ @SenBlumenthal will help get victims of trafficking the justice they deserve: https://t.co/Eu4aNPmcyB #SESTA',senrobportman,23,27
