id,created_at,text,user,favorite_count,retweet_count
935710340595240960,2017-11-29 03:21:44,b'The Trump administration\xe2\x80\x99s proposed deep budget cuts to @StateDept and failure to fill key diplomatic posts threaten the country\xe2\x80\x99s security.',SenWhitehouse,129,67
935710114132131840,2017-11-29 03:20:50,"b""I'm the son, grandson and nephew of Foreign Service Officers. Burns and Crocker are two of the greatest ever. Here'\xe2\x80\xa6 https://t.co/bq3Jw0anUW""",SenWhitehouse,171,124
935702401805443072,2017-11-29 02:50:11,"b'.@USCCB says TrumpTax bill is ""fundamentally flawed"" and will ""raise income taxes on the working poor while simulta\xe2\x80\xa6 https://t.co/OC9vQPnCqF'",SenWhitehouse,172,121
935688298420428800,2017-11-29 01:54:09,"b'When our public universities are sounding the alarm on how terrible the TrumpTax plan will be for our students, we\xe2\x80\xa6 https://t.co/LEQfiRZNcB'",SenWhitehouse,537,254
935658126841450496,2017-11-28 23:54:15,"b'The TrumpTax bill is shameful on so many levels, but the parts attacking students are particularly awful. Why in th\xe2\x80\xa6 https://t.co/8rvGm9FAaw'",SenWhitehouse,706,367
935651141358104576,2017-11-28 23:26:30,"b'It\'s that time of week again--head to my FB page for my 187th ""Time to Wake Up"" speech. Climate change is a serious\xe2\x80\xa6 https://t.co/HkzM6Er6b3'",SenWhitehouse,209,50
935643971761602561,2017-11-28 22:58:00,"b'Here\xe2\x80\x99s a tale as old as time: handing out jobs to insiders, family and friends. Brett Talley even failed to disclos\xe2\x80\xa6 https://t.co/zziRDBKFhZ'",SenWhitehouse,173,124
935637347689025536,2017-11-28 22:31:41,"b""I've had the privilege of working alongside A.T. Wall on important criminal justice reforms. He\xe2\x80\x99s dedicated his car\xe2\x80\xa6 https://t.co/bpOhF1huRr""",SenWhitehouse,27,10
935617176136044544,2017-11-28 21:11:32,b'Why does @realDonaldTrump keep threatening government shutdowns? Not helpful; not smart; not good for the country. https://t.co/nXJcdrtNao',SenWhitehouse,394,136
935598235464454145,2017-11-28 19:56:16,"b'Thanks to Senator Pell\xe2\x80\x99s vision, millions of students across generations get help paying for college. In RI, Pell G\xe2\x80\xa6 https://t.co/sxXSIKc09C'",SenWhitehouse,75,18
935589432421384197,2017-11-28 19:21:17,"b'Oops. Even Paul Ryan\'s carefully crafted ""example"" of someone who gets middle-class tax savings\xe2\x80\xa6falls apart upon ex\xe2\x80\xa6 https://t.co/sP4T8LmLDx'",SenWhitehouse,427,287
935579734259458049,2017-11-28 18:42:45,"b'""The GOP would saddle future generations with ever-rising interest payments, [and] misery ... would result from mil\xe2\x80\xa6 https://t.co/yInYqPkW4Z'",SenWhitehouse,168,87
935554572562595840,2017-11-28 17:02:46,"b'Making things worse: ""The Republican tax bill hurtling through Congress is increasingly tilting the United States t\xe2\x80\xa6 https://t.co/fR5PvZ48gq'",SenWhitehouse,139,84
935540168941101056,2017-11-28 16:05:32,b'Rhode Islanders: need health insurance for 2018? Head to https://t.co/O5oLXbk5EW to enroll &amp; shop for savings. https://t.co/AiadyHYI0a',SenWhitehouse,50,33
935514647637168128,2017-11-28 14:24:07,"b'.@realDonaldTrump makes ""Pocahontas"" comment to Navajo ""code talker"" WWII heroes, in front of painting of President\xe2\x80\xa6 https://t.co/gT2QOnOOlY'",SenWhitehouse,1710,730
935337645441474563,2017-11-28 02:40:47,b'An amazing case study of how the alt-right fights back to protect a pervert. https://t.co/hUQctyh99L',SenWhitehouse,439,186
935323154712547328,2017-11-28 01:43:12,"b""Trump's former @HHSGov Sec Tom Price walked away from efforts to provide better care at lower costs. This week, the\xe2\x80\xa6 https://t.co/C0MQGxN2zD""",SenWhitehouse,147,51
935293628641173509,2017-11-27 23:45:52,"b'If the disastrous TrumpTax plan passes, 13 million Americans will lose health insurance by 2027 while billionaires\xe2\x80\xa6 https://t.co/nRtwQ9V4x9'",SenWhitehouse,488,376
935268730036252672,2017-11-27 22:06:56,"b'While @realDonaldTrump denies climate change is happening, @OMBPress seeks $12 billion for communities facing storm\xe2\x80\xa6 https://t.co/1s7qqiVJSw'",SenWhitehouse,110,75
935253415088787456,2017-11-27 21:06:04,"b'RI forecast: ""the social and economic vitality of the cities and towns in Narragansett Bay and its watershed are at\xe2\x80\xa6 https://t.co/IJjQ3a54xt'",SenWhitehouse,21,12
935240076136771584,2017-11-27 20:13:04,b'Enjoyed hearing from folks at @Middletown411 Senior Center. We need to do everything we can to stop the GOP tax pla\xe2\x80\xa6 https://t.co/pCFt1oLW2s',SenWhitehouse,48,22
935230230389772288,2017-11-27 19:33:57,"b""Forgive me if I don't believe that the creepy billionaires, who live to manipulate secretly, will leave Time indepe\xe2\x80\xa6 https://t.co/E0lBgalNIA""",SenWhitehouse,457,192
935203259341594624,2017-11-27 17:46:46,"b'""Once the [tax] law is passed and the public sees its impact, voters will like its benefits."" Replace the word ""vot\xe2\x80\xa6 https://t.co/NPxVnxORJd'",SenWhitehouse,108,58
935183180579078145,2017-11-27 16:26:59,"b'Texas congressman wants funds to ""rebuild, repair and return to normal"" in Texas. Fine, but let\'s also ""prevent, pr\xe2\x80\xa6 https://t.co/YKsxD8RD2i'",SenWhitehouse,150,39
935161805336465408,2017-11-27 15:02:03,"b""DOJ hasn't had that kind of fight in it for a while, I'm sorry to say, and in this administration DOJ is more likel\xe2\x80\xa6 https://t.co/zhPOzYcISm""",SenWhitehouse,78,31
935160952911269888,2017-11-27 14:58:40,b'And FWIW many people have noticed the similarities with the fossil fuel industry climate denial campaign to mislead\xe2\x80\xa6 https://t.co/OwOuCUC5zx',SenWhitehouse,96,33
935160012724465664,2017-11-27 14:54:56,"b'This was an important case, done by the Clinton DOJ, and finished under GW Bush, finding the tobacco industry liabl\xe2\x80\xa6 https://t.co/14Mgw0mxRb'",SenWhitehouse,119,51
934964916951371776,2017-11-27 01:59:41,"b'\xe2\x80\x9cCompanies that get it have said, \xe2\x80\x98Why are we paying GMA more than $1M a yr to lobby for things that our brands don\xe2\x80\xa6 https://t.co/HJ0pRl1nWY'",SenWhitehouse,76,20
934964486154440706,2017-11-27 01:57:58,"b""Strange but not unusual: @Apple, @Google, @Facebook &amp; @Microsoft all lobby through @TechNetUpdate which doesn't men\xe2\x80\xa6 https://t.co/6WhxCSN6no""",SenWhitehouse,95,41
934963390132432896,2017-11-27 01:53:37,"b'.@CocaCola &amp; @PepsiCo have great climate policies but run $ through the American Beverage Assoc to @USChamber, whic\xe2\x80\xa6 https://t.co/OseISbZFRq'",SenWhitehouse,95,58
934963101778276352,2017-11-27 01:52:28,"b""Really hard to win a contest when you don't show up. Or when your people actually play for the other side. https://t.co/Kia5BhIExH""",SenWhitehouse,57,20
934955981892734976,2017-11-27 01:24:11,"b'This why our Defense Department has for a decade called climate change a \xe2\x80\x9ccatalyst of conflict."" https://t.co/SUAoBKGuiT'",SenWhitehouse,245,169
934948142558138369,2017-11-27 00:53:02,"b'The problem with pretending that your tax cuts are good for the middle class is that, soon enough, many will find o\xe2\x80\xa6 https://t.co/2JSmqLJRGB'",SenWhitehouse,811,440
934933889801424896,2017-11-26 23:56:24,"b""From alumni magazine: my father's college class of 1944 lost 37 classmates killed in WWII. Puts things in perspecti\xe2\x80\xa6 https://t.co/KtIQ7LFl7C""",SenWhitehouse,91,22
934927750628077568,2017-11-26 23:32:00,"b'I expected Flynn was cooperating for a while. We will see. Either way, this is an interesting development. https://t.co/TeEd7iXMMB'",SenWhitehouse,255,72
934922016410480640,2017-11-26 23:09:13,"b'\xe2\x80\x9cFinancial Institutions have been devastated"" -- oh, right, that\'s who has your ear. They did have to pay back billions....'",SenWhitehouse,305,80
934920714523762688,2017-11-26 23:04:02,"b'That ""total disaster"" @CFPB has returned billions to cheated consumers. Whose side are you on? https://t.co/jPSqsjyHMa'",SenWhitehouse,3039,1636
934853130931621889,2017-11-26 18:35:29,b'This is the group that just bought one of the local stations here in RI. https://t.co/9rJXV0Xpb6',SenWhitehouse,247,215
934576672493527046,2017-11-26 00:16:56,"b'Oops! GOP has long pinned hopes on ""dynamic scoring"" to prove its mythology that tax cuts raise revenues. Fail. Sta\xe2\x80\xa6 https://t.co/bzJYhH5L7Z'",SenWhitehouse,647,375
934485205582217216,2017-11-25 18:13:29,"b'Small businesses are the backbone of our economy here in Rhode Island. On this #SmallBusinessSaturday, let\xe2\x80\x99s get ou\xe2\x80\xa6 https://t.co/mAU6eAF8pT'",SenWhitehouse,191,43
934189799858163713,2017-11-24 22:39:39,"b'Is the tax bill the GOP\'s ""salvation,"" or ""their Alamo\xe2\x80\x9d? https://t.co/hwYSuj18XB'",SenWhitehouse,62,30
934174884527296512,2017-11-24 21:40:23,"b""GOP too infatuated with deficit-financed tax cuts for the rich to preserve bipartisan children's health care progra\xe2\x80\xa6 https://t.co/74t0PDhCdT""",SenWhitehouse,214,141
934168147195723776,2017-11-24 21:13:36,"b'Joe Scarborough on tax cuts: \xe2\x80\x9cthe Republicans\xe2\x80\x99 fiscal record is nothing less than shameful."" https://t.co/wDXq237Do7'",SenWhitehouse,353,156
934159169543958529,2017-11-24 20:37:56,b'Some secret. https://t.co/bbFNddeTfe',SenWhitehouse,294,117
934141973585424384,2017-11-24 19:29:36,b'Preview of what the TrumpTax bill means for RI. https://t.co/GwU8vRCWy1',SenWhitehouse,41,29
934135206679928832,2017-11-24 19:02:43,b'Putting a price on carbon pollution and building great infrastructure. How is that a bad thing? https://t.co/pgY4Qe65mK',SenWhitehouse,159,56
933742230107541507,2017-11-23 17:01:10,b'We have a lot to be grateful for here in RI &amp; Thanksgiving is a time to appreciate our blessings &amp; to do our part h\xe2\x80\xa6 https://t.co/5gYf50lcQH',SenWhitehouse,190,31
933545249791729664,2017-11-23 03:58:26,b'And how do you put a cost on something like this? https://t.co/KSy32IAucw',SenWhitehouse,107,55
933540192123801600,2017-11-23 03:38:20,"b""Without a price on carbon, there's no financial reason to do this. The market failure of free pollution cascades in\xe2\x80\xa6 https://t.co/e9aVufM0bX""",SenWhitehouse,312,166
933522525744762880,2017-11-23 02:28:08,"b""Definitely with all that's going on in the world too many minorities at Harvard is where DOJ should put its attenti\xe2\x80\xa6 https://t.co/xtoUtngvRu""",SenWhitehouse,459,200
933497488870387712,2017-11-23 00:48:39,b'One fact at the heart of all this: Comey was in fact way out of line disclosing derogatory investigative info and v\xe2\x80\xa6 https://t.co/qlDOhi6I7P',SenWhitehouse,161,50
933467405988388864,2017-11-22 22:49:07,"b'That little scoundrel Pruitt says ""a lot of times the tools aren\'t in the toolbox,"" but when they are he still won\'\xe2\x80\xa6 https://t.co/xoOXaO41fI'",SenWhitehouse,160,73
933455796041601025,2017-11-22 22:02:59,"b'A political list of things to be thankful for, on the day before Thanksgiving. https://t.co/Ah9kKI9Zx3'",SenWhitehouse,132,57
933446757169713152,2017-11-22 21:27:04,b'Not a ringing endorsement: \xe2\x80\x9c1 of 42 top economists surveyed by the Initiative on Global Markets....thought tax prop\xe2\x80\xa6 https://t.co/B6FwhMDbuw',SenWhitehouse,283,180
933438403898691584,2017-11-22 20:53:52,"b""RI's offshore wind farm makes it into The Nature Conservancy magazine. Go Rhody! https://t.co/Ln9Tm3Hj7Y""",SenWhitehouse,147,26
933171210136969217,2017-11-22 03:12:08,"b"".@EPAScottPruitt: \xe2\x80\x9cI don't hang with polluters; I prosecute them.\xe2\x80\x9d As we showed at his nomination hearing, the oppo\xe2\x80\xa6 https://t.co/2ebRzY7fSi""",SenWhitehouse,211,115
933160124662902784,2017-11-22 02:28:05,"b'Watch this carefully. Even more concentration of power in this hyper-concentrated area is a dangerous idea, and wil\xe2\x80\xa6 https://t.co/4OgI9SXinC'",SenWhitehouse,330,166
933149760902623232,2017-11-22 01:46:54,"b""Valuing nature in monetary terms beats valuing it at zero, but the value will always be too low, because God's Crea\xe2\x80\xa6 https://t.co/EinHEYJfrf""",SenWhitehouse,214,46
933149575682187264,2017-11-22 01:46:10,"b'Deloitte Access Economics valued the Great Barrier Reef at $42.4B, based on jobs &amp; revenue to Australia\xe2\x80\x99s economy.\xe2\x80\xa6 https://t.co/rySayKgUEM'",SenWhitehouse,187,59
933127409532055552,2017-11-22 00:18:05,"b'Look out, deficit: ""the Senate bill would load up on debt to provide upper-income tax breaks that no serious assess\xe2\x80\xa6 https://t.co/aZESEcl2d4'",SenWhitehouse,196,117
933082348308123650,2017-11-21 21:19:02,"b'Republican Cabinet member following Koch brothers\' script a ""coincidence""? Sure.... https://t.co/W3lS18rpyq'",SenWhitehouse,92,67
933062287400865799,2017-11-21 19:59:19,b'Lending a hand to the @CityofPawtucket\xe2\x80\x99s holiday basket drive to make sure families working hard to make ends meet\xe2\x80\xa6 https://t.co/CLYittMOlc',SenWhitehouse,107,15
933050729186713601,2017-11-21 19:13:23,"b""Rhode Islanders, it's time to sign up for health insurance! Head to https://t.co/O5oLXbk5EW to enroll &amp; shop for sa\xe2\x80\xa6 https://t.co/d2NflLMShe""",SenWhitehouse,31,19
933019410423582720,2017-11-21 17:08:56,"b'Less than five minutes of our world from space via @NASA satellites, to the tune of ""Sound of Silence."" Worth the f\xe2\x80\xa6 https://t.co/hFXkEJRry0'",SenWhitehouse,45,27
932780663656329216,2017-11-21 01:20:15,"b'Under Sec. Tom Price, @HHSGov walked away from efforts to provide better care at lower costs.  Nominee Alex Azar sh\xe2\x80\xa6 https://t.co/QSht22yBwo'",SenWhitehouse,110,46
932743047724576768,2017-11-20 22:50:46,b'Glad to report @EPAScottPruitt has set a date to testify before the Senate Environment &amp; Public Works Committee (af\xe2\x80\xa6 https://t.co/fECXzXh3Ux',SenWhitehouse,1095,378
932717666019799040,2017-11-20 21:09:55,"b'Glad to be here, @mit_esi. https://t.co/kQtJE2J6JN'",SenWhitehouse,38,7
932706940874117128,2017-11-20 20:27:18,"b""GOP no longer the party of the 1%; now it's the 0.2%! https://t.co/4UcLpuCNM4""",SenWhitehouse,208,94
932694393194270722,2017-11-20 19:37:26,"b'As the Kochs expand into news media, remember how much of the ""Trump"" administration they already control. https://t.co/tMKsWAqPC2'",SenWhitehouse,255,226
932679583920525313,2017-11-20 18:38:35,"b""At Mermaid's Purl in Wickford selling Block Island wool! Sheep to yarn on BI! #shopsmall https://t.co/4QKBkYBPLB""",SenWhitehouse,92,14
932668609687707649,2017-11-20 17:54:59,b'Getting an early start on holiday shopping in Wickford this am ahead of #SmallBusinessSaturday. Remember to\xe2\x80\xa6 https://t.co/rKOsME0PXb',SenWhitehouse,65,23
932643585018785793,2017-11-20 16:15:33,"b""Republicans finance their tax cuts w $2T deficit; RI can't run deficit, so spending cuts or taxes will be required\xe2\x80\xa6 https://t.co/4QyprAcGxH""",SenWhitehouse,123,80
932430704809594880,2017-11-20 02:09:38,"b""It's a wonder-full world! https://t.co/QqzzSKXlXD""",SenWhitehouse,52,8
932421653329530880,2017-11-20 01:33:40,"b'Just heard Bill McKibben say: \xe2\x80\x9cIf you\'d been marinating in Rush Limbaugh for thirty years, you\'d be impervious to reason too.""'",SenWhitehouse,2879,960
931911795522105346,2017-11-18 15:47:40,"b'It\'s time for @UPS to wake up! It ""believes"" industry, government &amp; the public all have a responsibility to address\xe2\x80\xa6 https://t.co/4K0tivFtlY'",SenWhitehouse,228,135
931869759607640064,2017-11-18 13:00:38,"b""Funding climate deniers doesn't make sense considering the damage Hurricane Maria did to @pfizer factories. It know\xe2\x80\xa6 https://t.co/FvJWPi21ts""",SenWhitehouse,200,59
931868702257172480,2017-11-18 12:56:26,"b'It\'s time for @pfizer to wake up! It ""believes"" industry, government &amp; the public all have a responsibility to addr\xe2\x80\xa6 https://t.co/xPuFF3Qpwn'",SenWhitehouse,230,102
931693534821969920,2017-11-18 01:20:23,"b""Donors' threats, and efforts to please big donors, continue to drive tax bills in Congress. Bipartisanship? Good po\xe2\x80\xa6 https://t.co/lVOFMPTIEs""",SenWhitehouse,449,299
931651361355288576,2017-11-17 22:32:48,"b'Thanks, @Surgeon_General for mentioning the great work of RI\xe2\x80\x99s @CVSHealth in your testimony during this week\xe2\x80\x99s HELP\xe2\x80\xa6 https://t.co/JU3bJwL8NT'",SenWhitehouse,98,23
931647064467009536,2017-11-17 22:15:43,"b'Once again, we tried here as hard as I knew how. I wish we had received this decision back then. We could have clea\xe2\x80\xa6 https://t.co/OCp0EzTRJp'",SenWhitehouse,137,52
931644503739551749,2017-11-17 22:05:33,"b'The news has dribbled out slowly, but the totals are striking: \xe2\x80\x9cthe Trump campaign interacted with Russians at leas\xe2\x80\xa6 https://t.co/5L6GlMrCEJ'",SenWhitehouse,19430,14164
931634197608976384,2017-11-17 21:24:36,b'Good for France. The 30 Euro level is pretty close to my carbon fee bill. https://t.co/DnLBnkZQwz',SenWhitehouse,165,58
931631841823657984,2017-11-17 21:15:14,"b'More Koch-funded anti-science mischief. They do not let up protecting their ""right"" to pollute. Unfortunately, they\xe2\x80\xa6 https://t.co/330kegIxPr'",SenWhitehouse,164,117
931617047276085248,2017-11-17 20:16:27,"b'""Collusion"" is not a legal term in this context; conspiracy, attempt, aiding and abetting all are. ""Collusion"" is a\xe2\x80\xa6 https://t.co/EYGk7jf7uz'",SenWhitehouse,289,114
931599834838192128,2017-11-17 19:08:03,b'It is never appropriate to deny judges confirmation because of their religious beliefs. It is always appropriate to\xe2\x80\xa6 https://t.co/ylXab9wulB',SenWhitehouse,542,151
931578512103936001,2017-11-17 17:43:19,"b""Proud that my bill to protect servicemembers &amp; veterans from foreclosure is headed to @POTUS's desk to be signed in\xe2\x80\xa6 https://t.co/LAx7OPyCzC""",SenWhitehouse,237,57
931575862436270080,2017-11-17 17:32:48,b'Scott McKay nails it about the tax bill. https://t.co/EyZROYVACf',SenWhitehouse,28,28
931554819243995136,2017-11-17 16:09:11,"b'The Senate plan ""effectively takes from low- and middle-income individuals to give to corporations.""  \nhttps://t.co/WZrEPIBiQA'",SenWhitehouse,244,170
931357338002509824,2017-11-17 03:04:27,"b'GOP health-care reform tried to ""remove millions of people from health-care coverage while giving tax cuts to the s\xe2\x80\xa6 https://t.co/5ABqLKcqql'",SenWhitehouse,316,181
931343352972414976,2017-11-17 02:08:53,"b'Oh, great, that\'s all we need. FOX ""News"" and Sinclair ""must-runs"" are not enough? More creepy-billionaire news to\xe2\x80\xa6 https://t.co/zfUkG76Ut6'",SenWhitehouse,177,91
931337927606591488,2017-11-17 01:47:20,"b'But of course Pruitt would do this, along with @HeartlandInst, famous for comparing climate scientists to the Unabo\xe2\x80\xa6 https://t.co/mRNkLizEwP'",SenWhitehouse,86,48
931312376401444865,2017-11-17 00:05:48,"b'Aah, memory. And its oh-so-convenient lapses.\nhttps://t.co/xcstvGxW8h'",SenWhitehouse,195,60
931309872653647872,2017-11-16 23:55:51,"b""Under TrumpTax plan, grad students pay for billionaires\xe2\x80\x99 tax breaks. Can't make this stuff up. https://t.co/9AqXMK6oA8""",SenWhitehouse,475,428
931293435998363648,2017-11-16 22:50:32,b'My bill w/ @timkaine would help those who serve their communities get the student loan relief they deserve under th\xe2\x80\xa6 https://t.co/nQhIfKuh9S',SenWhitehouse,551,167
931284086915780608,2017-11-16 22:13:23,b'NEW REPORT: The TrumpTax plan is basically tax cuts for billionaires &amp; corporations. How is @SenateGOP planning to\xe2\x80\xa6 https://t.co/33jbeNhCAu',SenWhitehouse,238,227
931275843669778432,2017-11-16 21:40:38,b'From the Department of This Is No Surprise. https://t.co/bBRdvo7Idh',SenWhitehouse,82,58
931260917450510336,2017-11-16 20:41:19,b'.@SenateGOP wants to give huge tax breaks to billionaires like @realDonaldTrump and is asking middle-class families\xe2\x80\xa6 https://t.co/EwTmkphKCC',SenWhitehouse,441,360
931256140897423361,2017-11-16 20:22:20,b'This is a great eight-and-a-half minute video displaying how the tax code favors the rich and unearned income. https://t.co/0Rx7DyshNW',SenWhitehouse,97,104
931244096215187457,2017-11-16 19:34:28,"b'As climate change and related pollution drives asthma problems, responses like this Rhode Island Hospital grant are\xe2\x80\xa6 https://t.co/IrdPpASRRp'",SenWhitehouse,60,18
931232394425851905,2017-11-16 18:47:58,b'This is an important clarification. I take sexual assault allegations very seriously. https://t.co/vbVXzhhPRO',SenWhitehouse,483,166
931232244143812609,2017-11-16 18:47:23,"b'Allegations of sexual assault or harassment by any member of Congress, like those against Senator Franken, must be\xe2\x80\xa6 https://t.co/SyWaQxrhgY'",SenWhitehouse,573,109
931204043694886914,2017-11-16 16:55:19,b'Wearing purple today in honor of World Pancreatic Cancer Day. Let\xe2\x80\x99s keep working toward advancing pancreatic resear\xe2\x80\xa6 https://t.co/LhGDDHpBTg',SenWhitehouse,308,44
931166482238705666,2017-11-16 14:26:04,b'Interesting and creepy climate change article about unknown (in modern time) viruses emerging from melting permafro\xe2\x80\xa6 https://t.co/o0tqAaVBLb',SenWhitehouse,210,130
931151822936465408,2017-11-16 13:27:49,"b""An acid critique of the pro-billionaire, you-pay-for-it TrumpTax sellout. Wouldn't it be great if this were just fu\xe2\x80\xa6 https://t.co/IMPrhuMyOz""",SenWhitehouse,219,116
930978578241654784,2017-11-16 01:59:24,b'.@SenateGOP is ramming judicial nominees through the Senate Judiciary Committee without giving them the scrutiny th\xe2\x80\xa6 https://t.co/V6flB1EvM5',SenWhitehouse,12074,7249
930976271399641088,2017-11-16 01:50:14,b'Virginia looking at joining RGGI! Step by step we will meet our climate goals. https://t.co/5yVNIbTF4o',SenWhitehouse,123,33
930972605020024832,2017-11-16 01:35:40,"b"".@MikeBloomberg and @JerryBrownGov keep the climate pressure on. We're still in! https://t.co/BbsprHgp6g""",SenWhitehouse,201,80
930958246105505793,2017-11-16 00:38:36,"b'Under the TrumpTax plan, corporations &amp; billionaires will enjoy huge tax breaks, and middle-class homeowners could\xe2\x80\xa6 https://t.co/fq2bZFooe8'",SenWhitehouse,195,192
930942871523520513,2017-11-15 23:37:31,"b""Where in the world is #SecretiveScott? It's been 300 days since he last appeared before the Senate Environment &amp; Pu\xe2\x80\xa6 https://t.co/2t9oKxdshu""",SenWhitehouse,364,189
930936356792135682,2017-11-15 23:11:38,"b'Instead of working with @SenateDems, @SenateGOP keeps resurrecting the ACA repeal and replace zombie for their Repu\xe2\x80\xa6 https://t.co/nN6vgSp9EO'",SenWhitehouse,216,79
930930870223101952,2017-11-15 22:49:49,b'Note photo. Anyone missing? https://t.co/1pKuCfKey4',SenWhitehouse,51,29
930917919973871618,2017-11-15 21:58:22,"b""RT @jacob_holzman: Hope you had your coffee, because it's https://t.co/S9nEBtFDj4""",SenWhitehouse,0,38
930909105799270401,2017-11-15 21:23:20,"b'At the @CFPB, Richard Cordray helped US consumers stand up to big corporations and empowered judges and juries, whi\xe2\x80\xa6 https://t.co/9Cu52BUV01'",SenWhitehouse,166,60
930899098923880449,2017-11-15 20:43:35,b'CEOs explode myth that corporate tax cuts will yield capital investments (hence jobs). https://t.co/4yeoukSq3Q',SenWhitehouse,213,117
930891989171744768,2017-11-15 20:15:20,"b'LIVE NOW on the Senate floor to discuss #COP23 &amp; to call on @realdonaldtrump, @EPAScottPruitt &amp; @SecretaryPerry to\xe2\x80\xa6 https://t.co/eMUhmUbF5r'",SenWhitehouse,107,54
930882207807426560,2017-11-15 19:36:27,"b'""The G.O.P.\xe2\x80\x99s new plan eventually raises rates for everyone but corporate America,"" but corporate ""tax savings will\xe2\x80\xa6 https://t.co/hw3EggpPC1'",SenWhitehouse,132,122
930865021923577860,2017-11-15 18:28:10,"b'TrumpTax plan = tax breaks for billionaires at the expense of middle-class programs, 13M Americans lose health insu\xe2\x80\xa6 https://t.co/4d9WwMTEHl'",SenWhitehouse,366,210
930854722008952833,2017-11-15 17:47:14,b'Thank goodness for quick thinking and action by Rancho Tehama School officials. When does this end? https://t.co/zABYqC7wwA',SenWhitehouse,90,31
930849842225696770,2017-11-15 17:27:51,b'RT @AARPRI: Talk about Medicare and healthcare issues with @SenWhitehouse Friday morning. Register here and you will receive a call shortly\xe2\x80\xa6',SenWhitehouse,0,8
930835933490008064,2017-11-15 16:32:35,"b""This is the decision we should have won in Rhode Island years ago. It's a long read, and a sad comparison.\xe2\x80\xa6 https://t.co/lzcoeS3HWU""",SenWhitehouse,37,18
930828236866641921,2017-11-15 16:02:00,"b'Here we go again. After months of pushing an irresponsible, partisan plan to tear down the ACA &amp; strip health insur\xe2\x80\xa6 https://t.co/i4mhONJf6R'",SenWhitehouse,694,397
930802875105673216,2017-11-15 14:21:13,"b""RT @SenWarren: .@SenFranken and I break down what CEOs will do with the tax giveaways they'll get if the GOP's corporate tax bill passes Co\xe2\x80\xa6""",SenWhitehouse,0,3934
930578365811167232,2017-11-14 23:29:06,"b""It's not normal that @EPAScottPruitt hasn't appeared before the Senate committee charged w/ oversight of the agency\xe2\x80\xa6 https://t.co/sTsRse6HQi""",SenWhitehouse,454,240
930569561996447744,2017-11-14 22:54:07,"b'\xe2\x80\x9cThis is a dark, dark chapter in the history of the United States Senate.\xe2\x80\x9d Couldn\xe2\x80\x99t agree more, John. Thanks for sp\xe2\x80\xa6 https://t.co/NPHDYL0l3F'",SenWhitehouse,2223,644
930554527845109761,2017-11-14 21:54:22,"b'Rhode Islanders, tomorrow you can sign up for health insurance &amp; shop for savings \xe2\xac\x87\xef\xb8\x8f https://t.co/JGGuLIShjW'",SenWhitehouse,75,37
