id,created_at,text,user,favorite_count,retweet_count
806690852076666880,2016-12-08 02:44:21,"b'I\xe2\x80\x99ll keep fighting to implement the good policies in #CuresAct, repeal the giveaways, &amp; hold Congress accountable for NIH &amp; opioid funding.'",SenWarren,2517,495
806690383791030272,2016-12-08 02:42:29,b'But I believe the final 21st Century #CuresAct still failed to live up to the standards we should expect from our Congress.',SenWarren,953,198
806689987987197952,2016-12-08 02:40:55,b'We also got a ridiculous provision removed from the #CuresAct that would let drug companies hide kickbacks to doctors &amp; hospitals.',SenWarren,2102,529
806689658423902212,2016-12-08 02:39:36,"b'By fighting back, we changed a #CuresAct provision that would let @realDonaldTrump decide opioid spending. Now MA should get its fair share.'",SenWarren,1000,215
806689338205540352,2016-12-08 02:38:20,b'Republicans also broke their promise in the #CuresAct to meaningfully boost guaranteed funding for NIH and the opioid crisis.',SenWarren,1159,425
806689066725076992,2016-12-08 02:37:15,b'Republicans concluded that bipartisan medical innovation in the #CuresAct would require a raft of giveaways to giant drug companies.',SenWarren,826,291
806688674104668160,2016-12-08 02:35:42,"b'I\xe2\x80\x99m glad that many good provisions in the #CuresAct will become law, but I\xe2\x80\x99m disappointed by the price we paid for the GOP to pass the bill.'",SenWarren,1048,256
806688366020411392,2016-12-08 02:34:28,b'The #CuresAct includes my bipartisan provision reducing the admin burden at NIH to ensure more efficient spending of fed research money.',SenWarren,937,171
806688100319657984,2016-12-08 02:33:25,b'The #CuresAct includes my bipartisan provision ensuring the meaningful inclusion of women &amp; minorities in clinical trials.',SenWarren,1154,222
806687784362614784,2016-12-08 02:32:09,b'The #CuresAct includes my bipartisan provision supporting the development of genetically-targeted therapies for people with rare diseases.',SenWarren,1216,248
806687583153614848,2016-12-08 02:31:22,b'The #CuresAct includes my bipartisan provision to strengthen Senator Kennedy\xe2\x80\x99s work to protect the genetic privacy of patients.',SenWarren,890,172
806687338810245124,2016-12-08 02:30:23,b'The 21st Century #CuresAct includes a number of bipartisan provisions that I\xe2\x80\x99ve spent months &amp; years working with others to write &amp; pass.',SenWarren,1179,187
806642548332695552,2016-12-07 23:32:24,"b'So will you keep your promise to protect Medicare &amp; Medicaid, @realDonaldTrump? My colleagues &amp; I want to know: https://t.co/PtyEAZL1HP'",SenWarren,2372,959
806642313573335040,2016-12-07 23:31:28,"b'But the election is over, @realDonaldTrump, &amp; now you\xe2\x80\x99re shifting to support changes that would gut Medicare &amp; Medicaid.'",SenWarren,2207,932
806642013483466752,2016-12-07 23:30:17,"b'During your presidential campaign, @realDonaldTrump, you promised you were the only Republican who would protect Medicare &amp; Medicaid.'",SenWarren,4123,1676
806610477975556099,2016-12-07 21:24:58,"b'I know I speak for millions when I say: Thank you for your tireless fight, @VP Biden. We wish you the very best.\xe2\x80\xa6 https://t.co/MCOHOk2sHC'",SenWarren,8901,1801
806587121469427713,2016-12-07 19:52:10,b'I introduced the Jessica Kensky &amp; Patrick Downes Act to let terrorism victims access military healthcare facilities. https://t.co/nMq3tfdIm6',SenWarren,926,211
806586796406665216,2016-12-07 19:50:52,b'We need to allow military doctors to share their expertise &amp; provide terrorism victims with streamlined access to our military healthcare.',SenWarren,1567,317
806586559013224449,2016-12-07 19:49:55,b'I visited Jess &amp; Patrick at Walter Reed &amp; saw the state-of-the-art facilities &amp; world-class physicians who helped them recover more fully.',SenWarren,786,133
806586309104062470,2016-12-07 19:48:56,b'Jessica Kensky &amp; Patrick Downes survived the Boston Marathon bombing. @DeptofDefense gave them special designation for care at Walter Reed.',SenWarren,594,131
806550702105444352,2016-12-07 17:27:27,b'We know the big bank onslaught to roll back critical financial rules &amp; pad bankers\xe2\x80\x99 pockets is coming. It\xe2\x80\x99s up to all of us to fight back.',SenWarren,3318,1057
806550442083811330,2016-12-07 17:26:25,"b""Big banks like @WellsFargo have no shame. No matter how much they hurt investors &amp; customers, they're prowling to gut Dodd-Frank.""",SenWarren,2069,748
806550190689755136,2016-12-07 17:25:25,"b'Fresh off of defrauding customers, @WellsFargo\xe2\x80\x99s new CEO wants Congress to weaken the financial rules. https://t.co/wIZeJFUCie'",SenWarren,1385,1089
804058707101356032,2016-11-30 20:25:09,"b'Trump, Mnuchin &amp; @HouseGOP may be willing to gamble w/ our economy, but @HouseDemocrats should side with ppl who want tougher Wall St rules.'",SenWarren,3094,1042
804058387004715010,2016-11-30 20:23:52,b'Steve Mnuchin would get to decide how to regulate 30 of our biggest banks \xe2\x80\x93 including the bank where he currently serves as board member.',SenWarren,6283,4211
804058111774511105,2016-11-30 20:22:47,"b'HR 6392 would take power away from independent regulators &amp; give it to @realDonaldTrump\xe2\x80\x99s choice for Treasury Secretary, Steve Mnuchin.'",SenWarren,1085,739
804057773227077632,2016-11-30 20:21:26,b'The banks cut loose by HR 6392 are the same size as the banks that helped bring down the economy in 2008. What could possibly go wrong?!',SenWarren,2985,1485
804057502367289344,2016-11-30 20:20:21,b'.@HouseGOP aren\xe2\x80\x99t waiting for @realDonaldTrump to roll back Wall St reform. HR 6392 guts Dodd-Frank rules for 30 of the biggest banks.',SenWarren,1052,772
804045751357734912,2016-11-30 19:33:40,b'I still oppose the 21st Century Cures Act. The American people deserve a better deal. https://t.co/YAxDpglGGm',SenWarren,1313,456
804045527281238021,2016-11-30 19:32:46,"b'21st Century Cures still doesn\xe2\x80\x99t do nearly enough to help generate real cures for Alzheimer\xe2\x80\x99s, diabetes, cancer, &amp; other deadly diseases.'",SenWarren,1350,401
804045216466534407,2016-11-30 19:31:32,"b'21st Century Cures no longer lets drug companies hide kickbacks to doctors, but it still lets drug companies get away with fraud.'",SenWarren,1285,553
804044922718449664,2016-11-30 19:30:22,"b'Since the public got wind of the Big Pharma giveaways &amp; Congress started feeling the heat, 21st Century Cures has changed a little.'",SenWarren,1152,324
804006675778863104,2016-11-30 16:58:23,b'Heading to the Senate floor w/ @SenJeffMerkley &amp; @SenatorDurbin to discuss why I still oppose the Cures Act. Watch: https://t.co/yqWgK1qEGx',SenWarren,1045,282
803716917009797120,2016-11-29 21:47:00,"b""RT @SenWhitehouse: My 150th climate speech is live on @CSPAN 2 at ~4:45pm. We've got to #ActOnClimate now &amp; #draintheswamp of special inter\xe2\x80\xa6""",SenWarren,0,329
803690408194834433,2016-11-29 20:01:39,b'I\xe2\x80\x99m proud to #Fightfor15 alongside workers in Massachusetts &amp; nationwide. #povertydoesntfly https://t.co/zPWmk3aTF3',SenWarren,2233,759
803689927137443840,2016-11-29 19:59:45,b'Building economic security starts by raising the min wage to $15/hr &amp; making sure every worker has the right to join a union. #fightfor15',SenWarren,4444,1357
803689664704118784,2016-11-29 19:58:42,"b'No one who works full time should live in poverty. Not fast food workers, Uber drivers, or hardworking folks at @BostonLogan. #Fightfor15'",SenWarren,4561,1324
803403609929121796,2016-11-29 01:02:01,b'I told my Dem colleagues: We weren\xe2\x80\x99t sent to Congress to roll over to drug companies. Show some spine &amp; fight back. https://t.co/QvSJiGmUaF',SenWarren,7818,2425
803403299512848384,2016-11-29 01:00:47,b'I know the difference between compromise &amp; extortion \xe2\x80\x93 and I cannot vote for the 21st Century Cures Act as it currently stands.',SenWarren,3123,789
803402971488940036,2016-11-29 00:59:29,"b'Every good proposal in the Cures Act will die unless Democrats help drug companies commit fraud, give out kickbacks, &amp; put patients at risk.'",SenWarren,2069,638
803402650142277634,2016-11-29 00:58:12,"b'Congress has been working on medical innovation legislation for yrs. But in the final days of 2016, Big Pharma hijacked 21st Century Cures.'",SenWarren,2387,897
803355285293244416,2016-11-28 21:50:00,b'Big Pharma has hijacked the 21st Century Cures Act. About to speak on the Sen floor about my concerns with the bill. https://t.co/aaP67lX8jh',SenWarren,2733,820
803319318582882304,2016-11-28 19:27:05,b'Congress should pass the bipartisan Retirement Savings Lost &amp; Found Act \xe2\x80\x93 a commonsense bill to help Americans retire with dignity.',SenWarren,3978,1058
803318991917842432,2016-11-28 19:25:47,b'.@SteveDaines &amp; I introduced a bill to help workers locate old 401(k)s online. Read more about it in @WSJ: https://t.co/wPD51v3RJL',SenWarren,1419,499
803318764834013186,2016-11-28 19:24:53,"b'When workers leave jobs, retirement accounts get left behind. Up to 30% of retirement plans &amp; hundreds of millions $$$ are lost/neglected.'",SenWarren,2146,654
801483086311604224,2016-11-23 17:50:33,b'.@realDonaldTrump\xe2\x80\x99s transition \xe2\x80\x9cdisarray\xe2\x80\x9d &amp; serious conflicts of interest raise questions that taxpayers deserve to have answered.',SenWarren,6372,2123
801482804995489792,2016-11-23 17:49:26,b'.@RepCummings &amp; I asked @USGAO to review @realDonaldTrump\xe2\x80\x99s taxpayer-funded transition today.\xe2\x80\xa6 https://t.co/OuUOzbtY6j',SenWarren,3747,1923
801482527567446016,2016-11-23 17:48:20,b'The President of the US should work for you \xe2\x80\x93 &amp; not exploit the most powerful office in the world &amp; your tax dollars to make a quick buck.',SenWarren,18062,7394
801189353108205569,2016-11-22 22:23:21,"b"".@USTreasury shouldn\xe2\x80\x99t drag its feet to say that 387k people's cancelled student loans aren\xe2\x80\x99t taxable. https://t.co/5YuiU61846""",SenWarren,2091,727
800727903239606272,2016-11-21 15:49:43,"b'RT @presmccartney: Steve Bannon has made some uninformed comments about the Seven Sisters. Today, we have our own message for him. https://\xe2\x80\xa6'",SenWarren,0,1251
799758600981925888,2016-11-18 23:38:03,b'We should all be very worried if a @realDonaldTrump Education Dept will stand up for students being ripped off at shady for-profit colleges.',SenWarren,7833,3103
799758158520430592,2016-11-18 23:36:18,b'It is totally unprecedented for a President-elect of the United States to have to settle fraud lawsuits before taking office.',SenWarren,66653,34869
799757882723995649,2016-11-18 23:35:12,b'.@realDonaldTrump just paid $25 million for breaking the law &amp; ripping off students. https://t.co/G73gPNd7lS',SenWarren,8442,7025
799757625944576000,2016-11-18 23:34:11,b'.@realDonaldTrump swindled thousands of students at his sham \xe2\x80\x9cTrump University.\xe2\x80\x9d That\xe2\x80\x99s not up for debate anymore \xe2\x80\x93 that\xe2\x80\x99s a fact.',SenWarren,18048,9763
799702778344079361,2016-11-18 19:56:14,"b'Today, a new GOP Senate must decide whether self-interest &amp; political cowardice will prevent them from once again doing what is right.'",SenWarren,5639,1943
799702070282612738,2016-11-18 19:53:25,"b'30 yrs ago, a GOP Senate rejected @SenatorSessions\xe2\x80\x99 judicial nomination, affirming no compromise with racism; no negotiation with hate.'",SenWarren,9699,4981
799701762206679040,2016-11-18 19:52:12,"b'If @realDonaldTrump refuses to reverse on @SenatorSessions, it falls on the Senate to exercise fundamental moral leadership for our nation.'",SenWarren,7488,3031
799701540546236416,2016-11-18 19:51:19,"b'Instead of embracing the bigotry of his rallies, I urge @realDonaldTrump to reverse his decision to nominate @SenatorSessions for AG.'",SenWarren,4021,1495
799632324916838400,2016-11-18 15:16:17,"b""Gov @MittRomney: when you're meeting with @realDonaldTrump, maybe you could bring your binders full of women with y\xe2\x80\xa6 https://t.co/UYD32JzZR4""",SenWarren,11967,5203
799383282697834496,2016-11-17 22:46:41,b'Today I spoke about @realDonaldTrump\xe2\x80\x99s decision to hand over the government to the worst special interests. Watch: https://t.co/mx9z44CZ13',SenWarren,4076,1905
799382990954622978,2016-11-17 22:45:31,"b'.@realDonaldTrump isn\xe2\x80\x99t \xe2\x80\x9cdraining the swamp.\xe2\x80\x9d He\xe2\x80\x99s inviting the biggest, ugliest swamp monsters in the front door.'",SenWarren,14089,5855
799335521122013184,2016-11-17 19:36:53,b'About to speak on the Senate floor about @RealDonaldTrump\xe2\x80\x99s broken promise to #draintheswamp. Watch live: https://t.co/9cyvsLgdnt',SenWarren,2598,813
799331877211541506,2016-11-17 19:22:25,b'Registering &amp; tracking Americans based on race or religion is idiotic. Disgusting. Unconstitutional. And it\xe2\x80\x99s a recruiting bonanza for ISIS.',SenWarren,26850,12304
799315221361868804,2016-11-17 18:16:13,"b""If @realDonaldTrump thinks we\xe2\x80\x99re going to just roll over while his Wall St buddies crash our economy again, they're in for a rude awakening.""",SenWarren,9404,2875
799314825453015040,2016-11-17 18:14:39,"b'Why is Wall St celebrating @realDonaldTrump? Because his administration ""looks like an investment banker\xe2\x80\x99s dream.\xe2\x80\x9d https://t.co/ugnYkjTOd7'",SenWarren,2311,1373
799032815320973314,2016-11-16 23:34:03,b'I ask the financial industry: Bigotry is bad for our country &amp; business. What message do you send customers &amp; employees if you stay silent?',SenWarren,7294,2376
799032530309677056,2016-11-16 23:32:55,"b'.@SenSherrodBrown, @MaxineWaters, @keithellison &amp; I sent a letter to banking leaders, urging them to condemn Bannon. https://t.co/eCiitHjOmP'",SenWarren,3149,986
799032206429736976,2016-11-16 23:31:37,b'.@realDonaldTrump appointed a bigot as his WH Chief Strategist. This is a moral test for all of us \xe2\x80\x93 including the business community.',SenWarren,7736,2710
798916285014933505,2016-11-16 15:51:00,"b'Brought a longtime friend &amp; my new colleague by the office today \xe2\x80\x93 our new Senator-Elect from CA, @KamalaHarris! https://t.co/6PbkLwlRQV'",SenWarren,17140,2726
798643894741336064,2016-11-15 21:48:37,"b'#draintheswamp on your team, @realDonaldTrump. The American people demanded changes, &amp; we\xe2\x80\x99re watching you every step of the way.'",SenWarren,6917,2293
798643590603776000,2016-11-15 21:47:24,b'And I sent a letter to @realDonaldTrump raising my concerns about the insiders running his transition team: https://t.co/f9cRhIci8l',SenWarren,4677,1714
798643271387877376,2016-11-15 21:46:08,b'Today I told a room full of CEOs at the #WSJCEOCouncil: Nobody wants them to keep running the gov for themselves. https://t.co/PhyLkxE4dn',SenWarren,2140,701
798642947168358400,2016-11-15 21:44:51,"b'Keeping these lobbyists &amp; insiders on your team sends a clear message, @realDonaldTrump: your campaign was a giant con.'",SenWarren,8367,3825
798642600240680960,2016-11-15 21:43:28,"b'You already broke your promise, @realDonaldTrump. You stacked your transition team with Wall Street elites, insiders &amp; lobbyists.'",SenWarren,48349,22935
798642279770529793,2016-11-15 21:42:12,"b'.@realDonaldTrump, you promised the American people you\xe2\x80\x99d #draintheswamp of lobbyists &amp; insiders rigging the system for the rich &amp; powerful.'",SenWarren,4135,1485
798315544348860417,2016-11-15 00:03:52,"b""The President of the United States should condemn bigots, @realDonaldTrump. Not give them a West Wing office to decide our country's future.""",SenWarren,50852,23721
798315274776629248,2016-11-15 00:02:48,"b""Steve Bannon promoted white nationalism, @realDonaldTrump. He's been praised by KKK supporters &amp; denounced by @splcenter &amp; @ADL_National .""",SenWarren,9920,5758
798314999794069504,2016-11-15 00:01:42,"b'Tell us, @realDonaldTrump: You said you\'d be a ""President for all."" Then why are you embracing the ugliness &amp; divisiveness of your campaign?'",SenWarren,15024,5958
798226627826249728,2016-11-14 18:10:33,"b""Let me be clear: It's foolish for any Dem to think that weakening support for the @CFPB is good for the country or good for us as a party.""",SenWarren,3504,1166
798226261843779584,2016-11-14 18:09:05,"b'Anyone in Congress \xe2\x80\x93 GOP or Dem \xe2\x80\x93 who votes to weaken the @CFPB will declare loud &amp; clear they represent giant banks, not working families.'",SenWarren,4100,1915
798225901599109120,2016-11-14 18:07:39,b'The @CFPB has returned over $11 BILLION to consumers who have been cheated by big banks &amp; financial institutions.',SenWarren,2104,918
798225603929378816,2016-11-14 18:06:28,"b'If I were Wall Street &amp; the GOP, I\xe2\x80\x99d be scared too: The @CFPB goes after big banks like @WellsFargo when they break the law.'",SenWarren,1573,601
798225299129307136,2016-11-14 18:05:16,b'The real reason Wall St &amp; their @GOP allies are going after the @CFPB is because it\xe2\x80\x99s working too darn well for consumers &amp; must be stopped.',SenWarren,2488,1124
798225052906889217,2016-11-14 18:04:17,b'You\xe2\x80\x99re going to hear a lot of reasons why we must make these changes to the @CFPB. Not one of them is going to be true.',SenWarren,1515,617
798224848732520448,2016-11-14 18:03:28,b'It\xe2\x80\x99s only been a few days since the election &amp; Wall St banks &amp; their @GOP friends are already licking their chops to undercut the @CFPB.',SenWarren,1704,824
789533806831235072,2016-10-21 18:28:23,b'And @FCC should ban unreasonable pay-for-privacy schemes that coerce consumers to give up #privacy for discounts. https://t.co/CG8MNN9LcJ',SenWarren,1421,603
789533289652621312,2016-10-21 18:26:19,b'The @FCC can do something about #broadband #privacy \xe2\x80\x93 &amp; they should @TomWheelerFCC @JRosenworcel @MClyburnFCC @AjitPaiFCC @mikeofcc',SenWarren,827,306
789533075533422592,2016-10-21 18:25:28,"b'Right now we have no #broadband #privacy rules to protect consumers \xe2\x80\x93 no rules on how companies can collect, use, share, &amp; sell our data.'",SenWarren,1935,890
789171076752211969,2016-10-20 18:27:01,b'Great to see the @nytimes agrees it\xe2\x80\x99s time to pass my Accreditation Reform and Enhanced Accountability Act: https://t.co/tqk48zWDlu',SenWarren,1874,544
789117323038879749,2016-10-20 14:53:25,b'Glad to write the intro for @acslaw\xe2\x80\x99s new Big Ideas report on top policy recs for the next administration: https://t.co/0oOlgE16oz',SenWarren,621,113
788492159083216896,2016-10-18 21:29:14,b'Congress should pass the #SAVEBenefits Act in Nov to give a much-needed boost to millions of Americans on Soc Security who have earned it.',SenWarren,2407,828
788491862466322433,2016-10-18 21:28:04,"b"".@RepDuckworth &amp; I introduced the #SAVEBenefits Act to give 70M Americans a one-time 3.9% Social Security payment. There's still time.""",SenWarren,1432,548
788491602218086400,2016-10-18 21:27:02,"b'Today the @SocialSecurity Admin announced a 0.3% COLA for 2017. For many Americans struggling to make ends meet, that offers little relief.'",SenWarren,1520,540
786978936181944320,2016-10-14 17:16:14,b'The SEC needs new leadership to return to its mission to protect investors. @POTUS should use his authority to designate a new chair today',SenWarren,1091,345
786978551136456704,2016-10-14 17:14:42,b'SEC Chair White has refused to advance a rule to require public corporations to disclose political spending despite broad bipartisan support',SenWarren,979,400
786978228976099328,2016-10-14 17:13:25,"b'But under Chair White the SEC routinely ignores needs of investors to cater to interests of big businesses, dragging its feet on key rules'",SenWarren,356,162
786977891242348544,2016-10-14 17:12:05,b'The SEC has a simple purpose: to protect investors by ensuring they have the information they need to make decisions',SenWarren,355,144
786977440077930496,2016-10-14 17:10:17,b'Today I asked @POTUS to immediately designate a new Chair of the SEC to replace Mary Jo White: https://t.co/Jin8kvpbZ5',SenWarren,1516,520
786609896758185985,2016-10-13 16:49:48,"b'I am heartsick for the 2 brave @bostonpolice officers shot in Boston, their families &amp; the entire BPD. Our gratitude &amp; prayers are with you.'",SenWarren,2207,356
786344019567648768,2016-10-12 23:13:18,b'A bank CEO should not be able to oversee a massive fraud &amp; simply walk away to enjoy his millions in retirement.',SenWarren,6889,2710
786343735869120512,2016-10-12 23:12:10,b'A bank teller would face criminal charges &amp; a prison sentence for stealing a handful of 20s from the cash drawer.',SenWarren,3620,1224
786343438216069120,2016-10-12 23:10:59,"b""If @WellsFargo\xe2\x80\x99s John Stumpf is leaving with all of his ill-gotten millions, that's still not real accountability.""",SenWarren,3574,1315
786342912036450304,2016-10-12 23:08:54,"b'As I said: @WellsFargo CEO Stumpf should resign, return every nickel he made during the scam, &amp; face DOJ/SEC investigation. He\xe2\x80\x99s 1 for 3.'",SenWarren,5200,1813
785593802257997824,2016-10-10 21:32:12,"b""I'm proud of MA's cranberry heritage &amp; I'm fighting for our cranberry growers. https://t.co/If2gw8iN7V""",SenWarren,2774,265
785593272806891521,2016-10-10 21:30:06,"b""I've been looking forward to visiting our MA cranberry bogs all year! https://t.co/PrLdF8T3fh""",SenWarren,1036,105
785592973409017856,2016-10-10 21:28:55,b'Today we put on our cranberry waders at Mann Farms of the @OceanSprayInc co-op in Buzzards Bay. https://t.co/OWwRjbosYg',SenWarren,2236,258
783800116859789312,2016-10-05 22:44:44,b'The @CFPB just announced new rules to protect consumers from fraud and hidden fees with prepaid cards. Take a look: https://t.co/Hki6npOBlT',SenWarren,2408,873
781931654969524224,2016-09-30 19:00:08,"b'Watch @RepGutierrez tell this Board to open its doors to actual Puerto Ricans, not just Wall Street. https://t.co/VvYErL4IAX'",SenWarren,675,271
781931342678417408,2016-09-30 18:58:54,"b'If this unelected Board wants Puerto Rico to believe it takes their crisis seriously, they can start by leaving NY. Start by showing up.'",SenWarren,1363,586
781931004726501376,2016-09-30 18:57:33,"b""I guess holding the mtg in Puerto Rico would've been inconvenient. 20,000+ Zika cases. Recent blackouts left 1M w/o power. 340k w/o water.""",SenWarren,808,330
781930734185480192,2016-09-30 18:56:29,"b""Will this Board speak for the ppl of Puerto Rico or the bankers? Today it met for the first time - not in PR, but NYC. That's a bad start.""",SenWarren,1293,671
781930486922969088,2016-09-30 18:55:30,"b'Congress passed a bill in June to ""help"" Puerto Rico - handing authority over PR to an unelected Board, but providing no actual resources.'",SenWarren,791,453
781594685982801920,2016-09-29 20:41:09,"b'Today I joined @SenSherrodBrown, @SenSanders &amp; 9 other @SenateDems to say no to trade deals with #ISDS. https://t.co/aATYWclM2T #TPP'",SenWarren,879,346
781579392451481601,2016-09-29 19:40:22,"b""It\xe2\x80\x99s time for @usedgov's student loan bank to prove they care more about Corinthian\xe2\x80\x99s victims than their own bottom line.""",SenWarren,846,247
781579032525672448,2016-09-29 19:38:57,b'Today I wrote to @usedgov demanding their student loan bank halt collection of Corinthian students\xe2\x80\x99 debt: https://t.co/qk6LpjPfeP',SenWarren,775,273
781578792343105536,2016-09-29 19:37:59,"b'That means Corinthian\xe2\x80\x99s victims eligible for loan forgiveness are instead having tax refunds, EITC &amp; Social Security garnished. It\xe2\x80\x99s absurd.'",SenWarren,743,313
781578531407011840,2016-09-29 19:36:57,"b'We uncovered data that instead of simply discharging the loans of Corinthian\xe2\x80\x99s victims, @usedgov pushed 80k of them to debt collectors.'",SenWarren,696,375
781578288225452032,2016-09-29 19:35:59,"b'Corinthian Colleges went belly up amid findings that it defrauded students. Under fed law, those students are eligible for loan discharge.'",SenWarren,1107,447
781533326339432448,2016-09-29 16:37:19,"b'That\xe2\x80\x99s the @GOP agenda in a nutshell: Pay Congress to do nothing, &amp; block back-breaking Americans from getting paid for a hard day\xe2\x80\x99s work.'",SenWarren,2358,1086
781533081207447552,2016-09-29 16:36:21,b'Last night @HouseGOP voted to delay our new overtime rule by 6 months. Kill a simple rule that hard-working people deserve to get paid.',SenWarren,1790,1016
781532818140635137,2016-09-29 16:35:18,b'.@SpeakerRyan\xe2\x80\x99s Congress is on track to work the fewest days in decades. But what did they do last night before leaving town until November?',SenWarren,1406,650
781222599112163329,2016-09-28 20:02:36,b'RT @VotingInMass: The voter registration deadline is 3 weeks away. Make sure your voter information is up to date:\nhttps://t.co/g1xroLhd7B\xe2\x80\xa6',SenWarren,0,356
781213868815183872,2016-09-28 19:27:55,b'Deepest sympathies for the family of Shimon Peres on the passing of a dedicated public servant with an enduring commitment to peace.',SenWarren,1462,204
781134339400609792,2016-09-28 14:11:53,"b'As I said last week: Mr. Stumpf should resign, return every nickel he made while this scam was ongoing, &amp; face SEC &amp; DOJ investigations.'",SenWarren,4141,1211
781133999993262081,2016-09-28 14:10:33,b'.@WellsFargo CEO Stumpf will be just fine: he keeps his job &amp; most of the money he made while massive fraud went on under his nose.',SenWarren,1607,664
781133686053871620,2016-09-28 14:09:18,b'.@WellsFargo employees who tried to sound the alarm about the creation of fake accounts were fired. Their lives turned upside down.',SenWarren,1729,790
